text	label
i would like to reserve a table for 2 at sam's steakhouse under the name jessie at 6:30 pm	restaurant_reservation
could you please reserve a table for 6 at lucille's under the name tom at 5pm	restaurant_reservation
i'd like to make a reservation at rooth chris, can you do that	restaurant_reservation
would you please make a reservation for 2 at olive garden for 5 pm today	restaurant_reservation
i need you to reserve a table for 6:00 pm for three at devon's seafood	restaurant_reservation
can you make a reservation at the restaurant for tonight	restaurant_reservation
can i have a table held at the outback steakhouse for johnson at 5	restaurant_reservation
can i make a reservation for 2 at state bird for 6:30, please	restaurant_reservation
can you set me up for a reservation for five at outback steakhouse on february 28th at seven pm	restaurant_reservation
what reservations are available for 3 people at the xenophobe	restaurant_reservation
please book a reservation for 8 pm at red robin under the name kevin	restaurant_reservation
are there 8pm tables available at texas roadhouse	restaurant_reservation
i gotta make a reservation for 8 pm at red robin for 3	restaurant_reservation
make a reservation for three at prime rib at 6:30 pm	restaurant_reservation
book room for me and her under the name kendra	restaurant_reservation
please make me a reservation for monty's at noon for 55555	restaurant_reservation
book a reservation for 3 at red lobster under the name steve	restaurant_reservation
can you get me a table for 8 at johnnys	restaurant_reservation
allow me to turn on the lights	restaurant_reservation
can you get a table for 5 at joe's at 5pm	restaurant_reservation
make a reservation for wheeler party of 3 for 5pm at andrea's steakhouse	restaurant_reservation
is it possible to book a room at the taco bell for reavers at 3	restaurant_reservation
can you get me a table for 3 at captain d's at 2pm	restaurant_reservation
i want you to book a reservation for 8 pm at red robin under the name kevin	restaurant_reservation
a table for two needs to be reserved for 7:00pm at olive garden using the name michael	restaurant_reservation
can you get me a table for 4 at red lobster at 8pm	restaurant_reservation
reserve a table for 3 at andrea's steakhouse around 5pm under the name wheeler	restaurant_reservation
can you book a table at the restaurant for me and my husband	restaurant_reservation
can you make a reservation for me at the restaurant	restaurant_reservation
martins needs a table for 5 people at tropicana at 8pm precisely	restaurant_reservation
reserve a table for 6 at morton's under the name jaime at 8:30pm	restaurant_reservation
reserve a table for 4 at red lobster under the name dave at 7:30pm	restaurant_reservation
could you reserve table for 3 at carlos jr under the name adam at 4	restaurant_reservation
can you get me a table for two for 8:00 pm at parc	restaurant_reservation
can you get me a table for 5 at johnnys	restaurant_reservation
i need to book a reservation for 3 at xenophobe under the name zebee	restaurant_reservation
please make a reservation at ruth's steaks for a party of five at 7:00 pm under jack arnold	restaurant_reservation
help me reserve a table for 3 at lucky's under the name crystal at 8 pm	restaurant_reservation
i want to eat at seven in the restaurant for two people	restaurant_reservation
would you please schedule a reservation for 2 at lucky's under the name sam at 7:30pm	restaurant_reservation
please make a reservation for me: party of two, february 22nd at chili's, two in the afternoon	restaurant_reservation
can you reserve a table for 6 at red robin under the name mavrick at 5 clock	restaurant_reservation
can i make a reservation for 2 at state bird for 7:30, please	restaurant_reservation
make a reservation for 2 at red lobster at 8pm	restaurant_reservation
make me a reservation for 5 at coral for 10 pm immediately	restaurant_reservation
i'd like a reservation for 2 at olive garden for 5 pm today	restaurant_reservation
please reserve a table for two at olive garden at 7:00pm for michael	restaurant_reservation
i'd like to set up a reservation for kibble at 4	restaurant_reservation
book a reservation for 4 at outback steakhouse under the name dave	restaurant_reservation
hey computer, make a reservation for 2 for my parents at red lobster on wednseday next, 2:00pm if possible	restaurant_reservation
please make a reservation for 2 at olive garden for 5 pm today	restaurant_reservation
reserve a table for 3 at 7 for olive garden	restaurant_reservation
book a reservation for 8 pm at red robin under the name kevin	restaurant_reservation
reserve a table for 5 at lawry's under the name steve at 8:00pm	restaurant_reservation
make a reservation for 2 tonight at 7:00 at outback steakhouse	restaurant_reservation
at 7, i need a table for 3 at olive garden	restaurant_reservation
i think there has been a fraud on my black visa card, can i report it	report_fraud
there's been some fraudulent activity on my card	report_fraud
i want to report fraudulent activity on my visa	report_fraud
i think there's a fraudulent transaction on my account	report_fraud
i want to report fraudulent activity on my navy federal card	report_fraud
help me tell visa about fraud on my account	report_fraud
it looks like someone made an unauthorized amazon purchase on my account	report_fraud
help! i'm a victim of credit card fraud!	report_fraud
i think i made a fraudulent transaction	report_fraud
there has been fraudulent activity on my card and i need to report it	report_fraud
i don't remember buying this	report_fraud
i may have a fraudulent transaction	report_fraud
i think i've been the victim of fraud	report_fraud
i have a false charge on my account from mcdonald's	report_fraud
help me figure out where this fraudulent transaction from google came from on my account	report_fraud
i'm afraid there is a false transaction on my account	report_fraud
i believe there are fraudulent charges on my card how can i report them	report_fraud
there are some questionable charges on my card	report_fraud
where do i report fraud on my credit card	report_fraud
i have some charges on my account from old navy that aren't mine	report_fraud
i gotta report fraudulent activity on my credit card	report_fraud
i think i have fraud on my account from walmart	report_fraud
i made a fraudulent transaction	report_fraud
i have transactions on my card that aren't mine	report_fraud
i seem to have a purchase that i didn't make from olive garden on my account	report_fraud
there is a fraudulent charge for paypal on my bank account	report_fraud
i think my chase account has been compromised and fraud committed	report_fraud
i believe there's fraud on my card	report_fraud
i need to report fraudulent activity on my usaa card	report_fraud
someone misused my card and put fraudulent transactions on it	report_fraud
"""""""i need to report fraudulent activity to my card company"""	report_fraud
i'm reporting fraudelent activity on my card	report_fraud
an unauthorized transactions has been made on my gap card and i need to report it	report_fraud
can you report credit card fraud for me	report_fraud
i see a purchase on my chase checking that i did not make	report_fraud
my online bill has some items that i didn't purchase from penneys	report_fraud
report fraudulent activity on my debit card	report_fraud
who do i contact to report fraud on my visa	report_fraud
my card has purchases i don't recognize	report_fraud
i want to report fraudulent activity on my visa card, please	report_fraud
this charge is bs	report_fraud
there is an unauthorized transaction on my bank of america checking	report_fraud
i want to report fraud on my american express	report_fraud
i need to report a fraudulent transaction from postmates on my account	report_fraud
send information about suspicious credit card activity	report_fraud
looks like someone made an unauthorized charge to nike on my account	report_fraud
i want to report fraudulent activity on my amex card	report_fraud
i need to talk to someone about a transaction that was not made by me on my chase account	report_fraud
report fraud on my card	report_fraud
i have a fraudulent transaction from red robin on my account	report_fraud
there's fraudulent transaction going on	report_fraud
i think a thief used my card	report_fraud
i have activity on my bank of america card i don't recognize	report_fraud
i must report fraudulent activity on my debit	report_fraud
i have detected fraudulent activity on my account	report_fraud
i have a fraudulent transaction from wal mart on my account right now	report_fraud
i have a bogus transaction from amazon on my account	report_fraud
looks like my card is being used by someone else, report it	report_fraud
i need to report unauthorized activity on my card	report_fraud
i think someone made an illegal charge to my card	report_fraud
i want to report fraudulent activity on my card	report_fraud
i need to report fraudulent activity on my mastercard	report_fraud
is there anyway, i can report a suspicious activity on my citi card	report_fraud
"""""""please contact my credit card company to report fraudulent activity on"""	report_fraud
i suspect some suspicious activity	report_fraud
i have a fraudulent transaction from fry's on my account	report_fraud
send fraudulent activity information	report_fraud
i think the charge for uber on my account is fraudulent	report_fraud
i want to report fraudulent activity on my visa card	report_fraud
i see a suspicious transaction in my account history	report_fraud
i want to report fraudulent activity on my quicksilver card	report_fraud
i'm afraid this charge on my account is fraud	report_fraud
i'd like to report a fraudulent charge from people's natural gas	report_fraud
i think there's fraud on my account	report_fraud
i think there's a fraudulent charge from mcdonald's on my account	report_fraud
my account has a fraudulent transaction i think	report_fraud
i need to report fraudulent activity on my visa card, please	report_fraud
how do i report fraud on my chase bank card	report_fraud
i have to report fraudulent activity the bank of america card	report_fraud
i would like to report a fraud on my wells fargo card, please	report_fraud
please report information about activity on my credit card	report_fraud
how do i tell mastercard about a fraudulent charge	report_fraud
contact the bank about fraud activity on my card	report_fraud
i need to report some fraudulent card activity	report_fraud
what steps do i take if there is a transaction that i do not recognize on my navy federal credit union account	report_fraud
there's a messed up transaction on my account from mcdonald's	report_fraud
so i made a fraudulent transaction	report_fraud
i want to report fraudulent activity on my mastercard	report_fraud
do i have a fraudulent transaction on my account	report_fraud
it seems that there's fraudulent activity on my card i'd like to file a report	report_fraud
due to fraudulent activity on my card i need to make a report	report_fraud
i think this transaction is bogus	report_fraud
i need to talk to someone about a fraudulent activity on my card	report_fraud
i saw a fraudulent transaction	report_fraud
there's a false charge on my account from mcdonald's	report_fraud
i'm thinking someone may have used my card in a fraudulent way	report_fraud
there has been unauthorized use of my visa	report_fraud
how do i report fraud on my discover card	report_fraud
how do i let visa know about a charge i didn't make	report_fraud
i have a crap transaction from guitar center on my account	report_fraud
i have a fraudulent transaction from wal mart on my account	report_fraud
i think someone jacked my bank account	report_fraud
it seems someone conducted a fraudulent transaction on my account	report_fraud
i need to report fraudulent activity on my card	report_fraud
my account shows a transaction that i didn't make from foot locker	report_fraud
i want to report fraudulent activity on my capital one	report_fraud
someone else used my account to buy stuff from mcdonald's	report_fraud
can you assist me on my fradulent activity on my chase card	report_fraud
i suspect fraudulent transaction	report_fraud
my bill shows a purchase from payless shoes but i didn't buy anything	report_fraud
i have a fraudulent transaction from wal mart showing on my account	report_fraud
please file a fraud report	report_fraud
there's something fishy on my card, report it	report_fraud
i see a fraudulent transaction from netflix on my account	report_fraud
i want to report fraudulent activity on my amex card, please	report_fraud
i need to know how to report fraud on my discover card	report_fraud
discover card reporting fraud	report_fraud
i need to make a report due to fraudulent activity on my card	report_fraud
someone is charging my card for playstations, and it's not me! what do i do!	report_fraud
i've got a fraudulent purchase from kayak on my account	report_fraud
i need a replacement phone charger ordered online	order
i need to buy everything on the shopping list	order
i would like everything on my shopping list ordered	order
i need more cat food, please order some	order
add everything to my shopping cart	order
i'm out of cat food, order more	order
i've used the last can of tuna fish and need you to order a new case of it	order
everything needs ordered off my list	order
will you order me some more lysol spray	order
can you buy something from walmartcom for me	order
find inner tube and buy it for me	order
place my order alexa	order
i'm out of conditioner so will you order me some more	order
can you order me new ray bans	order
i want all the things on the shopping list	order
can you please order me more plastic bags	order
please order me a 7lb bag of world's best cat litter from targetcom	order
please order some more cat food, i'm out	order
will you buy me underpants	order
i'm out of detergent so will you order me some more	order
purchase me dog food	order
put in the order for everything on my shopping list	order
i'd like to buy something	order
order more paper towels from amazon	order
can you buy me a toy car	order
i'd like to you order everything that's on my shopping list	order
take my shopping list and order all	order
could you get everything on my shopping list	order
submit the order for everything on my shopping list	order
would you buy me a phone	order
i'm low on mouthwash so create an order for me	order
i want you to order everything on my shopping list	order
i want to buy something	order
order me a new usb cable on amazon	order
order me some doritos, please	order
submit order for everything	order
i'm out of shampoo so will you order me some more	order
i want everything on my shopping list ordered	order
please order some more pepsi	order
for the shopping list, order everything	order
i need more candy so could you order me a pack	order
can you buy something	order
i'm out of soap so will you order me some more	order
i'm out of paper plates so will you order me some more	order
i'd like to buy a lamp online	order
where can i find bluetooth speakers	order
i'm lacking vitamins so order me more	order
i want you to buy me a shirt	order
i need everything on my shopping list	order
i am currently out of q tips and need more ordered right away	order
i need you to order all the things on my shopping list	order
i'd like to buy some cooking pans	order
buy everything on my list	order
i want everything on my shopping list	order
can you purchase underpants for me	order
can you order more printer paper	order
please get everything on my shopping list	order
aquire me them kyrie 4s	order
are you able to purchase underpants for me	order
get my entire shopping list ordered	order
make an order of bread because i am out	order
i would like you to buy me some paper plates	order
i want everything on my shopping list to be ordered	order
purchase a computer for me	order
i need some more lysol, could you order me some	order
order more cat food, i'm out	order
purchase grass seed from the store	order
please order me everything that is on my shopping list	order
i do not have flour so will you order me some more	order
i'm out of lysol could you order me some	order
i need to buy something, please	order
i'm ready to put in the order for everything on my shopping list	order
i need everything on my shopping list to be ordered	order
order my whole shopping list	order
would you order everything on my shopping list	order
please buy me something	order
i'd like to have everything on the shopping list	order
alexa, buy a new television	order
can you go to amazon a repurchase my last purchase	order
could you please reorder me some lysol	order
i wanna buy a pair of shoes online now	order
please order everything you see on my shopping list	order
i'm out of toothpaste so will you order me some more	order
i need everything ordered on my shopping list	order
i'm out of milk so you will order me some more	order
get everything on my shopping list	order
what is the price of bluetooth speakers on amazon	order
can you order an iphone7 for me with two-day free delivery	order
can you order some more eggs for me since i just ran out	order
i'd like you to purchase me canned soup	order
order more bread please	order
i've just run out of butter and need you to order me some more	order
please buy me flowers	order
help me buy a black iphone7	order
i want to buy an iphone7	order
i just used up my toothpaste and need you to order more	order
can you order me some nacho chips	order
purchase all the things on my shopping list	order
i want my entire shopping list ordered	order
are you able to get my shopping list and order everything on it	order
place an order for bread	order
can you place an order for the olive oil i just finished	order
order some cat for me, i ran out	order
please order an iphone7 for me	order
order all items on the list	order
i require another filter so can you order me another one	order
i don't have ice cream so will you order me some more	order
i would like all of these things on my shopping list ordered	order
alexa, buy my grocery list	order
i'd like to have everything on my shopping list	order
can you order more chapstick i am all out	order
i'm out of fabric softener so will you order me some more	order
i'm making a purchase and need the help of ai	order
order an amazon gift card from amazon in the amount of twenty dollars	order
order a case of coke from amazon	order
can you have some new oakley's shipped to me	order
i am needing you to buy me some shoes	order
will you please go on amazon so i can buy speakers	order
siri, place my amazon order	order
i want to make a purchase	order
how do i redeem my visa points	redeem_rewards
how can i cash in my credit card points	redeem_rewards
how can i cash in rewards on my discover card	redeem_rewards
my amex rewards; how do i get them	redeem_rewards
how do i use my credit card points	redeem_rewards
i want to use the cash that my points have earned on my credit card	redeem_rewards
how can i cash in my visa rewards	redeem_rewards
how do i redeem my card points	redeem_rewards
where do i redeem my credit card points	redeem_rewards
do i have to contact someone to use my credit card points	redeem_rewards
how can i cash in the rewards i earned with my visa card	redeem_rewards
at what point balance can i redeem my points	redeem_rewards
walk me through the best ways to use my credit card points	redeem_rewards
can i redeem my credit card on safeway	redeem_rewards
i want to use my credit card points	redeem_rewards
how do i utilize my credit card points	redeem_rewards
let me use my credit card points	redeem_rewards
how do i use reward for my first hawaiian bank	redeem_rewards
how can i cash in the rewards i have earned on my amex	redeem_rewards
i want to hear more about how i can use my credit card points	redeem_rewards
walk me through the process of cashing in on credit card points	redeem_rewards
i want to convert my credit card points	redeem_rewards
i want to know if i can redeem my credit card points now	redeem_rewards
can you explain to me how i ought to use my credit card points	redeem_rewards
how do i get cash back for the rewards on my amex card	redeem_rewards
how do i obtain the cash for the rewards on my hy-vee card	redeem_rewards
i have credit card points, how do i redeem them	redeem_rewards
i am ready now to cash in on the many credit card points i have saved up	redeem_rewards
i want to redeem points on my chase card, but how	redeem_rewards
can i redeem my points for flights	redeem_rewards
help with credit card points	redeem_rewards
can i use my credit card point on amazon	redeem_rewards
i want to cash my credit card points	redeem_rewards
how can i go about cashing in rewards with discover	redeem_rewards
i have a lot of points saved up from my credit card rewards but don't know how to redeem them	redeem_rewards
what do i do to redeem credit card points	redeem_rewards
i would like to redeem my credit card reward points	redeem_rewards
do i need a certain amount of points before i can redeem them	redeem_rewards
i have credit card points but don't know how to use them	redeem_rewards
i want to cash out my credit card points	redeem_rewards
redeem credit card points	redeem_rewards
how do i cash in credit card points	redeem_rewards
i would love to redeem some smart speakers with my credit card points	redeem_rewards
how do i cash the reward for city	redeem_rewards
i need to use my credit points	redeem_rewards
explain to me how to cash in rewards for my mastercard	redeem_rewards
if i want to cash in my american express rewards, how do i do that	redeem_rewards
what do i do to get cach back for points on my discover card	redeem_rewards
what do i need to do in order to redeem my credit card points	redeem_rewards
what's the procedure to get cash back rewards on my visa	redeem_rewards
how do i go about getting cash for my card points accumulated	redeem_rewards
how do i get my rewards from my visa card	redeem_rewards
i need to redeem my visa points	redeem_rewards
i'd like to redeem my credit card points	redeem_rewards
what are ways to utilize my credit card points	redeem_rewards
can you help me begin the process of redeeming credit card points	redeem_rewards
tell me how to use credit card points	redeem_rewards
can i use my points to pay my credit card	redeem_rewards
call my credit card company and ask can i use my points	redeem_rewards
where can i cash out my card points	redeem_rewards
how do i cash in my reward for chase	redeem_rewards
i would like to use my credit card points to acquire a new laptop	redeem_rewards
how many points do i have to cash	redeem_rewards
if i redeem my credit card points, can i get a kroeger gift card	redeem_rewards
what can i buy with credit card points	redeem_rewards
have i got enough credit card points to get a new tablet device	redeem_rewards
redeem my credit card rewards into my account	redeem_rewards
how many points do i need before i can redeem them	redeem_rewards
can i use my credit card points to make purchase	redeem_rewards
do you think i could get a target gift card with my credit card points	redeem_rewards
how do i redeem my credit card points	redeem_rewards
help me redeem my reward points	redeem_rewards
i want to use my credit rewards now	redeem_rewards
what are my mastercard points good for	redeem_rewards
where i can use credit card points	redeem_rewards
do i have enough credit card points to redeem a new appliance	redeem_rewards
can i redeem my credit card points to cash	redeem_rewards
how to cash in visa card rewards	redeem_rewards
let's use my credit card points	redeem_rewards
what do i have to do to use my credit points acquired through purchases	redeem_rewards
how can i redeem rewards earned through my amex card	redeem_rewards
i am ready now to use some of the credit card points i have saved	redeem_rewards
can i redeem my credit card points for anything	redeem_rewards
please tell me the procedure to cash in my rewards for my citibank card	redeem_rewards
could i redeem my credit card points on a new tv	redeem_rewards
is a walmart gift card one of the things i can use my credit card points on	redeem_rewards
can i convert my credit card points to milage	redeem_rewards
i want to use my card reward points	redeem_rewards
i need you to check if my credit card points are redeemable right now	redeem_rewards
help me figure out redemption of my credit card points	redeem_rewards
what do i do if i want to use my credit card points	redeem_rewards
whats the policy to redeem my visa reward points	redeem_rewards
can you check with my credit card company and see if i can redeem my points	redeem_rewards
what steps do i take to redeem my credit card points	redeem_rewards
i want to utilize my credit card points	redeem_rewards
cash in my credit card points	redeem_rewards
use my credit card points	redeem_rewards
can i use my credit card points for gas	redeem_rewards
how do you get your visa card rewards	redeem_rewards
if i want to redeem miles from my delta skymiles card, how do i do that	redeem_rewards
can you tell me how to redeem my credit card points	redeem_rewards
how do i cash the reward for first bankcard	redeem_rewards
where would i get my rewards for my master card	redeem_rewards
i want to shop using credit card points	redeem_rewards
please redeem my credit card points	redeem_rewards
how can i claim my rewards for my visa card	redeem_rewards
cash in rewards for my visa card	redeem_rewards
how to use credit card points	redeem_rewards
how can i get my rewards for my master card	redeem_rewards
