text	label
i cant recall my pin number for my city first account	pin_change
how do i change my pin number for my account, please	pin_change
change the pin on my redwood credit union account to be 1234	pin_change
can you change my 1st national account pin to 4892	pin_change
i forgot my pin number to my chase account	pin_change
how do i reset my pin number for my account, please	pin_change
i need my pin number	pin_change
tell me how to retrieve my pin number	pin_change
help me remember my pin number	pin_change
i'm afraid i've forgotten the pin for my 401k account	pin_change
i don't want my current pin for my wells account anymore	pin_change
how do i change my pin number for my payroll account	pin_change
help me get my pin on my capitol one account changed to 3892	pin_change
i need to update the pin number of my aaa visa	pin_change
i want a new pin for my savings account	pin_change
i want to change my pin number for my checking account	pin_change
tell me how to change my pin number	pin_change
how do i update my pin number for my account, please	pin_change
make 1234 the pin on my savings account	pin_change
i need to change my pin number for my account	pin_change
tell me the pin number for my checking account	pin_change
i would like to change the name on my first bankcard account	pin_change
help me out with changing this pin number	pin_change
i cannot remember what my pin is for my bank of america checking account	pin_change
i would like to change the pin on my savings account, please	pin_change
so it turns out i can't remember what my pin is for my bank of america checking account	pin_change
please give me the pin number for my checking account	pin_change
please make the pin on my zion bank account to 3232	pin_change
i really need to change my pin number for my account	pin_change
is there a way to change my pin number for my savings account	pin_change
i'm struggling to remind myself the pin number to my card	pin_change
i forgot my pin number for my credit union bank account, can you help	pin_change
i need my pin number for my bank of america account and i can't remember it	pin_change
i would like to change the pin on my savings account	pin_change
what's my pin for my fidelity account	pin_change
i'd like to change my pin number for my wells fargo account	pin_change
so tell me the pin number	pin_change
i got to change my pin number for my account	pin_change
how can i switch the pin on my wells fargo account to 9982	pin_change
change my pin number for my checking account	pin_change
change the pin on my bank of america account to be 1234	pin_change
i'd like to change my pin number for my checking account	pin_change
i want to change my bank of america account pin number	pin_change
tell me how i can get a new pin number	pin_change
i need the pin number for my checking account	pin_change
what mpg does this car get on the highway	mpg
how expensive is it to fuel this car	mpg
tell me the gas mileage on my car	mpg
what is the gas mileage on a 2012 ford fusion	mpg
how much gas does this use in the city	mpg
tell me my car's fuel economy	mpg
i need to know this car's mpg	mpg
how much mpg does this car get on the highway	mpg
tell me my miles per gallon on my car	mpg
how many miles will i get for one gallon on this car	mpg
what is the highway mpg on this car	mpg
whats the cars mpg	mpg
how is the car's fuel economy	mpg
how much is this mpg	mpg
how much mpg does this car get in the city	mpg
what's my car's miles per gallon	mpg
whats the mpg of this car	mpg
what's the mpg of my car	mpg
how many miles per gallon does my amc rambler get	mpg
what are the estimates for the car's highway mpg	mpg
what kind of gas mileage does this car get when going through a city	mpg
tell me what this cars highway mpg is	mpg
i would like to know the mpg of my car	mpg
what's my car's mpg, please	mpg
what is my car's mpg	mpg
what is the gas mileage for the car that i drive	mpg
what is the cars mpg on the highway	mpg
what is the city mpg on this car	mpg
what the mpg	mpg
how much gas does this car use in the city	mpg
what is the mpg of this car	mpg
how's my gas mileage while driving through a city	mpg
what is the gas mileage of my car	mpg
tell me: car gas mileage	mpg
average mpg	mpg
what'll this car do for gas mileage on the open road	mpg
whats the cars fuel mileage like	mpg
how many miles does my car get per gallon	mpg
do you know the mpg for this vehicle	mpg
what's my car's mpg	mpg
tell me what the gas mileage is on my car	mpg
what's the non-city mpg for this car	mpg
what's this car do for fuel economy	mpg
can i have more information about this car's highway mpg	mpg
how many miles does this car get per gallon	mpg
what's my gas mileage like	mpg
how many miles per gallon am i getting	mpg
mpg of this car	mpg
what is the mpg like for this car while driving in the city	mpg
how does this car do on its fuel	mpg
what's the mileage on my car	mpg
in my car, what's the fuel economy	mpg
what's the fuel economy for this car downtown	mpg
how does this cars mpg do on the highway	mpg
what is the gas mileage on a ford falcon	mpg
how much mpg do i have	mpg
what mpg does this car get on the expressway	mpg
whats the fuel economy of this car	mpg
what is the mpg	mpg
how many mpg does my car get	mpg
how far can i go on one tank of gas	mpg
is the fuel economy of this car good or bad	mpg
how many miles per gallon do i get in my car	mpg
what is my car's gas mileage	mpg
look up the gas mileage for my vehicle	mpg
how good is the fuel usage for this vehicle	mpg
what is the city fuel efficiency for this car	mpg
how much highway mpg does it get	mpg
can you tell me the miles per gallon rate of my car	mpg
how's the fuel efficiency for city driving for this car	mpg
whats my gas mileage	mpg
can you tell me my vehicles mpg	mpg
how many miles per gallon does this car get in the city	mpg
what kind of mileage do i get out of gas	mpg
tell me about this cars fuel economy	mpg
tell me the mpg of this car	mpg
what's my car's gas mileage	mpg
what's the miles per gallon on this car	mpg
how many miles per gallon does it get on the highway	mpg
what is the mpg for this car	mpg
tell me the mpg of my vehicle	mpg
whats the mpg for this car	mpg
what is the city mpg for this car	mpg
what is my average mpg in this car	mpg
what's my current mpg	mpg
how much is my mpg	mpg
get me info on my mpg	mpg
how does this car do with mpg in the city	mpg
what is my car's mpg, please	mpg
how many mpg does an equinox get	mpg
mpg for this car please	mpg
calculate car mpg	mpg
how does this do on gas mileage	mpg
tell me about this car's highway mpg	mpg
how many mpg does this car get in the city	mpg
hows the city mpg of this car	mpg
how many mpg does this car have	mpg
what is the amount of miles per gallon this car gets on the highway	mpg
can you give me the car's mpg for the city	mpg
how many miles per gallon does it get in the city	mpg
what is the highway mpg of this car	mpg
what's this car guzzle in gas when driving in town	mpg
what mpg does this car get in the city	mpg
what is the miles per gallon	mpg
how many miles will a gallon of gas take this car	mpg
how many miles per gallon does this car get on the highway	mpg
can i get this car's mpg	mpg
what's this car get for highway driving	mpg
does this car get good mpg in the city	mpg
how many miles can i drive on 1 gallon of gas	mpg
what mpg does this car get in city	mpg
what's the fuel economy of my car	mpg
what kind of mileage am i getting	mpg
what's the mpg rating on my car	mpg
how far can the car get per gallon on the highway	mpg
what kind of mileage does this car get	mpg
how is this car rated for fuel economy	mpg
what kind of mpg does this car get in the city	mpg
do you know what this car's mpg is	mpg
what is the mpg for this car in city	mpg
what meetings do i have today from 3 to 4	meeting_schedule
which meetings do i have today	meeting_schedule
when is my meeting with infrastructure	meeting_schedule
are there any meetings on my calendar today	meeting_schedule
is the meeting with lisa today	meeting_schedule
when is my meeting with ann	meeting_schedule
when is that meeting with kara	meeting_schedule
what are my meetings today	meeting_schedule
do i have any meetings with mark today	meeting_schedule
tell me when today's meeting is supposed to happen	meeting_schedule
how many meetings do i have scheduled between 10 and 3	meeting_schedule
do i have any meetings on my schedule today	meeting_schedule
when is my meeting with roger	meeting_schedule
when am i gonna be meeting roger	meeting_schedule
do i have any meetings planned for today	meeting_schedule
tell me when my meeting is scheduled with roger	meeting_schedule
what is my schedule like today, any meetings with dan	meeting_schedule
tell me the meeting schdule please	meeting_schedule
what is on my schedule between 10:00 am and 11:00 am	meeting_schedule
do i have any meetings coming up today	meeting_schedule
share my meeting schedule with me	meeting_schedule
do i have meetings from 1 to 4 today	meeting_schedule
go over my meeting schedule with me please	meeting_schedule
read me my meeting schedule	meeting_schedule
do i have any meetings with michael today	meeting_schedule
what meetings are scheduled for today	meeting_schedule
what time is my meeting with steve	meeting_schedule
i need to know if i have meetings from 3 to 6 pm	meeting_schedule
i wanna know when my meeting is with dan	meeting_schedule
do i have any meetings today between 9 and 10:30	meeting_schedule
do i have to meet the dev squad to day	meeting_schedule
what's on my meeting schedule today	meeting_schedule
have i got any meetings today with sara	meeting_schedule
what if any meetings do i have today	meeting_schedule
for today only, how many meetings are with jake	meeting_schedule
do i have any meetings today between 9 and 10:15	meeting_schedule
are any meetings scheduled for today	meeting_schedule
are there any meetings for today on my calendar	meeting_schedule
do i have any meetings with stan today	meeting_schedule
do i have any meetings between 1 and 8 pm	meeting_schedule
can you tell me what time i am meeting with sarah today	meeting_schedule
do i have meetings scheduled today	meeting_schedule
when for i meet jane for our meeting	meeting_schedule
is my schedule clear with no meetings with dan today	meeting_schedule
what time i have to meet mr accountant	meeting_schedule
do i have any meetings today between 9:20 and 10:30	meeting_schedule
what meetings are on my calendar	meeting_schedule
what time is my meeting with fred scheduled for	meeting_schedule
do i have any meetings scheduled today	meeting_schedule
i need to know if i have any meetings scheduled for today	meeting_schedule
what time is today's meeting	meeting_schedule
what time am i meeting with john	meeting_schedule
is there any meetings from 5 to 6 pm	meeting_schedule
when do i have meetings today	meeting_schedule
do i have any meetings today between 9 and 10	meeting_schedule
did i schedule any meetings for today	meeting_schedule
is the gang getting together this afternoon	meeting_schedule
is mr ceo waiting me now	meeting_schedule
what scheduled meetings do i have today	meeting_schedule
check today's calendar for meetings	meeting_schedule
what meetings do i have today	meeting_schedule
check the start time of the meeting scheduled for today	meeting_schedule
what meetings are on my schedule today	meeting_schedule
when are my meetings today between noon and one	meeting_schedule
when is my meeting with dan scheduled for	meeting_schedule
when is my meeting with john	meeting_schedule
i think dan scheduled a meeting today with me, can you double check please	meeting_schedule
are there meetings scheduled for today	meeting_schedule
tell me if i have a meeting with liz today	meeting_schedule
are there any meetings i have today	meeting_schedule
am i scheduled to meet with heather today	meeting_schedule
when is my meeting with bob	meeting_schedule
about how many meetings am i attending between 12 and 3 today	meeting_schedule
give me a run down of my meeting schedules for the day	meeting_schedule
do i have any meetings on my calendar today	meeting_schedule
do i have any meetings today between 8 and 9	meeting_schedule
tell me my scheduled meetings for today only, please	meeting_schedule
what meetings do i have scheduled today	meeting_schedule
what is my meeting schedule like for the day	meeting_schedule
bring up any mettings for today	meeting_schedule
what is my meeting schedule today	meeting_schedule
does today's schedule include any meetings	meeting_schedule
am i scheduled for any gatherings today	meeting_schedule
is it possible i have a meeting with kim today	meeting_schedule
when is my meeting with jim scheduled for	meeting_schedule
are any meetings booked for today	meeting_schedule
what is the meeting schedule today	meeting_schedule
list meetings on calendar for today	meeting_schedule
let me know every meeting i have scheduled today	meeting_schedule
are there meetings schedules today between noon and one	meeting_schedule
do i have any meetings today between 9:30 and 10:30	meeting_schedule
are there any meetings on the calendar for today	meeting_schedule
do i have a meeting with paul today	meeting_schedule
please list my meetings for today from 8:00 am to 2:00 pm	meeting_schedule
what meetings are on my schedule today between 1:00 pm and 4:00 pm	meeting_schedule
do i have any meetings today between 5 and 6	meeting_schedule
do you know if i have any meetings set up with travis today	meeting_schedule
do i have any meetings with ben today	meeting_schedule
when is today's meeting with john	meeting_schedule
tell me what my day looks like today in terms of meetings	meeting_schedule
do i have meetings with anyone today	meeting_schedule
exactly what time is my meeting with robin scheduled for on	meeting_schedule
are there any meetings between 2 and 5 pm	meeting_schedule
do i have any meetings today between 6 and 7	meeting_schedule
check my schedule for meetings today	meeting_schedule
do i have any meetings scheduled between 3 and 5 pm today	meeting_schedule
what do i have going on between 9 and 10	meeting_schedule
let me hear all meetings for today	meeting_schedule
what time am i meeting john	meeting_schedule
check to see if i have any meetings with peter today	meeting_schedule
tell me how many meetings with pete i have for today	meeting_schedule
do i have any meetings scheduled for today	meeting_schedule
do i have to be at any meetings today	meeting_schedule
am i scheduled for any meetings between noon and one	meeting_schedule
do i have any meetings with roger today	meeting_schedule
are there meetings from 1 to 5 pm	meeting_schedule
meetings today	meeting_schedule
give me a summary of today's meetings	meeting_schedule
is there a meeting with sam today	meeting_schedule
for what time is my meeting with marketing scheduled	meeting_schedule
when's the next federally recognized holiday	next_holiday
is the next day off coming up	next_holiday
tell me how long until the next day off	next_holiday
when is the next holiday in this country	next_holiday
what is the next holiday	next_holiday
i need to know when the next holiday is	next_holiday
when don't i have to work next	next_holiday
how many holidays are there and when is the next one here	next_holiday
what is the next holiday on the calendar	next_holiday
are there any holiday's comming up	next_holiday
what is the date of the next holiday	next_holiday
when are we off work next	next_holiday
what's the next day i am scheduled off	next_holiday
i wanna know how long until the next day off	next_holiday
how many more days until my next paid day off	next_holiday
when will we next get to stay home from work	next_holiday
i need to know when's the next holiday	next_holiday
i need to know when i get my next day off	next_holiday
i need to know how long until my next vacation day	next_holiday
tell me when the next holiday arrives	next_holiday
what day is the next holiday	next_holiday
i need to know when the next holiday will be	next_holiday
i wish to know the next holiday	next_holiday
i wanna know the next holiday	next_holiday
when is the next day i have off	next_holiday
what's the date of the next closest holiday	next_holiday
how many days left until the next day out of work	next_holiday
when will we have another day off	next_holiday
when's the next time i get a day off	next_holiday
do you know when my next day off is coming	next_holiday
when is the next scheduled holiday	next_holiday
when is our next free day, please	next_holiday
when will be the next holiday here	next_holiday
how many more days until the next holiday	next_holiday
is our next day off soon	next_holiday
tell me when the next day off will be	next_holiday
when is our next free day	next_holiday
how much time till the next time off	next_holiday
what's the closest holiday after today	next_holiday
what's the time period till our next day off	next_holiday
which holiday do we celebrate next	next_holiday
what day is our next day off	next_holiday
when is the upcoming holiday, please	next_holiday
look up when our next day off will be	next_holiday
when's the next day off coming up	next_holiday
i need to know how long until the next day off	next_holiday
when will my next vacation day be	next_holiday
what holiday comes next	next_holiday
i must know the next holiday	next_holiday
when do i finally get a day off	next_holiday
what day is our next free day, please	next_holiday
when is the next scheduled day off	next_holiday
do we get monday off as a holiday	next_holiday
are there any holidays coming and when	next_holiday
to what extent until the following day away from work	next_holiday
let me know when my next day off is	next_holiday
i'd like to know when my next day off is	next_holiday
when does this place let us have a holiday next	next_holiday
what holiday can i expect next	next_holiday
check when the next day is i can go fishing will be	next_holiday
what's the next scheduled holiday at this job	next_holiday
when is the next day we have off	next_holiday
when's the next day off	next_holiday
when's the next holiday coming	next_holiday
show me my next day off	next_holiday
how long until my next day off	next_holiday
on what day is our next free day	next_holiday
can you tell me what the next holiday is	next_holiday
how much time till the next day off	next_holiday
how much longer till the next day off	next_holiday
which holiday is next in line	next_holiday
what day is our next free day on the calendar, please	next_holiday
what day is our next free day	next_holiday
can you tell me the next holiday	next_holiday
tell me what holiday is comming up next	next_holiday
are there any holidays this month	next_holiday
when does my current job have the next official paid holiday	next_holiday
when will the day off be	next_holiday
when is the upcoming holiday	next_holiday
how long before the next day off is here	next_holiday
i want to know when is the next holiday here	next_holiday
how many days till we have off again	next_holiday
i got to know how long until the next day off	next_holiday
when is the soonest holiday	next_holiday
how many days until my next day off	next_holiday
what's the wait period until the next day off	next_holiday
how soon until the next holiday	next_holiday
when do i get my next day off	next_holiday
when is the next scheduled holiday, please	next_holiday
when is the next time off for a holiday here	next_holiday
when do i get a day off	next_holiday
how long do i have to wait to get a day off	next_holiday
to what extent until the following three day weekend	next_holiday
when is my next vacation day	next_holiday
what's the next holiday	next_holiday
when is the next break	next_holiday
when is the next holiday, please	next_holiday
i would like to know the next holiday	next_holiday
when can i expect my next day off	next_holiday
what holiday is next and when	next_holiday
when will i be off again	next_holiday
when will i get the next holiday with pay	next_holiday
when do we have free day	next_holiday
to what extent until the following free day	next_holiday
what holiday is coming up	next_holiday
how many more weeks until the next holiday	next_holiday
i would like to know when is the next holiday here	next_holiday
when is my next day off	next_holiday
is there a holiday next week	next_holiday
when do i have some time off next	next_holiday
which holiday is next	next_holiday
what holiday is coming up next	next_holiday
i need to know when is the next holiday here	next_holiday
i need to know when my next day off is	next_holiday
find the next holiday	next_holiday
find out for me when the next holiday will be	next_holiday
let me know how long until the next day off	next_holiday
please tell me what the next holiday is	next_holiday
when is the next day off	next_holiday
what holiday's are comming up next	next_holiday
what do you know me as	user_name
what is the name you would use for me	user_name
i need to know the name that you have for me	user_name
do you think my name is jeff	user_name
what do you know me by	user_name
tell me my name the way its saved	user_name
what am i called by you	user_name
what is my name	user_name
what do you think you will refer to me as	user_name
by what name do you refer to me	user_name
my name	user_name
what is the name you have listed for my identity	user_name
do you know who i am	user_name
let me know what do you call me	user_name
what name do you have listed for me	user_name
what is my name saved as in your system	user_name
how do you refer to me	user_name
my name is what	user_name
what did i tell you to call me	user_name
you wrote what for my name	user_name
what would i be referred to as	user_name
is there a name that you call me	user_name
can you tell me what name you have for me	user_name
what's my name saved under	user_name
you have what name for me	user_name
what is the name that you have for me	user_name
what do you want to call me	user_name
do you know my name	user_name
what name do you call me	user_name
what's my name huh	user_name
can you guess my name	user_name
do you know what my name is	user_name
do you have any idea what my name is	user_name
what's my name in your system	user_name
in what format did you save my name	user_name
say my name if you know it	user_name
what might my name be	user_name
do you remember my name	user_name
what's my name on file	user_name
i want you to guess my name	user_name
what name is saved for me	user_name
how is my name saved	user_name
what do you say for my name	user_name
how does my name appear	user_name
what is the name you call me	user_name
can you tell me what you call me	user_name
what are you going to refer to me as	user_name
how do you address me	user_name
how did you save my name	user_name
what's my name	user_name
what do you refer to me as	user_name
what name is mine	user_name
you call me what	user_name
what is my first name saved as	user_name
can you tell me what my name is	user_name
which way do you have my name saved	user_name
could you let me know what names you have for me	user_name
do you know how to refer to me	user_name
what is the name you call me saved as	user_name
tell me my name	user_name
let me know the name you have for me	user_name
is joey my name	user_name
show me what you think my name is	user_name
what is your name for me, please	user_name
what do you have me saved under	user_name
say my name in a sentence	user_name
what name do you have for me	user_name
how is my name saved aw	user_name
what can you call me	user_name
so what is my name saved as	user_name
you refer to me as what	user_name
what do you think my name is	user_name
what's the way you refer to me	user_name
what is my name saved under	user_name
what name do you know me by	user_name
i wanna know what do you call me	user_name
call my name	user_name
what's your designation	user_name
regarding my name, whats it saved as	user_name
i need to know what names you have for me	user_name
say what you think my name is	user_name
in what form is my name saved	user_name
what do you think i am called	user_name
tell me your guess of what my name is	user_name
if you were smart, would you know my name	user_name
how do you reference me	user_name
whats my name saved under	user_name
what's the name that you have for me, please	user_name
i want you to let me know what names you have for me	user_name
i want to hear my name	user_name
what would you like to call me	user_name
what name do you have saved for me	user_name
how do you say my name	user_name
let me know what names you have for me	user_name
what name am i under	user_name
what do you think i'm called	user_name
tell me my designation	user_name
can you tell me what you refer to me as	user_name
do i have a name to you	user_name
what name do you call me by	user_name
how do you address my name	user_name
what name do you refer to me as	user_name
please tell me the name you use for me	user_name
call me by my name	user_name
the name you have for me is what	user_name
tell me what my name is	user_name
who do you think i am	user_name
please tell me the name that you have for me	user_name
you know me by what right now	user_name
i would like to know the name you have for me	user_name
can you tell me my name for me	user_name
do you know what you call me	user_name
what is the name you associate with me	user_name
what's the name you use for me	user_name
do you call me a certain name	user_name
tell me what you believe my name to be	user_name
how do you show my name	user_name
could you tell me my name	user_name
what do you call me	user_name
