text	label
i need to switch to a new insurance plan	insurance_change
i would like to change my insurance from a ppo to an hmo plan	insurance_change
i want to get new insurance	insurance_change
i am thinking of switching to a different insurance plan	insurance_change
could you tell me how to make changes to my insurance policy	insurance_change
connect me with some new insurance	insurance_change
what is the procedure for signing up for a new allstate plan	insurance_change
i need to change my insurance policy, do you know how	insurance_change
what rental insurance policy do you recommend	insurance_change
how do i update my insurance	insurance_change
help me switch to a new insurance plan	insurance_change
can i edit my insurance policy	insurance_change
how do i adjust my insurance policy	insurance_change
i'd like a new life insurance plan	insurance_change
i need new health care coverage	insurance_change
i want to get a new car insurance plan	insurance_change
walk me through making changes to my insurance policy	insurance_change
where do i go to get new insurance	insurance_change
i need new insurance, how do i get it	insurance_change
find the best life insurance for me	insurance_change
switch my insurance plan to a new one	insurance_change
phone number to state farm to change insurance	insurance_change
how do i switch insurance plans	insurance_change
help me find new insurance providers	insurance_change
can you tell me how do i get new insurance	insurance_change
help me find a new insurance plan	insurance_change
i'd like to know how changes are made to my insurance policy	insurance_change
i want to find a new united healthcare plan to get on	insurance_change
how can i get new insurance	insurance_change
i want a new motorcycle insurance plan	insurance_change
is there a way to alter my insurance policy	insurance_change
could you help me out with a new renters' insurance plan	insurance_change
help me change my insurance plan	insurance_change
what is the protocol for modifying my insurance policy	insurance_change
how do i apply for new insurance	insurance_change
is there a way to get a new insurance plan	insurance_change
what steps do i need to take to switch my insurance plan from an hmo to a high deductible ppo plan	insurance_change
i want to start a new aaa insurance plan	insurance_change
how can i obtain new insurance	insurance_change
explain to me how do i get new insurance	insurance_change
what are the steps to change my insurance policy	insurance_change
let me know the process for new insurance	insurance_change
i am interested in a new insurance plan	insurance_change
i would like to make changes to my insurance policy	insurance_change
i want a new insurance plan	insurance_change
i need new insurance but dont know how to get it	insurance_change
i'd like to know how to make changes for my insurance policy	insurance_change
how can i make changes for my insurance policy	insurance_change
i really would like to get a new insurance plan	insurance_change
i need new home owners insurance	insurance_change
i need a newer insurance plan	insurance_change
help me figure out getting new insurance	insurance_change
how do i get different terms on my insurance policy	insurance_change
i am in the market for a new insurance plan	insurance_change
i need help to make changes to my insurance policy	insurance_change
how can i change information on my insurance policy	insurance_change
i would like a new insurance plan	insurance_change
i must switch to a new insurance plan	insurance_change
i need help acquiring new insurance	insurance_change
how do i switch to a new insurance plan	insurance_change
i want to shop for new insurance plans	insurance_change
explain how do i get new insurance	insurance_change
my insurance plan needs to be changed	insurance_change
how can i get new insurance, please	insurance_change
how do i change my insurance policy	insurance_change
i shall switch to a new insurance plan	insurance_change
i wish to request a change in insurance plans	insurance_change
how do i make changes to my insurance policy	insurance_change
i want to switch my insurance coverage	insurance_change
i need to find new insurance	insurance_change
walk me through the process of getting new insurance	insurance_change
i would like to change my insurance policy	insurance_change
how do i modify my insurance policy	insurance_change
i really need to switch to a new insurance plan	insurance_change
website to start aaa new insurance plan	insurance_change
help make changes to my insurance policy	insurance_change
i would like to compare insurance plan options	insurance_change
i would like to switch my insurance plan	insurance_change
can you help me switch to a new insurance plan	insurance_change
what are my options for new insurance plans	insurance_change
how is new insurance gotten	insurance_change
how can i find out about new insurance	insurance_change
how do i sign up for a new allstatedplan	insurance_change
how to i change the policy on my insurace	insurance_change
i want to switch to a new insurance plan	insurance_change
what do i do for new insurance	insurance_change
help me modify my insurance policy	insurance_change
i want help adjusting my insurance policy	insurance_change
how do i go about changing my insurance to a new low monthly premium plan	insurance_change
do you know how i can change my insurance policy	insurance_change
how do i alter my insurance policy	insurance_change
what is the protocol for getting new insurance	insurance_change
what if i want to switch insurance plans	insurance_change
aaa insurance start new plan	insurance_change
how do i get new insurance, please	insurance_change
i want to sign up for a new allstate insurance plan	insurance_change
new insurance is obtainable how	insurance_change
how do i make my insurance policy different	insurance_change
i would like to switch to a different insurance plan	insurance_change
what do i need to do to get new insurance	insurance_change
i would like you to help me get on another united healthcare insurance plan	insurance_change
i need to change my insurance policy, how	insurance_change
what must i do if i want to adjust my insurance policy	insurance_change
i'd like to get on a new united healthcare plan	insurance_change
i am in need of a switch to my insurance plan	insurance_change
i need to sign up for a new allstate plan	insurance_change
i would like to get a new insurance plan	insurance_change
what do i do to get new insurance	insurance_change
i need to get on a new united healthcare insurance plan	insurance_change
i want to change to a new allstate insurance plan	insurance_change
walk me through on how to change my insurance	insurance_change
can i get a new pet insurance plan	insurance_change
i gotta switch to a new insurance plan	insurance_change
help me find a new auto insurance policy	insurance_change
how can i change to new insurance plan	insurance_change
can you help me change my insurance policy	insurance_change
i need to change my insurance to a plan with a lower deductible	insurance_change
i dont like my current insurance plan and want a new one	insurance_change
how do i replace my insurance	insurance_change
i need a new house insurance plan	insurance_change
please put annie's baby shower on march 30 in my calendar	calendar_update
clear my calendar on march 1st	calendar_update
for friday, add a doctor's appointment to my calendar	calendar_update
clear my calendar on feb 28	calendar_update
i need buy a birthday gift for sue taken off my calendar  it is on monday or tuesday last week	calendar_update
add my dentist appointment to the calendar	calendar_update
clear my entire schedule for april 1	calendar_update
i need anniversary dinner added to my schedule for march 7	calendar_update
for the calendar, on february 8 add moms birthday	calendar_update
i want to take the 8am meeting with sam on monday the 5th off my calendar	calendar_update
the staff meeting on march 1 at 10:00 am needs to be added to my calendar	calendar_update
add to friday's calendar a doctor's appointment	calendar_update
on the 22nd of this month, we need to clear our calendar so we can leave it open for mark to visit	calendar_update
add my spa appointment on the 12th to my calendar	calendar_update
write down appointment for tomorrow on my calendar	calendar_update
can you change the date of the doctor's appointment event in my calendar from april 1 to april 3rd	calendar_update
remove anniversary dinner from my calendar on april 5	calendar_update
take my lunch plans off the calendar for march 13th	calendar_update
remove jess's party from my calendar	calendar_update
can you remove this event from my calendar	calendar_update
i need to remove fishing from my calendar for soccer	calendar_update
put my parents anniversary on the calendar for next week on tuesday	calendar_update
i have an appointment on the 5th put it on for 5pm	calendar_update
please remove lunch with sally that is on my calendar on tuesday the 8th	calendar_update
add farm trip to my calendar for friday	calendar_update
remove jake's birthday on march 22	calendar_update
you can remove the wedding from my calendar for march 12, 2019	calendar_update
make sure my calendar is clear for june 1	calendar_update
add my next doctor visit to my calendar	calendar_update
please remove an event from this calendar	calendar_update
can you add remember to register for the race on my calendar for the 15th of march	calendar_update
please add an item to my calendar that i need to clean the kitchen on thursday	calendar_update
i want you to add staff meeting to my calendar for march 1 at 10:00 am	calendar_update
can you get rid of my trip to the zoo from my calendar on march 1st	calendar_update
lunch with deb at noon today	calendar_update
"""put """"get tires checked"""" on my calendar"""	calendar_update
you can remove the brithday party from my calendar fpr january 15, 2019	calendar_update
can you cancel improv class from my calendar for may 7th	calendar_update
delete jury duty from my calendar for may 7th	calendar_update
make sure to add to my calendar the staff meeting for march 1 at 10 am	calendar_update
delete all calendar entries on march 3	calendar_update
please add final exams to my calendar for may 2	calendar_update
take pat's appointment off my calendar	calendar_update
cancel event scheduled for this afternoon	calendar_update
i wanna remove fishing from my calendar for soccer	calendar_update
i need a clear calendar for april 15	calendar_update
i no longer want this event in my calendar	calendar_update
delete lunch with steve on friday please	calendar_update
you can remove the play date from my calendar for feb 18, 2019	calendar_update
take the event called surprise party off my calendar for june 2	calendar_update
put appointment on my calendar for tomorrow	calendar_update
i need to add iep meeting to my calendar on april 15th	calendar_update
clear my calendar for tomorrow	calendar_update
i must add farm trip to my calendar for friday	calendar_update
mark my calendar that i will be meeting steven on march 5	calendar_update
i got to remove fishing from my calendar for soccer	calendar_update
please clear entries on my calendar for the 1st	calendar_update
please take off my calendar on saturday the 6th birthday party for john	calendar_update
please add lunch and catch up with lisa on friday to my calendar	calendar_update
i shall remove fishing from my calendar for soccer	calendar_update
go ahead and delete the doctor appointment i have scheduled for monday	calendar_update
add a vet appointment for 5 pm on saturday	calendar_update
remove my date with liz from my calendar on april 1st	calendar_update
remove from calendar jesse's bbq on june 9th	calendar_update
what can i do to get rid of this event	calendar_update
i want you to cancel the event called 'bachelorette party' on april 15	calendar_update
remove meeting with carla from the calendar	calendar_update
can you remove this event from my calendar, please	calendar_update
add to my friday calendar a doctor's appointment	calendar_update
remove the may 11 event called baby shower from my calendar	calendar_update
clear my calendar for this friday	calendar_update
cancel doctors appointment from my calendar	calendar_update
add my doctor appointment on march 25th at 3:00 to my calendar	calendar_update
get rid of tuesday the 5ths dinner	calendar_update
you can remove the dinner party from my calendar for january 21, 2019	calendar_update
make sure april 1 is clear on my calendar	calendar_update
remove the recurring training meeting events off my calendar	calendar_update
delete all events on my calendar that have the word girlfriend in them	calendar_update
remove the birthday party this friday from my schedule	calendar_update
leave the date of june 4 open on my calendar	calendar_update
clear my calendar for november 11th	calendar_update
remove fencing from my calendar for may 7th	calendar_update
i need to delete an event from my calendar	calendar_update
i need to edit this event out of my calendar	calendar_update
can you add a doctor's appointment to friday's calendar	calendar_update
schedule family dinner on my calendar on march 8	calendar_update
clear my calendar for the date of june 23	calendar_update
make not of my appointment for tomorrow on my calendar	calendar_update
remember to put down that i have an appointment for tomorrow on my calendar	calendar_update
delete my golf tournament event from tomrrow	calendar_update
get rid of everything on my calendar for march 2nd	calendar_update
take work from my calendar for may 7th	calendar_update
delete the hair appointment i had scheduled on may 1st pleae	calendar_update
delete dentist from my calendar	calendar_update
add a doctor's appointment to my calendar for friday	calendar_update
friday needs to be clear on my calendar	calendar_update
i want the events on my calendar for march 20th, 2019 to be cleared	calendar_update
erase any event on my calendar that's set for wednesday of next week	calendar_update
remove the june 12 event called sasha's wedding from my calendar	calendar_update
i want to add farm trip to my calendar for friday	calendar_update
please schedule an event called 'nadine's baby shower' on my calendar	calendar_update
i want to add a doctor's visit to the calendar for friday	calendar_update
add jake's birthday party for friday at 5	calendar_update
erase meeting with jeff from my calendar	calendar_update
clear my calendar for february 29th	calendar_update
clear my calendar for september 6th	calendar_update
erase all events on friday from my calendar	calendar_update
i need to remove an event from my calendar	calendar_update
please take final exams off my calendar for may 3	calendar_update
add my birthday to my calendar for next month on the 5th	calendar_update
take my dinner plans off my calendar for tomorrow	calendar_update
delete that event from calendar	calendar_update
add swimming to my calendar today	calendar_update
undo the last event on my calendar	calendar_update
take the doctor appointment off my calendar please	calendar_update
remove dinner with suzie from my calendar on march 1st	calendar_update
i need to put my appointment for tomorrow on my calendar	calendar_update
i no longer need to go to the zoo on the 8th of this month	calendar_update
please remove fishing from my calendar for soccer	calendar_update
please clear my calendar	calendar_update
how long should i fry an egg for	cook_time
how long do i need to cook pot au feu for	cook_time
about how long should you cook lasagna	cook_time
how long does it take to prepare a lasagna	cook_time
how long do i cook chicken breast	cook_time
how long does it take to make pho	cook_time
when can i expect meal of salmon to be finished	cook_time
how long do i cook steak	cook_time
how long do the brownies have to cook	cook_time
how long do i boil eggs	cook_time
how long to cook a frozen pizza	cook_time
how long does it take to prepare pot roast	cook_time
how long should i cook country fried potatoes for	cook_time
so how long do you think the chicken will take	cook_time
how long does pizza take	cook_time
should i cook this for a long time	cook_time
tell me how long i will need to spend preparing a meat loaf dish	cook_time
i want to cook a lasagna please tell me how long it will take	cook_time
how long do i need to cook lasagne for	cook_time
how long does it take to make shrimp scampi	cook_time
how long does a roast take	cook_time
what is the prep time for a 10 lb turkey	cook_time
how long do you need to bake chicken for it to be safe to eat	cook_time
how long does pizza take to cook	cook_time
how long do i need to cook beef stew for	cook_time
look up recipe time for this	cook_time
about how long should you cook a 10 pound turkey	cook_time
how long should i cook a ny steak	cook_time
what is the duration of time cookies should be in the oven	cook_time
how long will it take to make an omelet	cook_time
how long will it take to cook a lasagna	cook_time
how long does it take to make lasagna	cook_time
how long should i bake the brownies for	cook_time
how long do i put the casserole in	cook_time
what time should i cook noodles for	cook_time
how long should i cook carnitas for	cook_time
how long do i need to cook chili for	cook_time
tell me how long i ought to spend preparing fajitas	cook_time
how long must i cook spaghetti for	cook_time
what's the average cooking time for cooking wings	cook_time
how long does it take to cook hot pockets	cook_time
bake time for brownies	cook_time
what should i put on the timer to cook this dish	cook_time
how long to microwave a frozen dinner	cook_time
how long should i bake a cake	cook_time
how long will it take me to make baked chicken	cook_time
how long does it take to cook steaks	cook_time
how long should i wait before i can bake bread with homemade dough	cook_time
how long should i cook ham for	cook_time
how long does it take to cook meal of tuscan	cook_time
what is the proper time to cook steak for	cook_time
how long should i microwave hot pockets for	cook_time
how long do i need to cook tuna casserole for	cook_time
how long should i expect beef stroganoff to prepare	cook_time
what is the proper cooking time for this	cook_time
how many minutes should i put meal the cake in the oven	cook_time
how long does it take to cook roast beef	cook_time
what is the necessary amount of time required to prepare pot roast	cook_time
how long will the chicken take to cook	cook_time
can you tell me how long it will take to cook a lasagna	cook_time
how long to cook steak for	cook_time
how long should i cook a spiral ham	cook_time
how long will it take to make the wings	cook_time
i need to know how long to cook chicken for	cook_time
how long should this be in the oven	cook_time
lasagna takes how long to cook	cook_time
how long should i cook the cookie dough	cook_time
how long do i cook the chicken roast	cook_time
how long does it take to make roast chicken	cook_time
how long should i boil eggs	cook_time
how long to i bake the brownies	cook_time
how many minutes to melt cheese	cook_time
how long should i boil noodles for	cook_time
how long is it acceptable to carmelize onions	cook_time
what's the prep time for a garden salad	cook_time
how long do i put sugar cookies in for	cook_time
how long do i cook this dish of rice	cook_time
i need to know the preparation time required for fried chicken	cook_time
how long should i spend preparing roast beef	cook_time
how many minutes are involved in the preparation of curry	cook_time
how long do you cook pasta for	cook_time
how long do i need to make lasagne	cook_time
what's the recommended cooking time for steak	cook_time
how long will the turkey take to cook	cook_time
how long should i cook pho for	cook_time
what's the usual time for tuna casserole	cook_time
i want to bake brownies, how long do they bake for	cook_time
how long should i cook the asparagus for	cook_time
how long do noodles need to cook	cook_time
how much time does it take to boil an egg	cook_time
how long does it take to make mashed potatoes	cook_time
how long should i cook a steak for	cook_time
how long should i cook chicken thighs	cook_time
how long do you cook a salmon	cook_time
how long should i cook the steak for	cook_time
how long does it take pork to cook	cook_time
tell me how long it will take to prepare a lasagna	cook_time
what's the prep and cooking time on pizza dough	cook_time
how long should i cook chicken	cook_time
how many minutes do i cook baked ziti	cook_time
how long is the chicken gonna take	cook_time
what's the cooking time for chicken alfredo	cook_time
how long should i cook the ham for	cook_time
if i cook the pizza at 400 degrees how long must it be in for	cook_time
the steak must go under the broiler for how long	cook_time
how long should a cake bake	cook_time
how long do i cook this for	cook_time
how long do i need to cook chicken	cook_time
how long should i cook roast for	cook_time
how long do you bake a cake	cook_time
i need to know how long to do a pot roast in a slow cooker	cook_time
how long do i cook pork	cook_time
how long should i cook the eggs for	cook_time
how long to reheat chinese food	cook_time
how long does it take to bake a pork loin	cook_time
how much time do i need to prepare chicken	cook_time
how long to grill thick steaks	cook_time
how long do you need to put the cuish in for	cook_time
for how long should i bake the brownies	cook_time
how long does it take to cook a pork chop	cook_time
how long is the drive from sfo to fisherman's wharf	distance
how long does it take to get to the airport in dallas	distance
how long will it take to get to tacoma	distance
if i go by bus, how long will it take to get to the airport	distance
how long does it take until i reach the sky harbor airport	distance
how many miles will it take to get to my destination	distance
how long will it take me to get to walmart	distance
about how much time will it take to get to the laundry in this area	distance
approximately how long does it take to get to the resort in miami	distance
how much farther is orlando from my location	distance
do i have a ways to go or am i close to getting to penn station	distance
does it take a long time to get to the airport in la	distance
how long will it take to get from galleria mall to state capitol	distance
when will i get to orlando	distance
how long will it take to get to golden gate bridge from pier 39	distance
how much time does it take to get to levi stadium from san jose airport	distance
give me an eta on when i will arrive at my destination	distance
how much time to reach doctors office	distance
how long will it take me to get to red robin in glendale	distance
how many minutes will it take to get to the empire state building in manhattan	distance
tell me how far i am from home in time and miles	distance
what's the mileage to get the the taj mahal in atlantic city	distance
where is the closest gas station	distance
how long to reach my doctors office	distance
what's the time to destination going via bus to omaha	distance
whats the travel time to redmond right now	distance
how long will it take for me to get to red robin in san diego	distance
how many minutes am i from texaco	distance
how long does it take to get to phoenix by bus	distance
what time will we arrive at the bank	distance
what is the length of time it takes to get to phoenix	distance
tell the miles it will take to get to las vegas from san diego	distance
is it going to be much longer until i reach the bank	distance
it takes how long to get to the beach in santa barbara	distance
how long does it take to get to applebees in new york	distance
when will i arrive at hy-vee	distance
how long does it take to get downtown by bus	distance
when will the bus get me to vermont	distance
usually, how long does is the commute to brooklyn by bus	distance
how long will the trip to portland be	distance
how long to seattle on a bus	distance
utilizing an automobile known as a bus, how long will it take to get to detroit	distance
will it be long to get to the sky harbor airport	distance
how many hours will it take to get to my destination	distance
what is the average time to get to walmart in mays landing	distance
how long would it take to get to times square by bus	distance
how long does it take to get to orlando by bus	distance
can you please tell me how long it will take to get to target in austin	distance
what's the eta for grandma's house	distance
can you tell me about what time i should be arriving at the airport	distance
if i'm trying to get to heinz field, how long would it take by bus	distance
travel time to bend, oregon	distance
how long will it take me to get to the mcdonald's in the city	distance
estimated time to airport from current location, la	distance
does it take 5 hrs to get to brooklyn by bus	distance
i want to know how long it is from here to the sky harbor airport	distance
does it take long to get to yankee stadium in the bronx	distance
approximately how much time will it take to get to tod's in minutes	distance
how long's it take to get to the panera downtown	distance
what is the average time it takes to get to target in los angeles	distance
how much time to drive to the closest bank	distance
how long will it take for me to get to the gas station	distance
how long does it take to get to dallas by bus	distance
if i leave now, how long will it take me to drive to cape hatteras	distance
what is the time frame to get to phoenix	distance
time taken to reach doctors office	distance
how long will it take me to get to phoenix	distance
