text	label
what should i do if my car battery dies	jump_start
what shall i do now that my battery is dead	jump_start
what do i do to jump start my car	jump_start
i need to know how to get my car jump started	jump_start
how do i jump start a battery	jump_start
what do i do when my car battery is dead	jump_start
what do i need in order to jump start my car	jump_start
what's next when it seems there's a dead car battery	jump_start
what exactly is my credit limit	credit_limit
what is my limit on my visa card	credit_limit
how high is my credit limit for my walmart card	credit_limit
what's my visa limit	credit_limit
what is my visa card limit	credit_limit
look up the credit limit for my visa	credit_limit
how much credit do i have on my discover card	credit_limit
what is the credit limit on my discover card	credit_limit
i need to know my spending limit on my visa	credit_limit
how much can i use on my visa	credit_limit
tell me the visa card credit limit	credit_limit
what is my credit limit	credit_limit
look up how high my visa limit is	credit_limit
i would love to know my spending limit	credit_limit
what is the limit on my victoria's secret card	credit_limit
how is my credit limit	credit_limit
tell me the limit for credit on my mastercard	credit_limit
explain what my credit limit is	credit_limit
what is the spending limit i have	credit_limit
i wish to know my credit limit for my credit card	credit_limit
how is that credit limit	credit_limit
what's my limit on my visa card	credit_limit
how high is my credit limit for my wells fargo card	credit_limit
where can i go to find out my credit limit	credit_limit
i need to know my credit's limit	credit_limit
the credit limit on my account is how much	credit_limit
what's my current limit on my visa	credit_limit
what can i put on my bank of america card	credit_limit
can i please know the credit limit for my citibank card	credit_limit
credit limit info	credit_limit
what is the credit limit	credit_limit
how high is my spending limit on my wells fargo card	credit_limit
what is the credit limit for my chase card	credit_limit
what credit limit do i have	credit_limit
how high is my credit limit for my old navy card	credit_limit
what is the max on my credit limit	credit_limit
how much to i have left on my visa card limit	credit_limit
what is the current credit limit i have on my wells fargo mastercard	credit_limit
how much can i buy on my discover card	credit_limit
what is the max credit limit for my card	credit_limit
tell me the limit on my discover card	credit_limit
i need to know what the visa card credit limit is	credit_limit
tell me the highest amount i can spend on my discover card	credit_limit
what's my credit limit on my visa	credit_limit
what is the spending limit on my visa	credit_limit
what's my daily spending limit	credit_limit
tell me my credit limit	credit_limit
what is my credit limit at	credit_limit
will you tell me my spending limit	credit_limit
how much spending power is on my discover card	credit_limit
i would like to know the limit for my credit	credit_limit
how much can i spend on my discover card	credit_limit
what's the credit limit on my visa card	credit_limit
what is my amex credit limit	credit_limit
what is the credit limit for my usaa card	credit_limit
i need you to tell me the credit limit for my republic bank card	credit_limit
how much am i allowed to spend on my discover card	credit_limit
what's my credit limit	credit_limit
how much is my credit limit	credit_limit
what is my credit max	credit_limit
how much do i have available on my visa card	credit_limit
what is the credit limit for my bank of america card	credit_limit
would you tell me my spending limit	credit_limit
i wanna know the limit on my credit card	credit_limit
what's the credit limit on my visa	credit_limit
how high is my balance on my discovery card	credit_limit
could you tell me the limit on my chase credit card	credit_limit
how high is my credit limit for my target card	credit_limit
how high is my credit limit for my chase card	credit_limit
what's the most i can charge on my card	credit_limit
can you tell me what the limit is on my capital one card	credit_limit
what's the spending limit on my lloyds card	credit_limit
what is the credit limit on my visa	credit_limit
let me know the credit limit for my credit card	credit_limit
how can i check my credit card limit	credit_limit
what's my limit on my amex card	credit_limit
do i have a monthly spending limit	credit_limit
what is my credit limit on my discover	credit_limit
what is my visa credit limit	credit_limit
is there a spending limit	credit_limit
what is my spending limit on my chase sapphire card	credit_limit
how high is my credit limit for my american express card	credit_limit
what's my current limit on my mastercard	credit_limit
how much of a credit limit does visa allow	credit_limit
please let me know the credit limit on my citibank card	credit_limit
can you tell me my credit limit	credit_limit
what is my credit card spending limit	credit_limit
what's the credit limit on my discovery card	credit_limit
how much it the credit limit on my visa card	credit_limit
how high of a credit limit do i have on my amex card	credit_limit
tell me my hsbc card credit limit	credit_limit
what is my credit limit looking like	credit_limit
what's my discover credit limit	credit_limit
how much can i max out on my visa	credit_limit
what is the credit limit for my bank of the west card	credit_limit
i want to know my spending limit	credit_limit
what's the limit on my discover card	credit_limit
can you tell me my spending limit	credit_limit
i need to know the credit limit	credit_limit
i need know my credit limit on my american express card	credit_limit
what's my current spending limit	credit_limit
can you find my credit limit on my mastercard	credit_limit
what's my visa card's limit	credit_limit
will you let me know what my spending limit is	credit_limit
do you know my credit limit for the visa card	credit_limit
what's the credit limit on my account	credit_limit
what is my state bank of india card credit limit	credit_limit
what's my spending limit on my discover	credit_limit
i need to know what my limit is on my american express card	credit_limit
give me my credit limit	credit_limit
report my credit limit	credit_limit
what's the limit on my american express card	credit_limit
what's my credit limit for my visa card	credit_limit
how much can i spend, at most, on my chase freedom	credit_limit
please check my credit limit on my visa	credit_limit
how much can i charge on my visa	credit_limit
what is the credit limit for my navy federal card	credit_limit
i have to know the credit limit	credit_limit
can you let me know what my credit limit is for my visa card	credit_limit
can you tell me the limit i currently have on my barclay card	credit_limit
how is everything with you	greeting
hello, how are things	greeting
hello siri	greeting
are you doing okay	greeting
hey, ai	greeting
hola!	greeting
hello, how are you doing	greeting
ai how are you doing on this fine day	greeting
hey hey!	greeting
how's everything	greeting
how is the ai doing	greeting
how's ife treating you	greeting
hi, ai	greeting
how are things going	greeting
tell me how you are doing	greeting
hi, how are you	greeting
hello, how is it going	greeting
how are you this day	greeting
wassup	greeting
it's nice to see you	greeting
hey	greeting
how are things	greeting
hi! are you doing okay	greeting
how are you doing today, ai	greeting
hey what's up	greeting
hiya!	greeting
hey there, how are you today	greeting
how is your day	greeting
how are things going for you	greeting
ai, how are you doing	greeting
how are you doing, ai	greeting
how's it hanging	greeting
hola	greeting
how ya been	greeting
good day	greeting
hello how's it going	greeting
why, hello bandit	greeting
can you tell me how you're doing today	greeting
how are things treating you	greeting
how is it going my friend	greeting
heller	greeting
aloha	greeting
hey there	greeting
hey there!	greeting
what's up	greeting
hey, what's up	greeting
hi	greeting
how is everything going	greeting
hi there, how are things	greeting
hello, friend	greeting
it's good to see you	greeting
hello, anyone there	greeting
bonjour	greeting
hey how's it going	greeting
how've you been feeling	greeting
how is everything going for you	greeting
hi, how are you today	greeting
are you okay right now	greeting
hows are ya	greeting
hello there ai	greeting
are you doing ok	greeting
what's up with you	greeting
hello, what's up	greeting
hi how are you	greeting
are you good	greeting
hello, how are you	greeting
how's it going with you	greeting
would you tell me how the ai is doing	greeting
hey what's up	greeting
just wanted to say hi	greeting
yo	greeting
ai how are you doing today	greeting
whats up	greeting
hello, are you doing alright	greeting
how is my ai doing	greeting
greetings to you	greeting
salutations!	greeting
are you okay	greeting
what's happening	greeting
hello there, good morning	greeting
what do you feel like doing	greeting
how's life	greeting
hey, what's new	greeting
good to see you	greeting
hey, how are you	greeting
hi there	greeting
are you doing alright	greeting
how're you doing	greeting
hey how's life	greeting
how is life treating you	greeting
hey there fellow	greeting
well hello	greeting
what's going on	greeting
hello there	greeting
hi there, how are you doing	greeting
how are things for you	greeting
i'd like to know how you are doing	greeting
are you well	greeting
how you are	greeting
so how is everything	greeting
what are you feeling today	greeting
are you doing well	greeting
how are you today	greeting
how are you doing	greeting
is everything ok today	greeting
hi there alexa	greeting
whats up with you	greeting
are things going well for you	greeting
heyo	greeting
hey how's it hanging	greeting
hello there!	greeting
how goes it	greeting
wake up, ai	greeting
how have you been	greeting
hello, ai	greeting
how do you feel	greeting
is everything ok with you	greeting
hello, how's your day	greeting
how are things with you	greeting
is everything going okay	greeting
can you get me any recommendations for the place i'm traveling to	travel_suggestion
what festivals are there to see in paris	travel_suggestion
suggest some things for me to do while i am in los angeles	travel_suggestion
what's fun to do in thailand	travel_suggestion
let me know some things to do in phoenix	travel_suggestion
what's a good use of my time in toronto	travel_suggestion
are there any interesting activities to do in austin	travel_suggestion
what kinds of fun things are there in boston for tourists	travel_suggestion
i need ideas for things to do in nashville	travel_suggestion
what are some hot travel destinations	travel_suggestion
what are some fun things to do in butte, montana	travel_suggestion
what are some fun local experiences in canada	travel_suggestion
what are some activities to do in chicago	travel_suggestion
what are popular mountains to hike in arizona	travel_suggestion
what are some fun, tourist sites to see in nyc	travel_suggestion
what are some suggestions for places to travel	travel_suggestion
provide me with ideas of things we can do in charlotte	travel_suggestion
give me location for tourist destination in bangkok	travel_suggestion
what to do in minneapolis	travel_suggestion
what are some cool tourist attractions in england	travel_suggestion
what fun is there to do in england	travel_suggestion
what can i do in new orleans for fun	travel_suggestion
give me some ideas of what to do during my trip to dallas	travel_suggestion
where's a good place to go if i want to see mountains	travel_suggestion
i would like to find a list of cool things recommended for tourists in copenhagen, denmark	travel_suggestion
where do you suggest i plan my next vacation	travel_suggestion
could you tell me what fun tourist things i could do in tokyo	travel_suggestion
what do people in sioux falls do for fun	travel_suggestion
can you tell me about the best tourist attractions in sweden	travel_suggestion
i'd like some suggestions on where to go on my vacation this year	travel_suggestion
what can a tourist in denver do	travel_suggestion
i want some suggestions for tourist activities in dublin	travel_suggestion
i am itching to travel but don't know where to go	travel_suggestion
do you know of any activities in nashville	travel_suggestion
tell me some things to see in tampa	travel_suggestion
help me pick a new location to travel to	travel_suggestion
what are some fun tourist things to do in mumbai	travel_suggestion
what are some exciting things that are a must do for tourists visiting sedona	travel_suggestion
when visiting chicago, what things can i do there	travel_suggestion
name some tourist things to do in chicago	travel_suggestion
please do a search for entertaining activities for tourists in mexico city	travel_suggestion
what are some things to do in portland	travel_suggestion
what things can i do in portland	travel_suggestion
what does kentucky have to offer for things to do	travel_suggestion
name the five star attractions in gatlinburg	travel_suggestion
is there anything fun to do in manassas, virginia	travel_suggestion
i want to know about tourist places for bangkok	travel_suggestion
what's the funnest thing for a tourist to do in iceland	travel_suggestion
i wanna know some things to do in phoenix	travel_suggestion
what should i do in bangor	travel_suggestion
tell me some fun tourist attractions in london	travel_suggestion
what are some touristy things to do in boston	travel_suggestion
is there anything fun to do in berlin	travel_suggestion
tell me things i can do in chicago	travel_suggestion
can you throw out some suggestions to me of places to travel to	travel_suggestion
what should i do for fun in tokyo	travel_suggestion
can you give me some suggestions to go site seeing when i get there	travel_suggestion
what are some fun things to do in sweden	travel_suggestion
tell me some things to do in phoenix	travel_suggestion
what's a good place to vacation	travel_suggestion
what things are there to do in kentucky	travel_suggestion
i would like to do some things in phoenix	travel_suggestion
what are some good restaurants in chicago	travel_suggestion
what are the most popular attractions in gatlinburg	travel_suggestion
i want to travel this year but i need some suggestions	travel_suggestion
where should i travel if i want to visit some history museums	travel_suggestion
help me plan my traveling itinerary for my trip to madrid, i want to see lots of sights!	travel_suggestion
please suggest some fun tourist activities in tokyo	travel_suggestion
what can i do in evans	travel_suggestion
what are some fun things i can partake in in atlanta	travel_suggestion
give me a list of things to do in orlando	travel_suggestion
tell me some fun activities to do in oklahoma city	travel_suggestion
can you suggest some of the most popular travel destination	travel_suggestion
what do you suggest for entertainment in tampa, florida	travel_suggestion
what's something interesting to do kentucky	travel_suggestion
can you help me pick some fun things to do in london during my trip	travel_suggestion
please give me some ideas of fun tourist activities to do while i am in paris	travel_suggestion
what are some local attractions in portland	travel_suggestion
in seoul, what things can i do	travel_suggestion
what are some things i can do in portland	travel_suggestion
name some things i should do while in evans	travel_suggestion
in portland, what things are there to do	travel_suggestion
what do you recommend to do in vegas	travel_suggestion
find the favorite destination for traveling this year	travel_suggestion
do you think arizona has plenty of bike routes	travel_suggestion
can you give me some fun suggestions for tourists to check out in las vegas, please	travel_suggestion
give me some recommendations of good tourist attractions in montreal	travel_suggestion
what could i do for fun in kentucky	travel_suggestion
what's the best place to travel to this time of year	travel_suggestion
is there anything neat to do in boston	travel_suggestion
give me some awesome travel destinations	travel_suggestion
i need some recommendations for fun tourist activities in washington, dc	travel_suggestion
what's a nice place to visit a beautiful beach	travel_suggestion
let me know some things i can do in dallas	travel_suggestion
what is there to do besides drink in germany	travel_suggestion
i want to know where to visit in bangkok	travel_suggestion
when travelling in chicago, what kinds of attractions should i see	travel_suggestion
what is there to do in craberra	travel_suggestion
what sort of things do people do in new york	travel_suggestion
what are some of sweden's best sights	travel_suggestion
name some tourist things to do in seattle	travel_suggestion
give me some ideas on what i can do in seattle for fun	travel_suggestion
what can i do in hong kong	travel_suggestion
what are your best travel suggestions	travel_suggestion
what's the best place to just get away from it all	travel_suggestion
what things are there to do in portland	travel_suggestion
show me some things to do in gatlinburg	travel_suggestion
what's the best restaurant in arizona for pizza	travel_suggestion
what are some fun silly things to do in new jersey	travel_suggestion
what's the best place to visit in arizona	travel_suggestion
what are some fun cheap activities to do in colorado	travel_suggestion
are there any fun tourist things to do in boston	travel_suggestion
where should i travel to next	travel_suggestion
i am traveling to paris soon and would like some suggestions of what to do and see	travel_suggestion
are there any fun tourist activities in australia	travel_suggestion
what kinds of fun touristy things are there to do in boston	travel_suggestion
are there any exciting tourist things to do in boston	travel_suggestion
what are some tourist sites to see in ann arbor	travel_suggestion
what is there to do in evans	travel_suggestion
i want list of tourist destination for paris	travel_suggestion
i need to know the date in 256 days	date
when will it be in 10 days	date
give me today's date	date
give me tomorrow's date please	date
please give me today's date	date
what will the date be 100 days from now	date
what date will it be 9 days from now	date
tell me what the date will be tomorrow	date
give me the date	date
in 2 days, what date will it be	date
after another eight days, what day will it be	date
what day is it gonna be in twenty-one days	date
can you tell me the date today	date
what's the current date, month and year	date
the date tomorrow is what	date
what is today's date	date
what is today	date
can you tell me tomorrow's date	date
give me the date today	date
what's the date 32 days from now	date
i need the full date for today	date
what date is it	date
is today monday	date
i would like to get today's date	date
what would tomorrow's date be	date
what day of the week is it	date
what's the date tomorrow, please	date
what day of the month is it today	date
what day is it tomorrow	date
do you have the date	date
today's date is what exactly	date
please tell me what the date is tomorrow	date
what day is it	date
what is the day now	date
what is the date	date
what date will it be 7 days from now	date
which day will it be five days from now	date
today is which day of the week	date
which day is it now	date
what day will it be in fourteen days	date
tell me what the date will be in 5 days	date
what date will it be tomorrow	date
what's the date today	date
what is the month and day tomorrow	date
can you tell me today's date	date
please tell me today's date	date
let me know the date tomorrow	date
in six days, what will it be	date
tell me what date it is please	date
please tell me what date it is today	date
i'd like to know the date tomorrow	date
what's the name of the day today	date
tell me what the date is for tomorrow	date
15 days from today, what will the date be	date
what date will it be 8 days from now	date
what will the date be in 10 days	date
what day will it be 373 days from now	date
what's today's date	date
tell me what the date is today	date
what's tomorrow on the calender	date
what day it today	date
what's the date 400 days from now	date
i would like to know what today's date is	date
what day is it today	date
tell me the date it will be 5 days from now	date
what is the date today	date
what day of the month is it	date
show me a calendar	date
which day is it today	date
would you please tell me today's date	date
what will be the date in 100 days from now	date
today is what day of the week	date
i need to know tomorrow's date	date
i would like to know tomorrow's date	date
what is tomorrow's date, please	date
what's today	date
let me know what tomorrow's date is	date
tell me what today's date is	date
is it monday, tuesday, wednesday, thursday, friday, saturday, or sunday	date
what's the date	date
would you let me know today's date	date
can you remind me of the date	date
i need to know what the date is today	date
current date	date
today's date is what	date
let me know what date it will be in 3 days	date
what is the date of today	date
what day of the week are we on	date
what's the current date	date
could you tell me today's date	date
calender says tomorrow is	date
tell me the date, please	date
what day are we in	date
tell me the date 5 days from now	date
what is the date tomorrow	date
tell me what the date is tomorrow	date
what is the current date	date
what date is it today	date
what will be the date tomorrow	date
what is the date tomorrow, please	date
what's the day of the week	date
what is the date in 5 days	date
can you tell me what today's date is	date
what is today's month, day and year	date
tell me the date	date
can you tell me the date	date
i need to know what date it is tomorrow	date
please share today's date	date
today is what date	date
what date is today	date
what date is it tomorrow	date
i need to know the date it will be 4 days from now	date
i need to know today's date please	date
what is the date of tomorrow	date
date please	date
what is the date for tomorrow	date
what date will it be 6 days from now	date
tell me tomorrow's date	date
i need to know today's date	date
in 100 days from now, what will be the date	date
what is three quarters of one sixth	calculator
can you tell me what 30% off 279 is	calculator
what is 2+2	calculator
what is the sum of 10 plus 5	calculator
what is 4 + 4	calculator
what is the sum of 3 plus 5	calculator
what is the sum of 8 + 3	calculator
how to solve this math problem	calculator
what is 20+ 5	calculator
what is 48 multiplied by 4 divided by 2	calculator
what is the area of a 20 x 20 room	calculator
can you do a math problem	calculator
can you calculate the square root of 172	calculator
what is the square root of 36	calculator
can you tell me what is 18 percent of $2500	calculator
what is 78 times 85	calculator
what is 900 times 8	calculator
i need your assistance to solve this math problem	calculator
560 divided by 3	calculator
find the square root of 1243435	calculator
what is 13 times 57	calculator
what is the square root of 5	calculator
what is 7 x 7	calculator
can you subract 36 from 5	calculator
how much is 50 plus 756	calculator
what is the square root of 2784	calculator
can you help me solve a math problem	calculator
what is the square root of sixteen	calculator
what is 20% of a thousand	calculator
multiply 7 and 42	calculator
what is 1000 plus 745	calculator
what is 63 percent of 145	calculator
is 126 divisible by 8	calculator
can you multiply 45 by 23	calculator
how do i ask the ai to help me with math problem	calculator
what is the square root of 10294	calculator
what is 10000 divided by 20	calculator
can you factor x squared plus 4 x plus 4	calculator
what is 20 + 20	calculator
what is 100 multiplied by 55	calculator
tell me the answer to 1000 divided by 40	calculator
divide 100 by 12	calculator
what is 250 times 118 times 9	calculator
what is 8 factorial	calculator
what is 606 divided by 5	calculator
what is the square root of 95	calculator
will you help me with a math problem	calculator
what is 60 percent off of 350 dollars	calculator
can you do algebra	calculator
subtract 100 from 12	calculator
i bought 6 shirts at $499 each what was my total expenditure for them	calculator
what is seventeen plus three	calculator
what is 005 percent of 1 percent	calculator
what is 1100 minus 2347	calculator
what is 90908 divided by 30890	calculator
help me with math	calculator
what is the square root of 144	calculator
i need to know what 75 plus 43 is	calculator
what is 1 fifth times 2 fifths	calculator
i need to know what is 85% of $1500	calculator
what is 55 times 300	calculator
what is the square root of 66	calculator
can you calculate 18 divided by 45	calculator
what is the solution to sixty times thirty	calculator
can you tell me the square root of pi	calculator
what is 2/3 x 1/9	calculator
what's 47 times 83	calculator
can you help me do math	calculator
can you tell me what 30% off 279 is, please	calculator
tell me what 1875 plus 3459 equals	calculator
what is 3/4 of 18	calculator
what is 750 divided by 5	calculator
what is 2 + 2	calculator
add 45 to 87 plus 54 plus 43 plus 22	calculator
what is 4 x 4	calculator
what is 400 times 2	calculator
what is 213 times 3	calculator
i need to know the answer to 10000 multiplied by 44	calculator
whats the answer to 5-6=	calculator
what is the square root of 8814	calculator
