text	label
please remove your connection to my phone	sync_device
will you please end the connection to my phone	sync_device
with my phone please pair	sync_device
can you disconnect yourself from my phone	sync_device
can you get paired to my phone right away	sync_device
i don't want you synced to my phone anymore	sync_device
i want to disconnect the current connection to my phone	sync_device
please get off my phone connection	sync_device
please desync my current mobile	sync_device
remove the connection to my phone	sync_device
can you sync up with my phone	sync_device
connect with my phone please	sync_device
can you link up with my phone	sync_device
unsync yourself from my device	sync_device
establish a connection to my phone	sync_device
connect to my phone for me	sync_device
i want you to connect using my phone	sync_device
can you please disconnect from my phone	sync_device
desync from my iphone	sync_device
please connect the device to my phone	sync_device
please connect with my smart phone	sync_device
stop syncing with this phone	sync_device
please pair with my phone	sync_device
i need you to disconnect from my phone	sync_device
i want my phone to be disconnected from you	sync_device
connect with my phone	sync_device
how can i unsync my phone	sync_device
please add onto my phone	sync_device
would you connect to my phone	sync_device
please unsync from my phone	sync_device
sync with my phone	sync_device
don't connect to my phone anymore	sync_device
i no longer want this phone to sync	sync_device
can you connect to my phone	sync_device
don't be connected to my phone anymore	sync_device
stop synching to my phone	sync_device
can you disconnect from my phone	sync_device
can you connect to my phone, please	sync_device
please connect yourself to my main phone	sync_device
please connect to my phone	sync_device
please disconnect from my phone	sync_device
stop the connection with my phone	sync_device
please pair my phone	sync_device
get connected to my phone	sync_device
are you able to link to my phone	sync_device
do you have access to my phone	sync_device
mind connecting to my phone	sync_device
please link up to my phone	sync_device
pair with my smart phone	sync_device
disconnect from phone	sync_device
remove the sync from my phone	sync_device
go and disconnect from my phone	sync_device
stop syncing with my phone	sync_device
pair my phone please	sync_device
do you know how to say where is the restroom in french	translate
please tell me how to ask for a taxi in french	translate
in spanish, meet me tomorrow is said how	translate
what do spanish people say for the word cow	translate
translate hello into french for me	translate
translate for me hello into french	translate
how do i say bathroom in italian	translate
can you tell me how to say 'i do not speak much spanish', in spanish	translate
how do vietnameses people say hello	translate
how do i say you're welcome in chinese	translate
what would the word for grass be in finland	translate
how do you say hi in french	translate
how can i say thank you in spanish	translate
how do they say yes in brazil	translate
can you translate bowl into russian for me	translate
in england how do they say subway	translate
what do you call a subway if you were english	translate
how might i say hello if i were scottish	translate
can you translate milk into spanish for me	translate
can you translate this name into spanish for me, please	translate
how do you say thank you in spanish	translate
what is the correct way to say 'i am a visitor' in french	translate
how do you say i'm hungry in french	translate
"""how do they say """"what's up"""" in chinese"""	translate
how would they say butter in zambia	translate
"""how do they say """"where's the bathroom"""" in spanish"""	translate
how can i say i love you in italy	translate
"""how can i say """"cancel my order"""" in french"""	translate
how can i say thank you very much in chinese	translate
how is hello said in french	translate
how do you say please in arabic	translate
would you translate a phrase into mandarin for me	translate
how would i say pleased to meet you if i were japanese	translate
what words would i use to tell someone i am lost if i were japanese	translate
what is the right way to say excuse me in spanish	translate
how do germans say goodnight	translate
how do you say hello in japanese	translate
if i were english how would i say subway	translate
how does one say wonderful in german	translate
how would i say, 'i don't know the answer' in spanish	translate
tell me how to say hello in spanish	translate
can you translate where's the bar into irish for me	translate
how do i say good bye in chinese	translate
i would like to know the proper way to greet an adult in portuguese	translate
i wanna know a phrase in spanish	translate
could you translate this into chinese for me, please	translate
how do they say hello in brazil	translate
can you translate hello into swedish for me	translate
i must know how to say thank you in german	translate
could you translate atm machine into english	translate
how do you say it's snowing in german	translate
how do they say hello in france	translate
in french, how do i say, see you later	translate
what is spanish for good morning	translate
i want to know how to say goodbye in france	translate
how do i say i'm sorry in chinese	translate
i need you to translate the sentence, 'we will be there soon' into portuguese	translate
"""how do they say """"how's it going"""" in swahili"""	translate
how would you say fly in italian	translate
tell me how to say hello in chile	translate
how do you say good bye in french	translate
how do i say dinner in spanish	translate
how do you say dog in spanish	translate
how do they say tacos in mexico	translate
how do you say hello in french	translate
how would i say nice to meet you if i were russian	translate
how do i say thank you in spanish	translate
what's the french word you use for potato	translate
how do i ask about the weather in chinese	translate
how do you say hello in mexico	translate
what is the word for hello spanish	translate
tell me how the russians say notebook	translate
what expression would i use to say i love you if i were an italian	translate
can you translate good bye into russian for me	translate
how should i say hello in french	translate
what's the spanish word for dog	translate
what's local slang for goodbye in hawaii	translate
how do they say goodbye in hawaii	translate
can you translate cat into russian for me	translate
how would i say how are you today if i were mexican	translate
i wanna learn a phrase in russian	translate
how do i say 'hotel' in finnish	translate
if i were mongolian, how would i say that i am a tourist	translate
can you translate i have to go pee into korean for me	translate
how can i say not now in spanish	translate
translate hello english to french	translate
how would i say hello if i were swedish	translate
what is latin for i love you	translate
can you translate hi into spanish for me	translate
would you translate a sentence into russian for me, please	translate
what is dog in spanish	translate
how do i say hello in french	translate
how do you say fast in spanish	translate
can you translate bat into russian for me	translate
how would i say i love you if i were french	translate
how would i say i love you if i were german	translate
how does one say thank you in spanish	translate
how would they say say goodbye in hawaii	translate
how would one say cruiser in china	translate
how can i thank somebody in italian	translate
"""how do they say """"who is your father"""" in german"""	translate
how do i say thank you in japanese	translate
what phrase means goodbye in hawaii	translate
how would i say thank you if i were mexican	translate
how do they say hello in germany	translate
what's the spanish word for pasta	translate
how would i say if i were english subway	translate
dog in spanish	translate
translate hello in french	translate
how do you say please in french	translate
how could i say twin in chinese	translate
i need to know how to say hello in france	translate
how would i say where is the bathroom if i were korean	translate
how do they say no in germany	translate
translate hello to french	translate
how would i say i need directions if i were french	translate
what is the way to say thank you in spanish	translate
how would i say i am lost if i were japanese	translate
how do you say goodbye in spanish	translate
what is the equivalent of, 'life is good' in french	translate
how do i make my credit score better	improve_credit_score
what are some mistakes to avoid so that my credit score stays high	improve_credit_score
what steps should i take to improve my credit score	improve_credit_score
"""""""when the credit score improve"""	improve_credit_score
how can i build up my credit score	improve_credit_score
tell me how to improve my credit score	improve_credit_score
how can i build my credit	improve_credit_score
how do i keep my credit score from dropping	improve_credit_score
pull up ways to lower credit score	improve_credit_score
my credit score stinks but i don't know how to improve it	improve_credit_score
what can harm my credit score	improve_credit_score
what are some ways to keep my credit score up	improve_credit_score
show me a plan to help my credit score rating	improve_credit_score
would being late hurt my credit	improve_credit_score
what are the best ways to build my credit score	improve_credit_score
ways to build credit	improve_credit_score
give me tips on improving my credit score	improve_credit_score
tell me all the ways my credit score can get hurt	improve_credit_score
how can i make sure that my credit score does not decrease	improve_credit_score
what things can i do to increase my credit score	improve_credit_score
what will help my credit score	improve_credit_score
what are ways to improve my credit score	improve_credit_score
does carrying a balance hurt my credit score	improve_credit_score
do you know if bouncing one check on your checking account can hurt your credit score or not	improve_credit_score
how do i keep good credit	improve_credit_score
how to build up my credit score	improve_credit_score
i'd like to make my credit score better	improve_credit_score
what are some of the ways that i can see an improvement in my credit score	improve_credit_score
give me a recommendation to improve my credit score	improve_credit_score
can i improve my credit score	improve_credit_score
i want to keep my credit score from going down, how do i do that	improve_credit_score
are there any new harmful things that could affect my credit score	improve_credit_score
what steps can i take to build my credit score	improve_credit_score
steps to raise my credit score	improve_credit_score
is there a quick way to improve my credit score	improve_credit_score
what methods can i use to improve my credit score	improve_credit_score
how can i improve my credit score	improve_credit_score
how to keep my credit from dropping	improve_credit_score
what are some steps to building my credit score	improve_credit_score
will only having five late payments really make my credit bad	improve_credit_score
how to protect my credit score	improve_credit_score
can you explain to me how i might boost my credit score	improve_credit_score
is it true a hard pull hurts my credit score	improve_credit_score
tell me some things i can do to secure my credit rating	improve_credit_score
tell me if opening a new account will decrease my credit score	improve_credit_score
"""""""which could be improve the credit score"""	improve_credit_score
if i lose my job will my credit score go down	improve_credit_score
how can i hurt my credit score	improve_credit_score
what steps should i take if i want to ensure my credit score doesn't drop	improve_credit_score
give me some tips on building up my credit score	improve_credit_score
give me some ideas for boosting my credit score	improve_credit_score
i want to keep my credit from going down, how do i do this	improve_credit_score
help me build my credit score by showing me some ways on how to	improve_credit_score
how can i keep my credit score from falling	improve_credit_score
what steps can i take to make sure my credit score doesn't go down	improve_credit_score
how to improve a credit score	improve_credit_score
"""""""which is the best way to improve the credit score"""	improve_credit_score
i need a list of different methods for building my credit score	improve_credit_score
how do i prevent my credit score from lowering	improve_credit_score
does medical debt hurt my credit score	improve_credit_score
what is the best way to insure that my credit score doesn't decrease	improve_credit_score
give me some ways to build my credit score	improve_credit_score
what are some ways to increase my credit	improve_credit_score
how can i up my credit score	improve_credit_score
what's the best way to build credit	improve_credit_score
what can i do to keep my score from dropping	improve_credit_score
how can i safeguard my credit score from dropping	improve_credit_score
how can i build my credit score	improve_credit_score
is it possible to lower my credit score by doing this	improve_credit_score
can i hurt my credit rating if i open several credit cards in a short time frame	improve_credit_score
i'd like to improve my credit score	improve_credit_score
how is it possible to get a better credit score	improve_credit_score
what is the best thing for me to do to improve my credit score quickly	improve_credit_score
tell me if the following thing can hurt my credit score	improve_credit_score
tell me ways to improve my credit score	improve_credit_score
what steps can i take to improve my credit score	improve_credit_score
how do i build my credit score	improve_credit_score
how should i go about improving my credit score	improve_credit_score
what are some way s i can do to improe my credit score	improve_credit_score
what can i do to keep my credit in good standing	improve_credit_score
how do i build credit	improve_credit_score
i'd like to find ways to improve my credit score	improve_credit_score
can you tell me some strategies for raising my credit score	improve_credit_score
how can i go about improving my credit score	improve_credit_score
how do i maintain my credit score	improve_credit_score
how can i increase my credit score	improve_credit_score
will a loan lower my credit score	improve_credit_score
can i hurt my credit score	improve_credit_score
"""""""where is improve the credit score"""	improve_credit_score
what factors can ruin a credit score	improve_credit_score
can i protect my credit score	improve_credit_score
so how can i hurt my credit score	improve_credit_score
will doing this hurt my credit score	improve_credit_score
i want to find out if this will hurt my credit	improve_credit_score
would late payments hurt my credit	improve_credit_score
are there any videos on how to repair my credit score	improve_credit_score
how can i stop my credit score from dropping	improve_credit_score
how to improve my credit score	improve_credit_score
how to keep credit score high	improve_credit_score
what preventative measures can i take to avoid a low credit score	improve_credit_score
how do i keep my credit from lowering	improve_credit_score
i want to know if opening a new account will decrease my credit score	improve_credit_score
please confirm that opening a new account can decrease your credit score	improve_credit_score
i want to know how i can build up a good credit score	improve_credit_score
what can i do to improve my credit score	improve_credit_score
will checking your credit lower my score	improve_credit_score
are there ways for me to make my credit score better	improve_credit_score
it is damaging to my credit score if i miss one credit card payment	improve_credit_score
how can i ensure my credit score doesn't drop	improve_credit_score
give me some ideas of how to avoid my credit score lowering	improve_credit_score
what do i do to stop my credit score from going lower	improve_credit_score
how can i rehabilitate my poor credit score	improve_credit_score
how can i keep my credit score from going down	improve_credit_score
what are ways to build credit	improve_credit_score
i have a revolving store card and defaulted so will my fico score be affected	improve_credit_score
my credit is going down what should i do	improve_credit_score
how do i improve my credit score	improve_credit_score
how can i protect my credit rating	improve_credit_score
how to keep my credit score from going down	improve_credit_score
what lowers credit score	improve_credit_score
is butter ok to use instead of oil	ingredient_substitution
i don't have butter can i use oil	ingredient_substitution
is it ok to use ketchup instead of mustard	ingredient_substitution
can i use sour cream instead of yogurt	ingredient_substitution
is crushed garlic the same as powdered garlic for a spaghetti sauce	ingredient_substitution
is butter a substitute for oil	ingredient_substitution
i wanna sub sugar for salt	ingredient_substitution
can i use sour cream in place of creme fraiche	ingredient_substitution
would i be able to swap apples for grapes	ingredient_substitution
proper to substitute cumin for tumeric	ingredient_substitution
can i substitute rice for potatoes	ingredient_substitution
can i use olive oil instead of butter	ingredient_substitution
is almond milk an acceptable substitute for milk	ingredient_substitution
do you think i can sub honey for sugar	ingredient_substitution
can i use water instead of milk	ingredient_substitution
can i use milk instead of cream	ingredient_substitution
can i swap coconut milk for condensed milk	ingredient_substitution
i gotta sub sugar for salt	ingredient_substitution
can i use dark brown sugar instead of brown sugar	ingredient_substitution
it is okay to replace water instead of milk	ingredient_substitution
can i substitute yogurt for sour cream	ingredient_substitution
can i substitute milk for water	ingredient_substitution
i wanna swap salt for baking soda	ingredient_substitution
can you sub half and half for heavy whipping cream	ingredient_substitution
can i substitute apple juice for wine	ingredient_substitution
can i substitute butter for oil	ingredient_substitution
can i use skim milk instead of 2% in the recipe	ingredient_substitution
is it possible to use sausage instead of hot dog	ingredient_substitution
can i sub sugar for salt	ingredient_substitution
let me swap salt for baking soda	ingredient_substitution
cumin may be substituted for tumeric	ingredient_substitution
can i use mayonnaise instead of miracle whip	ingredient_substitution
can i substitute vinegar for apple cider vinegar	ingredient_substitution
is it okay to use applesauce instead of oil	ingredient_substitution
can i sub ketchup for mustard	ingredient_substitution
can i exchange milk for cream in recipes	ingredient_substitution
is it allow to switch apples to grapes	ingredient_substitution
can i substitute ginger for garlic	ingredient_substitution
can i switch cream with milk in a recipe	ingredient_substitution
can i get peppers instead of onions	ingredient_substitution
can i use yogurt in place of sour cream	ingredient_substitution
can i just use oil instead of vinegar	ingredient_substitution
is it acceptable to swap milk for water	ingredient_substitution
can i use pepper instead of salt	ingredient_substitution
can i substitute lemon juice for lime juice	ingredient_substitution
can i use baking powder instead of baking soda	ingredient_substitution
it is okay to use water in place of milk	ingredient_substitution
will it still work if i use applesauce instead of oil	ingredient_substitution
can i use apples instead of oranges in this recipe	ingredient_substitution
can i substitute rice milk for milk	ingredient_substitution
is honey a good sugar substitute	ingredient_substitution
is it okay to switch water for milk	ingredient_substitution
can i use coconut oil instead of olive oil	ingredient_substitution
can i use salt instead of baking soda	ingredient_substitution
is it okay to switch apples for grapes	ingredient_substitution
could i use white wine instead of red wine in a recipe	ingredient_substitution
can i take out the olive oil and use lard	ingredient_substitution
can i switch in almond butter for peanut butter	ingredient_substitution
can i use margarine instead of butter	ingredient_substitution
can i substitute skim milk for whole milk	ingredient_substitution
instead of pepper, can i use salt	ingredient_substitution
can i substitute salt for pepper	ingredient_substitution
what can i use as a substitute for yeast	ingredient_substitution
can i swap chili for sloppy joe mix in the recipe	ingredient_substitution
can i substitute butter for margarine	ingredient_substitution
will it be okay if i use water instead of milk	ingredient_substitution
can i use oil instead of vinegar	ingredient_substitution
can you just use regular milk instead of buttermilk	ingredient_substitution
i need to sub sugar for salt	ingredient_substitution
is it okay to use butter instead of margarine	ingredient_substitution
would it be ok to use butter instead of oil	ingredient_substitution
can i sub bacon for ham	ingredient_substitution
is it ok to use bananas instead of oranges in the recipe	ingredient_substitution
can i substitute lemon juice for vinegar	ingredient_substitution
can i use colby jack cheese instead of cheddar in a recipe	ingredient_substitution
will peas work instead of carrots	ingredient_substitution
can i use strawberries instead of pineapples for this	ingredient_substitution
can i substitute ketchup for mustard	ingredient_substitution
please allow me to swap salt for baking soda	ingredient_substitution
can substitute cumin for tumeric	ingredient_substitution
alternatives to white wine in food	ingredient_substitution
can i use mayo instead of miracle whip	ingredient_substitution
is it ok to sub sugar for salt	ingredient_substitution
can i swap applesauce for oil	ingredient_substitution
is it normal to use mayo instead of cheese	ingredient_substitution
can i switch cream out for milk	ingredient_substitution
will this recipe still be good if i use milk instead of eggs	ingredient_substitution
is it acceptable to swap salt for baking soda	ingredient_substitution
can i use flour as a substitute for bread crumbs	ingredient_substitution
can i swap yogurt for sour cream	ingredient_substitution
would it be ok if i have pepper and not salt	ingredient_substitution
can i substitute honey for sugar	ingredient_substitution
substitute for milk in pancakes	ingredient_substitution
is it alright to switch applesauce for oil	ingredient_substitution
will it be ok to sub turkey for beef	ingredient_substitution
can i substitute eggs for milk in a recipe	ingredient_substitution
is it possible to substitute apple cider vinegar for lemons	ingredient_substitution
if i use applesauce instead of oil, will that mess it up	ingredient_substitution
is it ok to substitute spinach for lettuce	ingredient_substitution
if a recipe calls for sour cream, can i use yogurt	ingredient_substitution
is it acceptable to swap beef for tempeh	ingredient_substitution
i wonder if it would be possible to switch from apples to grapes	ingredient_substitution
is it acceptable to swap chicken for pork	ingredient_substitution
can i substitute oregano for basil	ingredient_substitution
can i use almond milk instead of rice milk	ingredient_substitution
can i use sugar instead of salt	ingredient_substitution
can i modify the apples for grapes	ingredient_substitution
can i use apple juice instead of grape juice	ingredient_substitution
can yogurt be used for sour cream	ingredient_substitution
are you able to switch butter and oil	ingredient_substitution
is it fine to sub bread flour with all-purpose flour	ingredient_substitution
can i use a green pepper instead of a red pepper	ingredient_substitution
can i use pasta sauce instead of tomato paste	ingredient_substitution
is it ok to use brown sugar instead of powdered sugar	ingredient_substitution
is it okay to substitute oregano for basil	ingredient_substitution
let me know if i can use ketchup in place of the mustard	ingredient_substitution
can i use butter instead of margarine	ingredient_substitution
is it ok to use oil spray instead of canola oil	ingredient_substitution
are butter and oil interchangable	ingredient_substitution
i need to know if i could substitute apple sauce with eggs	ingredient_substitution
what's the weather like today	weather
what is the high temperature for tomorrow	weather
how much snow will we be getting tomorrow	weather
what is the weather outside	weather
what's is the current weather forecast	weather
what does the weather look like	weather
whats the forecast for the weather	weather
weather in costa mesa	weather
how is that weather	weather
what's the highest chance of rain for today	weather
need to know the weather now	weather
what's the chance of rain	weather
what is the current weather like	weather
how is the weather in austin	weather
how is it outside	weather
weather forecast please	weather
what is the weather in atlanta	weather
what's today's weather going to be	weather
what can you tell me about miami weather	weather
is it snowing right now in richmond, va	weather
what is the weather report for seattle	weather
how cold will it be tomorrow	weather
what does the forecast look like	weather
is it going to rain today	weather
when is the next time it is suppose to rain	weather
is there a uv or smog alert for tomorrow	weather
how's the weather in seattle	weather
is it raining	weather
