text	label
Could you help my figure out the exchange fee?	exchange_charge
Is there an extra charge to exchange different currencies?	exchange_charge
Do I need to pay extra for exchanging currencies?	exchange_charge
I exchange my currency quite a bit.  Do I get an exchange price break?	exchange_charge
How much to exchange currencies?	exchange_charge
Can you tell me about the exchange fee?	exchange_charge
Are there any fees when exchanging to foreign currencies?	exchange_charge
Will there be a charge for exchanging foreign currency?	exchange_charge
What is the rate for exchange fees?	exchange_charge
Do I need to pay more for exchanging currencies?	exchange_charge
what is the cost for exchanging currencies?	exchange_charge
Will I have to pay extra to exchange money?	exchange_charge
Is there a pay structure for currency exchanges?	exchange_charge
My currencies needed to be exchanged often and I was wondering if there were any discounts available for this?	exchange_charge
What is the exchange fee that is charged?	exchange_charge
IS there a fee to exchange currency?	exchange_charge
How much will I be charged for a cross-currency exchange?	exchange_charge
Exchange fee help?	exchange_charge
If I exchange currencies frequently, is there a discount?	exchange_charge
Are there discounts for frequent currency exchanges?	exchange_charge
What is the charge for exchanging currencies?	exchange_charge
What is the charge for exchanging currency?	exchange_charge
What is your currency exchange fee?	exchange_charge
Can I be charged for exchanging foreign currency?	exchange_charge
Is there an additional cost to exchange currencies?	exchange_charge
What's the cost for exchanges?	exchange_charge
What commission do you take for currency exchage?	exchange_charge
How much more do you charge for currency exchange?	exchange_charge
What kind of costs are involved for exchanging currency?	exchange_charge
Are currency exchanges free?	exchange_charge
are there any exchange fees	exchange_charge
How much extra will I be charged for exchanging foreign currency?	exchange_charge
Do you offer a discount for those who perform frequent currency exchanges?	exchange_charge
Does a discount apply if I exchange currencies frequently?	exchange_charge
How much do I have to pay to accept an international transfer?	exchange_charge
is there a foreign currencies charge?	exchange_charge
I need to exchange some foreign currency. What's the charge for doing that?	exchange_charge
Is it possible to have a discount for exchanging currency frequently?	exchange_charge
What fee will be charged for exchanges?	exchange_charge
Do I get any sort of discount on volume for a lot fo currency exchanges?	exchange_charge
Is there a fee for currency exchange?	exchange_charge
Are there any hidden extra fees for currency exchanges?	exchange_charge
When exchanging currencies, is there an extra fee?	exchange_charge
Since I need to exchange currencies frequently, would you be able to offer me a discount?	exchange_charge
Are there any discounts for frequent currency exchanges?	exchange_charge
What's the exchange fee?	exchange_charge
How much is the exchange fee?	exchange_charge
Please tell me what the exchange fee is.	exchange_charge
where do i find out about exchange fees	exchange_charge
Do exchanges cost more?	exchange_charge
Any extra charges for exchanging currencies?	exchange_charge
What is the cost for currency exchanges?	exchange_charge
What exactly is the exchange fee?	exchange_charge
Do I pay extra for exchange?	exchange_charge
I have foreign currency i would like to change how much will it cost me?	exchange_charge
How much does it cost to exchange my balance into a foreign currency?	exchange_charge
I wanted to know what discounts were offered for current exchanges as it is something that occurs frequently.	exchange_charge
What's the fee for exchange of foreign currencies?	exchange_charge
If I exchange currencies on a frequent basis can I receive a discount?	exchange_charge
I travel a lot, can I get a bulk currency exchange discount?	exchange_charge
Do I have to pay more for exchanges?	exchange_charge
Will you charge me for exchanging foreign currencies?	exchange_charge
Is it free to exchange currency?	exchange_charge
is there a frequent currency discount?	exchange_charge
What are the currency exchange fees?	exchange_charge
How much do you charge for exchange rates?	exchange_charge
If I exchange currencies on a regular basis, is there a discount?	exchange_charge
If I exchange foreign currency, are there any other charges?	exchange_charge
Please provide currency exchange rates	exchange_charge
Will there be a cost if I exchange currency?	exchange_charge
Is there a charge for exchanging foreign currencies?	exchange_charge
What is the current exchange fee?	exchange_charge
If someone in a different country sends me money, do I have to pay a fee?	exchange_charge
Do yo charge a fee for exchanging foreign currencies?	exchange_charge
Currency exchanges have any extra fees?	exchange_charge
I've been to several different countries, can I exchange the cash with a discount for a large transaction?	exchange_charge
how much do I have to pay for exchange of currency?	exchange_charge
Is there a discount for multiple currency exchanges?	exchange_charge
Is there any cost to change foreign money to local?	exchange_charge
Will there be any extra fees if I exchange currencies?	exchange_charge
Would I need to pay extra for currency exchanges?	exchange_charge
What is the currency exchange fee?	exchange_charge
how much is it to exchange currency	exchange_charge
How much does currency exchange cost?	exchange_charge
exchanging currencies costs what?	exchange_charge
Are there any extras for exchanging currency?	exchange_charge
Do you charge a fee on currency exchange?	exchange_charge
always exchanging currencies, do you offer a discount?	exchange_charge
What do you charge for an exchange fee?	exchange_charge
Does it cost extra to exchange foreign currencies?	exchange_charge
Would you be able to offer me a discount, since I need to exchange currencies frequently?	exchange_charge
Is there a fee for exchanging currency?	exchange_charge
Is there a charge for exchanging foreign currency?	exchange_charge
Are there any discounts in exchanging currencies frequently?	exchange_charge
How much is the charge for a foreign currency exchange?	exchange_charge
What is the fee for a foreign currency exchange?	exchange_charge
If I exchange currency frequently, can I get a discounted rate?	exchange_charge
Do you charge extra for exchanging currencies?	exchange_charge
Will I get charged on a foreign currencies exchange?	exchange_charge
Will I be charged an extra fee if I need to exchange currency?	exchange_charge
My job requires me to do a lot of exchanging currency, and I was wondering about any possible discounts or lower prices.	exchange_charge
Can you tell me what the exchange fee is?	exchange_charge
I need to exchange foreign currency will i be charged?	exchange_charge
Do you offer any discounts for someone who exchanges currencies frequently?	exchange_charge
Does it cost anything to do currency exchanges?	exchange_charge
Is there an additional charge to exchange currencies?	exchange_charge
Is there an extra fee to exchange currencies?	exchange_charge
Is there any type of fee for currency exchange?	exchange_charge
Do currency exchanges cost extra?	exchange_charge
i have a pending top-up	pending_top_up
My top up is still pending	pending_top_up
Should my top-up be completed by now?	pending_top_up
How long should it take for my top-up to finish? I've been waiting a while.	pending_top_up
I topped up about half an hour ago and the charge is still pending. I'm a new customer and today is my first time doing this. Can you fix it? It doesn't seem to be working.	pending_top_up
Please explain why my top-up hasn't been processed yet?	pending_top_up
There is a top up that has been pending for an hour and I don't know why.  I was expecting it immediately and need it now!	pending_top_up
I attempted to top up my account but it's been frozen in a pending state for well over an hour now! Is this normal? I'm a new customer and this is my first time doing this. I assumed it would be done quicker than this.	pending_top_up
Is there a reason that my top-up is still pending?	pending_top_up
new customer and filling gas for the first time today, not working,	pending_top_up
How long is a top up supposed to be pending, because an hour is too long! Can you fix this to go through?	pending_top_up
Seems like my top-up has not gone through	pending_top_up
I topped up but it isn't in my account	pending_top_up
My top up has been pending for an hour already, and I really need this to go through as soon as possible.  Can you help?	pending_top_up
Can you look into why my most recent top-up is showing as pending? I thought it was supposed to be instantaneous.	pending_top_up
Should my top up still be pending?	pending_top_up
I think something is wrong with your top up.  I've been waiting a little over an hour for this to go through, can you send it through for me?	pending_top_up
When will my top-up happen?	pending_top_up
Im trying to top up my card but it's still pending and it's been an hour. Is there any way to make it go through faster? Do I not have enough?	pending_top_up
How long does a top-up take to go through?	pending_top_up
Sort your top up out please! It's been pending since an hour already, can you please make this go through asap I really need the money	pending_top_up
What does it mean if my top-up has not gone through?	pending_top_up
Something is wrong with the top up! I'm a regular customer and use your service all the time, usually this works but now it just shows up as pending	pending_top_up
When will my top up be approved?	pending_top_up
It is still pending, I am still waiting. Your system just shows my top-up as pending. What is happening?	pending_top_up
Hello, I'm a brand new customer and tried topping up for the first time today. It has been pending for half an hour and doesn't seem to be working. Please resolve this.	pending_top_up
My top up keeps showing pending?  How long will things be like this?  Days, weeks, months?  I need the money quite urgently for an important coffee purchase, can you please let me know when top up will work?	pending_top_up
Is there a reason my top-up has not gone through?	pending_top_up
My top-up hasn't happened yet.	pending_top_up
Says that my top-up is incomplete?	pending_top_up
I think my top up is still pending?	pending_top_up
How come my top-up didn't go through instantly, like it usually does?	pending_top_up
How long does it take for a top-up?	pending_top_up
Tell my why my top-up is pending.	pending_top_up
How long does it take for a top up to be approved?	pending_top_up
Can you tell me why my pop-up is still pending?	pending_top_up
how long should i expect to wait when i add money	pending_top_up
When will my top-up be completed?	pending_top_up
I have a top-up that's still pending and wanted to know about it.	pending_top_up
Hello, I am a new customer, and just tried topping up for the first time. According to your information, the transaction should be instant - why does it still show as pending?	pending_top_up
My top-up has not posted.	pending_top_up
I tried topping up for the first time today since I am a new customer. It doesn't appear that it's working. It has been pending for at least half an hour. Please take care of this.	pending_top_up
My top up is pending still	pending_top_up
Why hasn't my top-up gone through?	pending_top_up
I just made a top-up but it shows as pending! I use your service all the time and have never had a problem before. Why does it keep showing up as pending?	pending_top_up
I topped up last night but don't have any funds, why not?	pending_top_up
My top-up is still pending	pending_top_up
What if my top up doesn't go through?	pending_top_up
I used my card to top up but it's saying it is still pending. What does this mean?	pending_top_up
top up is still pending	pending_top_up
I tried to top up, but it didn't finish.	pending_top_up
Problem with my top up going through	pending_top_up
Yesterday I topped up my card. Why didn't it complete as it still pending?	pending_top_up
How long will it take for my money to be deposited?	pending_top_up
My top-up didn't go through; it still says pending. What's up with that?	pending_top_up
Isn't my top-up supposed to mean its complete?	pending_top_up
top up not completed	pending_top_up
why is top up pending	pending_top_up
How do I know if my top-up went through?	pending_top_up
I added money to the card but the transaction didn't go through	pending_top_up
Needed gas, been delayed for half an hour.Please fix it!	pending_top_up
My top up did not complete.	pending_top_up
The top-up is broken.	pending_top_up
Even though I added money ey to the card, I couldn't use it	pending_top_up
My top-up is taking a very long time to complete.	pending_top_up
I topped up and went to buy something, but it says that my funds are pending. Is there a way to quicken this process?	pending_top_up
It appears my top-up is still pending.	pending_top_up
I can't find the money I just added to my account.	pending_top_up
Why is the top-up I made still pending.	pending_top_up
I believe my top up is still pending	pending_top_up
I've been waiting for over an hour for a top up to go through.  How long is this supposed to take?  I really need this money.	pending_top_up
How long will my top-up stay pending?	pending_top_up
Where to check top ups pending?	pending_top_up
How long do top-ups take to go through	pending_top_up
My top up says it is still pending	pending_top_up
When will my top up be applied?	pending_top_up
I'm pretty sure my top up is still pending.	pending_top_up
Why has my top up not gone through yet?	pending_top_up
I'm waiting on a top-up, its still pending	pending_top_up
How long will it take for my top up to work? It's still pending	pending_top_up
Please sort your top up! My top up has been pending for an hour already. Can you please make it go through as soon as possible. I really need the money.	pending_top_up
i put money on my card and i dont see it on the balance	pending_top_up
How long will my top-up be pending?	pending_top_up
Why can't I see my funds after I topped up?	pending_top_up
I already paid to top-up but the funds aren't available yet, where are they?	pending_top_up
What happened to my Top-Up? It's not reflected.	pending_top_up
My account is  new  why can I  not top up	pending_top_up
When will my top-up go through?	pending_top_up
Help, I don't see my money i just added.	pending_top_up
I am under the impression that my top up is still pending	pending_top_up
What's taking my top-up so long?	pending_top_up
What is the reason my top-up is still pending?	pending_top_up
Why is  my  top  up for  my  new account  not  instant	pending_top_up
How long do I need to wait til my top up isn't pending?	pending_top_up
How long does it take for my top up to clear?	pending_top_up
I'm still waiting for my top-up to go through	pending_top_up
How long after a failed topup will funds refurn to account	pending_top_up
Can you tell me what is wrong ? I top-up with you all the time but this time it just shows my top-up as pending. What is happening?	pending_top_up
My top up is incomplete.	pending_top_up
My top-up is taking a while to process!	pending_top_up
Why hasn't my top up gone through?	pending_top_up
My top up hasn't gone through yet, why?	pending_top_up
how long does it take to reflect in my balance a top up	pending_top_up
How long does my top up pending last?	pending_top_up
My top up did not go through yet.	pending_top_up
Is my top up not working?	pending_top_up
When will my top up go through?	pending_top_up
I'm still waiting for the top-up!	pending_top_up
My top-up seems to be pending for a long time?	pending_top_up
How long should I wait for top up go go through ?	pending_top_up
I do not think the pop up went through yet.	pending_top_up
Why is my top-up pending?	pending_top_up
Top-up is loaded into the card and no update.	pending_top_up
My money hasn't been deposited yet. When will it be?	pending_top_up
Why is my top up not completing?	pending_top_up
I tried to top up, but the funds show up as pending. I thought it was instant?	pending_top_up
Is there a problem with the top up system? My transaction hasn't gone through properly	pending_top_up
What is wrong with my top-up?	pending_top_up
My top is still pending.	pending_top_up
Did I do something incorrectly? Where is my top-up?	pending_top_up
Where are my funds? I topped off my car but it didn't seem to complete.	pending_top_up
My top-up hasn't gone through	pending_top_up
why isn't my top-up going through?	pending_top_up
How long does it take for a top up to go through	pending_top_up
Hi, I tried topping up for the first time today (I'm a new customer), and the transaction has shown as pending for the last half an hour. Can you fix it?	pending_top_up
Is there something wrong with my top up I did an hour ago? it's still pending. I need that money, i cant afford to wait or have it come back to me.	pending_top_up
When will my top up process?	pending_top_up
It appears my top-up has not gone through.	pending_top_up
Can you please sort out your top up? I need this to go through asap because I really need the money. It's already been pending for an hour.	pending_top_up
I'm a new customer and tried topping up today for the first time. It's still pending and doesn't seem to be working. I need to get this fixed.	pending_top_up
It's been some time since refilled the top-up.	pending_top_up
I topped-up my account, but I don't think it went through.	pending_top_up
What is the reason that my top-up is still pending?	pending_top_up
Can you explain to me why a top-up would still be pending?	pending_top_up
What card or currency can I use to pay?	supported_cards_and_currencies
Are cards from the US accepted?	supported_cards_and_currencies
How do I use American express to top up my account?	supported_cards_and_currencies
Which currencies can I use to add money?	supported_cards_and_currencies
How can I top up my card with another card?	supported_cards_and_currencies
can i add funds  with a card from the united states	supported_cards_and_currencies
Is American Express accepted?	supported_cards_and_currencies
Why doesn't it work when I use American Express to try to add money to my account?	supported_cards_and_currencies
Am I able to add money into my account using my American Express?	supported_cards_and_currencies
I have a US credit card, will you accept it?	supported_cards_and_currencies
With what currencies can I add money?	supported_cards_and_currencies
What currencies do you accept for adding money?	supported_cards_and_currencies
What forms of payment do you accept?	supported_cards_and_currencies
Do you have a list of the cards and currencies supported?	supported_cards_and_currencies
Do you accept credit cards from the US	supported_cards_and_currencies
Am I able to use my American Express to add money to my account balance?	supported_cards_and_currencies
If I top up by card, what options do I have re: currency and card type?	supported_cards_and_currencies
what currencies can i use to add money to my account	supported_cards_and_currencies
Do you accept US credit cards?	supported_cards_and_currencies
use my credit to add money	supported_cards_and_currencies
why wont my american express work to add money	supported_cards_and_currencies
can i top up from a usa credit card	supported_cards_and_currencies
For adding money, which currencies do you accept?	supported_cards_and_currencies
What are the acceptable currencies for adding funds?	supported_cards_and_currencies
What kinds of cards can I use to top up?	supported_cards_and_currencies
what cards can i use to add money to my account	supported_cards_and_currencies
I'd prefer to use my American Express when putting funds into my account.	supported_cards_and_currencies
What currency can I use to add money?	supported_cards_and_currencies
I want to add money to my card, what payments do you accept?	supported_cards_and_currencies
Can I use American Express?	supported_cards_and_currencies
Can I use a credit card from the US to top up?	supported_cards_and_currencies
If I want to add funds to the account using American Express, how do I do that?	supported_cards_and_currencies
How can I pay for top-ups?	supported_cards_and_currencies
Which cards and currencies are supported?	supported_cards_and_currencies
Which currencies do you accept for adding money?	supported_cards_and_currencies
What are the currencies that are accepted to add money?	supported_cards_and_currencies
What currencies do you accept to add money?	supported_cards_and_currencies
How can I get funds into my account from my American Express?	supported_cards_and_currencies
What other credit cards can I use?	supported_cards_and_currencies
I only have a card from the US is that okay?	supported_cards_and_currencies
What cards and currencies can I use?	supported_cards_and_currencies
What US cards do you accept?  I only have 1 other.	supported_cards_and_currencies
Do you accept all cards and currencies?	supported_cards_and_currencies
I want to know which currencies and cards are supported, can you provide a list?	supported_cards_and_currencies
Do I have to top up in euros if I use a card, or can I use a different currency?	supported_cards_and_currencies
How can I use my American Express to add money into my account?	supported_cards_and_currencies
Can you tell me what cards and currencies you support?	supported_cards_and_currencies
What US credit cards do you accept?	supported_cards_and_currencies
Is my credit card supported for top-ups?	supported_cards_and_currencies
How can I fund another account with my American Express?	supported_cards_and_currencies
What payment methods are used to top up?	supported_cards_and_currencies
I want to add funds to my account. What payment methods are accepted?	supported_cards_and_currencies
What types of cards and money do you accept?	supported_cards_and_currencies
I have one other credit card from the US. Do you take that?	supported_cards_and_currencies
How can I top up my account and which currency can I use?	supported_cards_and_currencies
I wish to use my American Express to put funds into my account.	supported_cards_and_currencies
Can I top off with a debit card?	supported_cards_and_currencies
Is American Express supported for adding money into my account?	supported_cards_and_currencies
What currency can I use to pay for a top up?	supported_cards_and_currencies
Which credit card top-ups do you accept?	supported_cards_and_currencies
What currencies are accepted to add money?	supported_cards_and_currencies
I have a second credit card from the US. Will you take it?	supported_cards_and_currencies
Can I electronically transfer funds into my account from my American Express?	supported_cards_and_currencies
Do you accept any card and currency?	supported_cards_and_currencies
Which cards do you support for top up?	supported_cards_and_currencies
Do you have a list of cards and currencies you support?	supported_cards_and_currencies
Are there certain cards and currencies you support?	supported_cards_and_currencies
Which currencies do you work with?	supported_cards_and_currencies
I want to deposit funds, what payments are accepted?	supported_cards_and_currencies
What cards do you accept to top up my account?	supported_cards_and_currencies
how can i transfer money from american express card	supported_cards_and_currencies
What kind of cards are supported?  What currency?	supported_cards_and_currencies
Do you accept Mastercard?	supported_cards_and_currencies
I want to top up my account. What payment methods are supported?	supported_cards_and_currencies
how can i add money from my amex card	supported_cards_and_currencies
Please let me know what currency I can use to top up my account?	supported_cards_and_currencies
Will you accept my credit card, it my only one.	supported_cards_and_currencies
Can I use my American Express card to add money into my account?	supported_cards_and_currencies
Can I use this app for any currency?	supported_cards_and_currencies
Which foreign currencies do you accept for adding money?	supported_cards_and_currencies
What kind of cards an currency do you support?	supported_cards_and_currencies
I am adding money, what currencies do you accept to do this?	supported_cards_and_currencies
Can I use any card and currency?	supported_cards_and_currencies
do you accept from usa credit card?	supported_cards_and_currencies
I only have one other credit card from the US. Do you accept that?	supported_cards_and_currencies
I just have one additional card from the USA. Do you support that?	supported_cards_and_currencies
what cards and currencies are accepted?	supported_cards_and_currencies
I have one other credit card from the US. Do you take it?	supported_cards_and_currencies
If I want to topup by card, how do I do it?	supported_cards_and_currencies
I want to use my American Express for adding money into my account.	supported_cards_and_currencies
What type of card can I use to top up?	supported_cards_and_currencies
What are my payment options?	supported_cards_and_currencies
What currency is acceptable for a top up?	supported_cards_and_currencies
What currencies are approved to add money?	supported_cards_and_currencies
What cards and currencies can I use to top up my account?	supported_cards_and_currencies
can i use my mastercard to add money to my account	supported_cards_and_currencies
What currencies can I use?	supported_cards_and_currencies
