text	label
A transaction I did to my friend hasn't arrived yet, why?	transfer_not_received_by_recipient
wheres my money receipt	transfer_not_received_by_recipient
How much time do transfers typically take? I sent money to a friend who needs it urgently. It's been hours and has not gone through.	transfer_not_received_by_recipient
I sent a payment, but the person I sent it to says they don't have it	transfer_not_received_by_recipient
Why is the transaction to my friend still pending?	transfer_not_received_by_recipient
I'm still expecting the transaction to be finished	transfer_not_received_by_recipient
I transferred some money but it hasn't arrived.	transfer_not_received_by_recipient
I tried doing an in country transfer earlier this week. I thought it would be there by now but I still don't see the money. Can you check the status on my transfer?	transfer_not_received_by_recipient
My friend says he hasn't received my transaction	transfer_not_received_by_recipient
I do not know where the transaction is.	transfer_not_received_by_recipient
Where did the money transfer go?	transfer_not_received_by_recipient
I sent money about 5 days ago and the recipient has not received the money yet.	transfer_not_received_by_recipient
Recipient has not received the money	transfer_not_received_by_recipient
I'm still waiting for my transaction.	transfer_not_received_by_recipient
|I moved out of my old house two weeks ago and cancelled my direct debit to my old landlord, this direct debit was working fine.  Now I've moved in to a new place and set up a transfer to a new landlord but it's not reached her yet, can you check it please?	transfer_not_received_by_recipient
How long does it take for the transfer to go through?	transfer_not_received_by_recipient
Why hasn't a transaction I did to my friend arrived yet?	transfer_not_received_by_recipient
How much time do transfers take? I sent money to a friend who needs it fast. It's been hours, and the money has not gone through.	transfer_not_received_by_recipient
I set up a payment to a new payee and sent some money but the person I'm sending it to has not received it.  Can you check where the money is?	transfer_not_received_by_recipient
How long should a transfer normally take to process completely? I have a friend that needs it right away, but it's already been 2 hours and she hasn't received it.	transfer_not_received_by_recipient
I performed a transfer within the country the day before yesterday, but it has not gone through? Can you check on that? The account number is definitely correct, as I've checked.	transfer_not_received_by_recipient
How long will my transaction take?	transfer_not_received_by_recipient
How long does it typically take a transfer to go through?  I sent some money to a friend earlier today, and she really needs it.  It still is a pending transfer, even though I sent it a few hours ago.	transfer_not_received_by_recipient
I am just waiting for the transaction to be completed.	transfer_not_received_by_recipient
Why has my transfer not arrived yet?	transfer_not_received_by_recipient
I transferred some cash and it didn't arrive	transfer_not_received_by_recipient
The money has not yet been placed in recipients account.	transfer_not_received_by_recipient
I need to transfer some money to a friend who is in urgent need of some fast cash. How long will it take before she can use that money?	transfer_not_received_by_recipient
What is the time frame that it usually takes for a transfer to come through? I have a friend needing it immediately but it has yet to come through.	transfer_not_received_by_recipient
I have moved to a new house and set up a rent payment to my landlord, it was supposed to be in her account a few days ago but it hasn't arrived.  I definitely sent it to the right place, can you confirm where the money is?	transfer_not_received_by_recipient
Why hasn't my transaction been completed?	transfer_not_received_by_recipient
Why hasn't my friend received the money i sent them yet?	transfer_not_received_by_recipient
i've waited 2 days for a transfer to reach a retailers account, am i going to have to wait longer.	transfer_not_received_by_recipient
What do I do if I completed a money transfer but the recipient hasn't received it?	transfer_not_received_by_recipient
My transfer isn't in	transfer_not_received_by_recipient
When will the transaction be done?	transfer_not_received_by_recipient
After taking over my card transactions I noticed that was charged twice for a restaurant purchased from earlier this week. Can you please remove one of these transactions from my account since it is not accurate?	transaction_charged_twice
Why did my card get charged twice for a transaction?	transaction_charged_twice
I made a payment and it appears it is showing twice	transaction_charged_twice
One of my payments was doubled	transaction_charged_twice
My card is showing multiple charges for the same items on my recent statement. I was wondering what actions of needed to take to fix this issue	transaction_charged_twice
I got double charged from something, what can I do?	transaction_charged_twice
Why do I have duplicate transactions for one purchase?	transaction_charged_twice
I have have multiple charges for one transaction.	transaction_charged_twice
Why have I been charged more than once for the same transaction?	transaction_charged_twice
Why does my statement show various transaction times?	transaction_charged_twice
Why do I have a transaction showing up more than once?	transaction_charged_twice
A duplicated payment was made for something.	transaction_charged_twice
Looks like my card payment was duplicated after all. I went to pay at the store earlier, got declined once, second time it works. App still stays pending for one of the payments. Can you please remove one of them as it's wrong and clearly was declined?	transaction_charged_twice
I went for a meal in Seattle and paid the bill but I think they charged me twice, the first time they swiped the card I got a notification to say the money had gone out the account but then I added a tip and I think they swiped it all again. Can you refund one of the charges?	transaction_charged_twice
Who do I talk to for transactions debited twice?	transaction_charged_twice
Is there a reason to why I was charged twice for a transaction?	transaction_charged_twice
Hello,  I am a college student who I recently attended my high school reunion at a local restaurant. I paid with my credit card and now my transaction history reflects a second charge of the seemingly same payment. What could be the reason for this?  Is there any way to have the fraudulent  payment credited back onto my card?	transaction_charged_twice
Looks like my card payment was duplicated after all. I went to pay at the store earlier, got declined once,second time it works. App still stays pending for one of the payments. Can you remove one of them as it's wrong and clearly was declined?	transaction_charged_twice
Will the duplicated payment be refunded?	transaction_charged_twice
I was charged for the same thing twice	transaction_charged_twice
There is the same transaction showing more than once.	transaction_charged_twice
I have been charged for one thing two times.	transaction_charged_twice
I have been charged twice for the same thing!	transaction_charged_twice
I have noticed that my account was double charged for a couple of items this week. Please review and refund the double charged items back.	transaction_charged_twice
Why was I double charged?	transaction_charged_twice
I got charged in double and want a refund	transaction_charged_twice
I noticed that my card was charged more than once for one thing.	transaction_charged_twice
What do I do if I have been charged twice?	transaction_charged_twice
I was charged twice for the same thing.	transaction_charged_twice
I have been double charged	transaction_charged_twice
I have a duplicate payment on my account	transaction_charged_twice
I have multiple of the same transaction	transaction_charged_twice
My transaction history is looking a little off. I have been charged twice for multiple different purchases, and would like to have those duplicate charges refunded.	transaction_charged_twice
Hi, I was at a restaurant later the week and when I went to look at my account I noticed that I got charged twice. I would like to get my money back from one of those transactions.	transaction_charged_twice
I think I got charged twice for the same thing	transaction_charged_twice
My account seems a bit off and getting weird charges.	transaction_charged_twice
I had a duplicate card and bought something and it showed up twice. I canceled my card, how do I get my money back?	transaction_charged_twice
I was charged twice for a restaurant, can you take the second charge off?	transaction_charged_twice
I was charged multiple times for one purchase	transaction_charged_twice
Why is there are there two of the same transaction?	transaction_charged_twice
I was double-charged for a transaction	transaction_charged_twice
My card is showing the same transaction over and over again.	transaction_charged_twice
I got charged twice with a duplicate card. How do I resolve this?	transaction_charged_twice
Hi, I checked my transactions and saw that I was charged twice during a restaurant visit. I would like to get my money back.	transaction_charged_twice
A transaction is showing more than once.	transaction_charged_twice
My account was charged twice for one purchase	transaction_charged_twice
I was charged twice for an in-store purchase that I thought was declined.  My App says that it's still pending for one of the payments. Please make sure one of the charges is removed.	transaction_charged_twice
My statement shows different transaction times.	transaction_charged_twice
I have a transaction that shows multiple times.	transaction_charged_twice
Hello, I just checked my card transactions and saw that I was charged twice for a restaurant visit I did earlier this week. Is it possible to remove one of them and get my false paid money pack?	transaction_charged_twice
Hi. I noticed I have a duplicate charge which I have not made twice. Who should I talk to take care of this?	transaction_charged_twice
I got double charged!	transaction_charged_twice
I was charged multiple times for one transaction.	transaction_charged_twice
Why does the same transaction appear multiple times?	transaction_charged_twice
A transaction shows duplicate times.	transaction_charged_twice
My bill shows the same charge more than once	transaction_charged_twice
I think I was charged double for something I bought - how long should I wait before reporting this?	transaction_charged_twice
Looks like my card payment was made twice by mistake. I went to pay at the store earlier which rejected once, second time it worked. App is on pending for one of the payments. Can you please remove one of them as it's wrong and clearly was declined?	transaction_charged_twice
I made a payment and it is showing up twice	transaction_charged_twice
I received duplicate charges.	transaction_charged_twice
There are two of the same charge on my statement.	transaction_charged_twice
I think I was charged twice, please help!	transaction_charged_twice
Hey there, I just went through my most recent credit card payments and I notice the same charge for a restaurant was processed twice. There was only one meal at this place, so I would like one of the charges to be reversed and my money to be put back in the account.	transaction_charged_twice
Why does a payment show up twice?	transaction_charged_twice
Several items I have charged this week are appearing twice.  Please review my statement and remove any duplicate charges.	transaction_charged_twice
There is a repeat charge for the same item	transaction_charged_twice
Duplicate transactions appear on my account	transaction_charged_twice
It appears as though my card payment was duplicated. I paid at the store earlier today. The first time it was declined and the second time it worked. The app is still showing one of the payments to be pending. Please take one of these off because clearly the first was declined and is not correct.	transaction_charged_twice
There is a duplicate payment on my card. Why?	transaction_charged_twice
I've got a repeated tranasaction on my card.	transaction_charged_twice
Why do I have a transaction showing multiple times?	transaction_charged_twice
Why was I charged twice for my item!	transaction_charged_twice
I noticed a duplicate charge on my statement.	transaction_charged_twice
I am concerned that I am being doubled charged for several items purchased in the past week.  Please review my statement and correct.	transaction_charged_twice
I was charged several times for something	transaction_charged_twice
I have been charged twice this week for a couple of things on my card. Can you please check this out for me and return the double charged items back?	transaction_charged_twice
I have been charged two times for one transaction.	transaction_charged_twice
Looking at my statement I see that I was double charged for a payment I made.	transaction_charged_twice
How can I fix this?  There is a double charge on my account.	transaction_charged_twice
Hi, I just looked at my card transactions and saw that I've been charged twice for a restaurant I went to this week. Can you remove the double charge, please?	transaction_charged_twice
I have duplicate charges for the same transaction	transaction_charged_twice
Hello. I checked my transactions and saw I was double charged for a restaurant visit. Can I get my money back?	transaction_charged_twice
It looks like I was charged twice for a single transaction	transaction_charged_twice
One of my charges was declined, but the second one went through.  But I notice on my App that one of them has gone through, and the other one is still pending.  Please ensure that only one charge is processed. Thanks	transaction_charged_twice
I have a transaction showing up more than once.	transaction_charged_twice
Why did I get charged more than once?	transaction_charged_twice
I have duplicated transactions on my statement	transaction_charged_twice
Hello, I was just went through my recent transaction on my bank account and I just noticed that I was charged twice at a place that ate at this past week. Can I get that second transaction removed from my account?	transaction_charged_twice
I was charged two times for the same thing.	transaction_charged_twice
Good day, in reviewing my credit card activity over the last several days, I see a repeated charge for a restaurant that I went to. The charge was put through twice, so I would like one of the charges corrected and the amount that was withdrawn to be reinstated please.	transaction_charged_twice
Hi. Please can you help me fix a double charge on my card? I'm looking at my transactions and this restaurant I went to earlier in the week has charged me twice! Please remove the additional charge for me.	transaction_charged_twice
I was charged twice, when I didn't purchase anything twice.	transaction_charged_twice
I was charged twice.	transaction_charged_twice
How come there is a duplicate charge on my card?	transaction_charged_twice
Help, I was charged twice!	transaction_charged_twice
I have been charged twice for the same transaction.	transaction_charged_twice
Why was I charged twice?	transaction_charged_twice
What do I do if I've been charged twice for the same transaction?	transaction_charged_twice
Why have I been charged twice?	transaction_charged_twice
I have two of the same charges on my account!	transaction_charged_twice
I was charged too many times for one transaction.	transaction_charged_twice
Please delete the duplicate payment that was made to my account. One payment is still pending and I do not want to pay twice.	transaction_charged_twice
I have a duplicate payment on my card.	transaction_charged_twice
My account shows I have been charged twice for the same meal. How do I get the second payment voided and returned to me? I do not eat out much and my family is living paycheck to paycheck,  mostly. I cannot afford to spend more money than necessary, as is, so I must see to it that the cost be promptly credited back onto my card.	transaction_charged_twice
Why is there a payment showing twice?	transaction_charged_twice
Can you help me? I have a duplicate transaction on my account and I don't understand why.	transaction_charged_twice
Why did I get charged twice for the same thing	transaction_charged_twice
Why do I have two charges It should only be one charge?	transaction_charged_twice
I think there is a mistake.  I am being charged twice.	transaction_charged_twice
I have a duplicate charge	transaction_charged_twice
I was charged more than once for a card payment I made.	transaction_charged_twice
How do I query a payment on my card? It looks like I have paid for the same thing twice.	transaction_charged_twice
What do I do if a transaction shows up twice?	transaction_charged_twice
Can you explain the various transaction times shown on my statement?	transaction_charged_twice
Who should I talk to or go to resolve a duplicate charge on my statement?	transaction_charged_twice
There is a duplicate charge on my account.	transaction_charged_twice
Looks like my card payment was made two time by mistake. I went to pay at the store earlier which rejected once, second time it worked. App is on pending for one of the payments. Can you please remove one of them as it's wrong and clearly was declined?	transaction_charged_twice
I see a duplicate payment.	transaction_charged_twice
There is more than one charge on my account for a transaction.	transaction_charged_twice
There's a duplicate charge on my account?	transaction_charged_twice
I was charged multiple times at the same location at the same time	transaction_charged_twice
Transaction showing up many times.	transaction_charged_twice
The first payment I attempted for my card at the store earlier did not process so I had to make a second attempt. The second time it worked. It now appears I was charged twice. After looking at the app I see a pending charge. Please remove the pending amount because it is clearly not accurate and was declined.	transaction_charged_twice
I got charged twice for the same payment. Please removed the pending payment. Thank you.	transaction_charged_twice
Looks like my card payment was made twice by mistake. I paid at the store earlier which rejected once, second time it worked. App stays at pending for one of the payments. Can you please remove one of them as it's wrong and clearly was declined?	transaction_charged_twice
There is a transaction showing up several times.	transaction_charged_twice
"My husband and I went out for our weekly ""dinner and a movie,"" and it was my turn to pick up the check. Now I see that my card was charged twice. Who should I contact about negating the second charge and getting my card credited?"	transaction_charged_twice
How do a reverse a duplicated charge?	transaction_charged_twice
A transaction posted twice to my account.	transaction_charged_twice
Why am I getting double charged for multiple transactions?	transaction_charged_twice
Why am i being double charged for something?	transaction_charged_twice
My account is showing a double charge.	transaction_charged_twice
My transaction is showing several times.	transaction_charged_twice
Please tell me why the same transaction is showing up on my account more than once.	transaction_charged_twice
It seems my card payment was completed twice. I paid at the store previously and the first one did not seem to go through. After a second attempt, it did go through. I now see within the app that I have been charged twice with one of them pending. Can you please remove the pending amount because it is clearly something that was declined?	transaction_charged_twice
You charged me more than once for the same transaction!	transaction_charged_twice
I'm really concerned because I only made one transaction, but it's appearing multiple times.	transaction_charged_twice
I have a transaction showing multiple times.	transaction_charged_twice
How do I get my money back for a duplicated charge?	transaction_charged_twice
I think I was double charged	transaction_charged_twice
There are two of the same charges on my account.	transaction_charged_twice
My card was declined but it shows as multiple charges?	transaction_charged_twice
Why was I charged twice for the same thing?	transaction_charged_twice
Looks like my card payment was duplicated after all. I went to pay at the store earlier, got declined once,second time it works. App still stays pending for one of the payments. Can you please remove one of them as it's wrong and was declined?	transaction_charged_twice
I got charged twice	transaction_charged_twice
I was charged twice for the same purchase!	transaction_charged_twice
I went to the store and tried to make a purchase.  The first time, it was declined, but the second one went through.  But my App shows me that I've already been charged once and the second charge is still pending.  Can you make sure that I'm not charged twice?	transaction_charged_twice
Why am I being charged for the same thing twice?	transaction_charged_twice
I have a payment that shows twice	transaction_charged_twice
There is a payment that I was charged two times for.	transaction_charged_twice
I have a transaction showing up multiple times.	transaction_charged_twice
I got charged two times for a transaction	transaction_charged_twice
I was charged more than once in a single transaction	transaction_charged_twice
Hi, I was looking over my card receipts for the past week and I realize I had a charge put through two times for the same single restaurant visit. Can one of the charges be removed so that I can get the money back that was mistakenly taken from my account?	transaction_charged_twice
What happens when I am charged twice?	transaction_charged_twice
I should only have one charge, but it shows two.	transaction_charged_twice
Why are there multiple transactions showing for one purchase?	transaction_charged_twice
Can I use the app without my phone?	lost_or_stolen_phone
I no longer have my phone with the app, what should I do?	lost_or_stolen_phone
Do I need to do anything? My phone was stolen yesterday.	lost_or_stolen_phone
what to do about stolen phone	lost_or_stolen_phone
What should I do if my phone is lost or stolen?	lost_or_stolen_phone
My phone has been lost or stolen	lost_or_stolen_phone
I have lost my phone, what steps can I take to prevent someone using my account?	lost_or_stolen_phone
I left my phone at the hotel I was staying at so I can't use the app!	lost_or_stolen_phone
Everything I have was stolen yesterday making it so I don't have access to the app, what should I do?	lost_or_stolen_phone
lost my phone, what is account security?	lost_or_stolen_phone
How can I stop someone from using my card after I lost it yesterday.	lost_or_stolen_phone
What do I do if my phone is stolen?	lost_or_stolen_phone
phone is gone, what should i do	lost_or_stolen_phone
My phone has been stolen.  How can I make sure no one uses my account from it?	lost_or_stolen_phone
I have lost my phone or it has been stolen.	lost_or_stolen_phone
Someone mugged my and stole everything.  I can't use the app.  What should I do?	lost_or_stolen_phone
My things were stolen and I need to know if I can still use this app.	lost_or_stolen_phone
My phone was stolen! What do I need to do?	lost_or_stolen_phone
Help me.  My phone has been lost or stolen!	lost_or_stolen_phone
Someone has stolen my phone, what should I do?	lost_or_stolen_phone
Can you tell me what i steps i should take since my card was stolen?	lost_or_stolen_phone
I cannot get to my app, what should I do?	lost_or_stolen_phone
I think my phone was stolen. What can I do?	lost_or_stolen_phone
My bag was stolen from me yesterday, so I can't use any apps or anything. I need some help.	lost_or_stolen_phone
What do I do if I cannot access the app?	lost_or_stolen_phone
left my phone at hotel, cant use app	lost_or_stolen_phone
I am not sure where my phone is.	lost_or_stolen_phone
If I lost my phone, how can I stop someone from accessing my account through the app?	lost_or_stolen_phone
Is there anything to do because my phone was stolen?	lost_or_stolen_phone
I just replaced my phone but how do I use my card information?	lost_or_stolen_phone
My phone is missing.	lost_or_stolen_phone
I don't have my cell phone with me so I cannot access the system to complete the transaction.	lost_or_stolen_phone
What do I do if I lost my phone?	lost_or_stolen_phone
my phone was taken yesterday, what should I do about my account?	lost_or_stolen_phone
My phone is at the hotel.  How can I use the app?	lost_or_stolen_phone
Is it possible to access my phone from the hotel/	lost_or_stolen_phone
My app was on the phone and I was mugged.  What do I do?	lost_or_stolen_phone
I can't find my phone; what can I do to prevent someone from accessing my account on it?	lost_or_stolen_phone
My phone was left behind.  Can I still use my card?	lost_or_stolen_phone
I lost my phone and need help so someone doesn't access my account.	lost_or_stolen_phone
I lost my phone and need help protecting it.	lost_or_stolen_phone
I got mugged yesterday and they took everything. I can't use the app, so I need some help.	lost_or_stolen_phone
My phone is missing or stolen.	lost_or_stolen_phone
I forgot my phone at the hotel, so I can't access the app.	lost_or_stolen_phone
My phone is lost I don't want someone to use my account, what can I do?	lost_or_stolen_phone
Can I use your services without access to the app?	lost_or_stolen_phone
Someone has taken my phone from my hotel room!	lost_or_stolen_phone
