text	label
that is accurate	yes
yes, that's right	yes
i vote yes	yes
that appears true	yes
is is very much true	yes
accepted	yes
absolutely correct	yes
yes you are correct	yes
that's true	yes
yup, that's true	yes
true, most definitely	yes
exactly right	yes
confirmed	yes
oh yes	yes
it's true	yes
that checks out	yes
that would be true	yes
yes, that's what i want	yes
the answer is yes	yes
yep, that's true	yes
that would be awesome	yes
yes, this is true	yes
that is affirmative	yes
that is true, yes	yes
yes, i'd really like that alot	yes
yes, that is accurate	yes
that seems true	yes
yes	yes
yup	yes
it's indeed true	yes
the statement is true	yes
yes, please	yes
yeap	yes
ya	yes
of course	yes
the answer to that is a resounding yes	yes
uh huh	yes
my response to that is yes	yes
i'm telling you this is a true statement	yes
yeah, that's right	yes
correct, that's true	yes
that's correct	yes
i want you to know it's a true statement	yes
yes, that happens to be correct	yes
roger that	yes
that makes sense as well	yes
absolutely!	yes
that's right	yes
please let's do it	yes
i would have to say yes as my answer	yes
that's a definite yes	yes
all right	yes
yes that's correct	yes
you are not wrong about that	yes
yes, that is a fact	yes
that's a yes	yes
yes, that's accurate	yes
yes, that is true for sure	yes
yep, that's right	yes
its a for sure true	yes
yes, that is right	yes
affirmitive	yes
that is correct	yes
agreed, that's valid	yes
positive	yes
that is totally true	yes
very true	yes
yes, you got it	yes
that is a fact	yes
i agree with the truth of what you just said	yes
i can confirm it is affirmative	yes
okay	yes
definitely	yes
that is not false	yes
indeed	yes
true is my response	yes
yes, that's correct	yes
yes, that's confirmed	yes
that would be yes	yes
yes i am	yes
yes, that is factual	yes
yes, that is correct	yes
confirm	yes
uh-huh	yes
yes is my answer	yes
that's a yes from me	yes
yes you are right	yes
i think it's true	yes
yeah that's right, so true	yes
that is a yes	yes
yes that's it	yes
that's definitely true	yes
i agree	yes
that's the truth	yes
i will say yes as my response	yes
you're right	yes
that is right	yes
my answer to your question is yes	yes
yes you are	yes
that will be true	yes
the answer to that is affirmative	yes
affirmative	yes
you are correct	yes
10-4	yes
true	yes
what you just said is true	yes
yes that is correct	yes
i have to say affirmative on that one	yes
yes, that is true	yes
yeah	yes
it is a true	yes
yes, ai, that is correct	yes
sure	yes
i believe that's true	yes
correct	yes
yes i do like that	yes
you got it	yes
that would be correct	yes
approved	yes
yes, that's it	yes
what's the average time it takes for a new card to arrive	replacement_card_duration
how long will it take to get a new card	replacement_card_duration
after losing a credit card, how long does it take to get a new one	replacement_card_duration
when will i received a replacement card	replacement_card_duration
how long should i expect to wait for my replacement credit card	replacement_card_duration
how long before i can get a replacement card	replacement_card_duration
i recently lost my credit card and need to know how long it takes to get a new one mailed to me	replacement_card_duration
how long before my new card is mailed to me	replacement_card_duration
i need to know the time it takes to get a new credit card sent to someone who lost theirs	replacement_card_duration
how long does it take to get a new credit card	replacement_card_duration
time to get replacement credit card for stolen one	replacement_card_duration
what's the time of arrival on my new credit card	replacement_card_duration
my credit card has been stolen and i want to know how long it will be before i can get a new one	replacement_card_duration
a new cards takes how long to mail to me	replacement_card_duration
what is the shipping time for my card	replacement_card_duration
is my card made immedietly after reporting stolen	replacement_card_duration
it takes how long to mail me a new card	replacement_card_duration
what's the eta for a new card to come in the mail	replacement_card_duration
mailing to me for a new card takes how long	replacement_card_duration
what's the transit time on a new card	replacement_card_duration
what is the earliest date i can get my new card	replacement_card_duration
how long does it take to replace a lost card	replacement_card_duration
tell me about today weather	replacement_card_duration
when can i expect my new card	replacement_card_duration
time to order and receive a new credit card	replacement_card_duration
what is the shipping wait for my card	replacement_card_duration
when do they mail me a replacement card	replacement_card_duration
my credit card was stolen; how long before a new one will arrive	replacement_card_duration
tell me the duration it takes to get a new cc	replacement_card_duration
i lost my credit card recently  how long does take to get a new one in the mail	replacement_card_duration
what's the phone number for my credit card company	replacement_card_duration
how long will it take for me to get a new credit card to replace the one that was stolen	replacement_card_duration
how long does it usually take for a new credit card to come	replacement_card_duration
what's the usual time to get a new card when your previous one was lost	replacement_card_duration
when will you mail me a replacement card	replacement_card_duration
do when you when my replacement card will get mailed	replacement_card_duration
show tracking information on my replacement credit card	replacement_card_duration
how long will a new card take to come in the mail	replacement_card_duration
when will i get my replacement card	replacement_card_duration
how much time does it take a new card to get mailed to me	replacement_card_duration
when does the replacement card arrive	replacement_card_duration
when can i expect my new card to get here	replacement_card_duration
when will my new card come in the mail	replacement_card_duration
how long until i get a replacement card	replacement_card_duration
my new card will arrive when	replacement_card_duration
how soon will you mail me a new card	replacement_card_duration
how long it takes to get a new replacement card	replacement_card_duration
how long until you send me a replacement card	replacement_card_duration
how long to replace a credit card	replacement_card_duration
what's the timeline on replacing a stolen credit card	replacement_card_duration
when will i get my new credit card	replacement_card_duration
what date will my replacement card arrive on	replacement_card_duration
how many days do i have to wait for my card	replacement_card_duration
how many days till i get a new card to replace the stolen one	replacement_card_duration
average time to receive new card	replacement_card_duration
my last card was stolen and i want to know how long until i get my new one	replacement_card_duration
how long does it take a new card to arrive in the mail to me	replacement_card_duration
how long til my new card arrives by mail	replacement_card_duration
how long will it take before the postal service delivers my new card	replacement_card_duration
will my credit card be mailed soon	replacement_card_duration
my new card will get here in the mail when	replacement_card_duration
what is the length of time it takes a new card to get mailed to me	replacement_card_duration
what is the time frame to get a new card mailed to me	replacement_card_duration
if i lose my credit card, will i get a replacement immediately	replacement_card_duration
how long until i get my replacement card	replacement_card_duration
when will a replacement card get here	replacement_card_duration
how long will it take a new card to come in the mail	replacement_card_duration
when will me new card arrive	replacement_card_duration
how long can i expect to wait for a new card	replacement_card_duration
how long before the replacement card is mailed to me	replacement_card_duration
for anew card to be mailed to me, how long does it take	replacement_card_duration
how long does visa take to get me a new card	replacement_card_duration
when will my card replacement arrive	replacement_card_duration
what is the eta on getting a replacement card	replacement_card_duration
how soon until you send me replacement card	replacement_card_duration
how long will i have to wait until they replace a stolen credit card	replacement_card_duration
how soon will i be sent a new card	replacement_card_duration
when will you send me a replacement card	replacement_card_duration
what is the turn around for a new card	replacement_card_duration
if i ordered a new card, how long til it comes	replacement_card_duration
will i get getting my new card anytime soon	replacement_card_duration
if i need a new card mailed how long will it take	replacement_card_duration
what is the time frame for sending a customer who lost their credit card a new one	replacement_card_duration
is my replacement card coming soon	replacement_card_duration
what is the time frame for receiving a new credit card if my original one gets lost	replacement_card_duration
how soon can i expect a replacement card for my lost card to arrive	replacement_card_duration
my card is coming by mail how long will that take	replacement_card_duration
when can you send me a replacement card	replacement_card_duration
will i have to wait a long time to receive my new credit card after i lost my old one	replacement_card_duration
how long does it take you to mail me a new card	replacement_card_duration
how long will a new card take to reach me	replacement_card_duration
what date will my replacement card get mailed	replacement_card_duration
can i replace a stolen card soon	replacement_card_duration
how soon does it take a card new card to get mailed to me	replacement_card_duration
what's the expected time to have a stolen credit card replaced	replacement_card_duration
let me know the wait on a replacement credit card	replacement_card_duration
what would be the estimated time from to get a new card mailed to me	replacement_card_duration
how many days does it take to receive a new card	replacement_card_duration
how long before my updated cc takes to arrive	replacement_card_duration
how long does it take for a credit card to be reissued and mailed to me	replacement_card_duration
when can i expect my replacement card	replacement_card_duration
when is my new card expected to arrive	replacement_card_duration
when will my replacement card get mailed	replacement_card_duration
how long should i wait to get my new card when my old one was stolen	replacement_card_duration
what is amount of time it takes to get a new credit card i lost mine recently	replacement_card_duration
what date will my card be here	replacement_card_duration
whats the wait time for a replacement card	replacement_card_duration
can credit card companies expedite delivery of reissued credit cards	replacement_card_duration
how long will delivery of a new card take	replacement_card_duration
how long until i can expect my new card to get mailed to me	replacement_card_duration
let me know when the replacement card will arrive	replacement_card_duration
how long is the shipping for my replacement card	replacement_card_duration
will my new credit card be here this week	replacement_card_duration
about how long does it usually take a new card to get mailed to me	replacement_card_duration
what's the typical time it takes for a new card to arrive	replacement_card_duration
my credit card got stolen and i need to know how long it will be before a new on arrives	replacement_card_duration
is it a short time before i receive my new credit card	replacement_card_duration
what is the shipping status of my replacement card	replacement_card_duration
when will i get a replacement card for a lost one	replacement_card_duration
my new card arrives in the post when	replacement_card_duration
certainly not	no
that is incorrect	no
it is very much false	no
that's definitely false	no
you are wrong	no
that’s not correct	no
false	no
i don't like that, no	no
not that one	no
thats a negative	no
what you just said is wrong	no
no, don't do that	no
no, that information is wrong	no
not that	no
i am afraid that that is not the case	no
that is not true, it's false	no
no, that is my response	no
false for sure	no
it seems not	no
that is the wrong answer	no
no, that is wrong	no
no that's wrong	no
that would be false	no
invalid	no
absolutely not	no
that's completely false	no
i do not think that is true, so i would say it is a false statement	no
that's not what i want!	no
the answer is false	no
i would prefer not	no
that's not right	no
that's not correct	no
not at all	no
no, that is not correct	no
that's wrong	no
i would say that the statement is definitely false	no
that’s incorrect	no
no, that's incorrect	no
that is overwhelmingly false	no
"""that would be """"no"""	no
that is erroneous	no
i do not think that is proper	no
that is most definitely false	no
no, that is a falsehood	no
the answer is definitely no	no
hell nah	no
nope not it	no
no, that is inaccurate	no
i don't believe that is possible, it is false	no
no, that can't be right	no
not happening	no
no!	no
no way!	no
that is wrong	no
that is false	no
i gotta say no	no
no don't do that!	no
i think it is false	no
not right now	no
no thanks	no
not true	no
no, that's not right	no
negative	no
i think not	no
naw	no
that's a negative	no
that's incorrect	no
no that isn't the case	no
sorry, that is not true	no
that turns out to be false	no
i meant no	no
no that is wrong	no
that is not the case	no
that is so false	no
the answer is no	no
that'd be a no	no
no good	no
there is no way in heck that is true	no
no, that is not right at all	no
it is false	no
i don't think so	no
that's incorrect!	no
definitely not	no
no is the answer	no
that is not correct	no
i disagree that is false	no
that's a negatory	no
oh hell no, that'd be terrible!	no
nope that's not it	no
incorrect, it is certainly a false statement	no
i am saying no	no
negatory	no
that's false	no
that's a hard no from me	no
i believe that to be false	no
no that isn't correct	no
nada	no
no that is not right	no
that isn't right	no
not really	no
i do not believe that that is correct	no
no, that is not right	no
that is not factual	no
i think that's false	no
that is untrue	no
the statement is false	no
no that isn't it	no
that's totally wrong!	no
that is a completely false statement	no
no, that's wrong	no
i'll pass	no
that's not right, so no	no
negative for sure	no
i would have to say the answer to that is no	no
that has to be false	no
it's a no	no
i must say no	no
no, that is incorrect	no
that is not right	no
ill pass	no
has there been any changes in the status of my credit card application	application_status
when will my credit card app be approved	application_status
i want to know if my application for a credit card at community bank has been approved or not	application_status
has my application for a trust bank credit card been mailed out and if so was i approved or not	application_status
did they process the credit card i applied for	application_status
can you check if my mastercard application has been reviewed yet	application_status
where can i find out the status of my credit card application	application_status
when can i hear the decision on my credit card application	application_status
what is the status of my new credit card application	application_status
i want to know the status of my credit card application	application_status
did my visa card app go through yet	application_status
how far has my application for the hsbc card gone till now	application_status
have i received any messages about my credit card application	application_status
what status is my card application in	application_status
please check the status of my mastercard application	application_status
i want to be updated on the most recent status of my credit card application	application_status
what is the status of my credit card application	application_status
can you please let me know the status of my capital one application	application_status
tell me if my application has been processed yet, i signed up for a credit card recently	application_status
look into the status of the credit card application i submitted recently for my new card	application_status
has my visa card application been approved yet	application_status
my credit card application status	application_status
has my application for american express gone through yet	application_status
can you tell me the credit card application status	application_status
what is the status of my credit card application looking like	application_status
how will i know when my application for a credit card has been processed	application_status
do you know if my amex card app went through	application_status
at what point will the review of my credit card application be completed	application_status
can you check if my credit card application has been processed	application_status
when will i know if my visa card application was approved	application_status
how far has my application for the hsbc card proceeded till now	application_status
do i have any updates about my credit card application	application_status
what exactly is the status of my application for the credit card	application_status
check the status of my credit card application please	application_status
how is my application on new credit card going	application_status
what is the status of my application for the credit card	application_status
how is the status of my credit card application coming along	application_status
is there any indication my application for a new credit card has been processed	application_status
i want to know if my credit card application has been processed yet	application_status
is my application processed for credit card	application_status
i would like to know if my visa card application has been approved	application_status
can you let me know the status of my discover credit card application status	application_status
i want to know if my credit card application has been processed	application_status
i put in a credit card application, so what is the status with it currently	application_status
look to see if my application for the barclay's card has gone through yet	application_status
is the processing done on my new credit card	application_status
could you check and see if my credit card application has been processed and approved or not	application_status
i want an update on my application for a credit card that i sent in a couple weeks ago	application_status
did the application i put in for a mastercard go through yet	application_status
has anyone looked at my mastercard application	application_status
has my credit card application been processed yet	application_status
has the discover card approved my app	application_status
can you tell me if my application for a credit card has been processed yet it was at chase bank	application_status
find out for me if my amex card application was received	application_status
how can i track the progress of my credit card application	application_status
when will my application for my credit card be processed	application_status
has my amex application gone through yet	application_status
please look into the latest status of my credit card application	application_status
has my mastercard application gone through the process	application_status
check on my credit card application	application_status
did discover get my card application yet	application_status
when will my credit card application be reviewed	application_status
go to the credit card site and check if my application has gone through	application_status
can you let me know if my visa card has been approved	application_status
can you check on the status of my credit card application	application_status
is it likely my credit card application has processed yet	application_status
help with credit card application status	application_status
check the status of my credit card application for me	application_status
i applied for a visa card; did that go through	application_status
has my card application successfully gone through	application_status
what is the status of the application for a credit card i put in	application_status
my credit card application has what status	application_status
in what status is my credit card application	application_status
will i be notified when my application has been processed	application_status
i'm desperate to know about my cc processing	application_status
let me know about the status of my credit card application	application_status
tell me a little more about the status of my credit card application	application_status
can you find out if my application at smith bank was approved or not  i applied for s credit card a month ago	application_status
i want to know how is my credit card application going	application_status
i would like an update on the progress of my credit card application	application_status
what is the present status of my credit card application	application_status
have they looked over my app for the new credit card yet	application_status
what's the status on my application for the hsbc credit card	application_status
see if my form submission for an american express card has been seen	application_status
how far along is my credit card application	application_status
i filed a credit card application so what is going on with it	application_status
how long to process my credit card application	application_status
can you check and see if my credit card application has been approved or not	application_status
i haven't heard if my application for a credit card has been accepted or not can you check on it for me	application_status
tell me the status of my credit card application	application_status
has my credit card application been approved yet	application_status
what is the current status of my credit card application	application_status
tell me about my american express application; did it go through	application_status
do you know what the latest is with my credit card application	application_status
do you know if anyone's even looked at the application i sent in for the new visa card	application_status
has my application for the hsbc card been approved yet	application_status
is my credit card application approved	application_status
in what status is my credit card application currently in	application_status
i need to know what the latest is with my application for a visa credit card	application_status
has my application for a new credit card been processed	application_status
can you please tell me about the status of my credit card application	application_status
pull up my credit card application's current status	application_status
when will my cc application process	application_status
has my application for discover card gone through yet	application_status
have i gotten confirmation for my credit card app	application_status
please get me an update on the status of my credit card application	application_status
where can i go to see if my credit card application has been processed	application_status
has my credit card application gone through	application_status
please let me know how my credit card application is going	application_status
let me know the credit card application status	application_status
has my application for the mastercard card gone through	application_status
have you heard anything back on my cc application	application_status
i would like to know the status of my credit card application	application_status
has my credit card application been received, or what is its current status	application_status
has my mastercard application gone through yet	application_status
tell me straight if it has been processed or not	application_status
tell me the present status of the credit card application i submitted	application_status
did the application for my visa card finish	application_status
has my credit card application processed yet	application_status
please let me know if my discover card application has been approved	application_status
how long should i fry an egg for	cook_time
how long do i need to cook pot au feu for	cook_time
about how long should you cook lasagna	cook_time
how long does it take to prepare a lasagna	cook_time
how long do i cook chicken breast	cook_time
how long does it take to make pho	cook_time
when can i expect meal of salmon to be finished	cook_time
how long do i cook steak	cook_time
how long do the brownies have to cook	cook_time
how long do i boil eggs	cook_time
how long to cook a frozen pizza	cook_time
how long does it take to prepare pot roast	cook_time
how long should i cook country fried potatoes for	cook_time
so how long do you think the chicken will take	cook_time
how long does pizza take	cook_time
should i cook this for a long time	cook_time
tell me how long i will need to spend preparing a meat loaf dish	cook_time
i want to cook a lasagna please tell me how long it will take	cook_time
how long do i need to cook lasagne for	cook_time
how long does it take to make shrimp scampi	cook_time
how long does a roast take	cook_time
what is the prep time for a 10 lb turkey	cook_time
how long do you need to bake chicken for it to be safe to eat	cook_time
how long does pizza take to cook	cook_time
how long do i need to cook beef stew for	cook_time
look up recipe time for this	cook_time
about how long should you cook a 10 pound turkey	cook_time
how long should i cook a ny steak	cook_time
