text	label
decrease the speed of your speech please	change_speed
how do i change the speed of my ai's voice	change_speed
talk fast	change_speed
can you slow down	change_speed
could you speak a little faster, please	change_speed
speed your speech up	change_speed
which ingredients does gumbo have	ingredients_list
what do you use when you make a chef's salad	ingredients_list
give me a list of ingredients for making pasta	ingredients_list
what do i need to make chicken salad	ingredients_list
let me know what ingredients i need to make pasta	ingredients_list
what ingredients are in cheese cake	ingredients_list
what do i need to make chicken noodle casserole	ingredients_list
what ingredients do i need to make pizza	ingredients_list
what do you purchase to put in a shepherd's pie	ingredients_list
tell me the ingredients to make an apple pie	ingredients_list
what is gumbo made of	ingredients_list
for peppercorn steak, what ingredients do i need	ingredients_list
whare the ingredients for the stir fry	ingredients_list
i want to cook a quick breakfast what ingredients do i need	ingredients_list
what ingredients do i need for shrimp scampi	ingredients_list
which ingredients are in pizza	ingredients_list
what ingredients do i need to make broccoli cheddar soup	ingredients_list
show me the recipe for broccoli cheddar soup	ingredients_list
what kind of ingredients go into the chicken a la king	ingredients_list
what ingredients are in coffee cakes	ingredients_list
what ingredients do i use for pork belly	ingredients_list
what is needed to make lasagna	ingredients_list
what do you i need to make pizza dough	ingredients_list
find list of ingredients i would need to bake a funnel cake	ingredients_list
what ingredients are required for chicken noodle soup	ingredients_list
pull up everything i need to make a pasta dish	ingredients_list
please give me a list of the ingredients contained in chocolate cupcakes	ingredients_list
what do i need to make authentic kimchi	ingredients_list
what are all of the ingredients for brownies from scratch	ingredients_list
what do i need to make a cake	ingredients_list
what ingredients do i need for tacos	ingredients_list
what do i need to use to make lasagna	ingredients_list
give me a list of ingredients needed for pizza dough	ingredients_list
for pasta primavera, what ingredients will i use	ingredients_list
what ingredients are in chips	ingredients_list
tell me all the things i need to buy to make pasta	ingredients_list
what ingredients go in pizza	ingredients_list
what ingredients are present in marshmallows	ingredients_list
what ingredients are needed for shrimp cocktail	ingredients_list
what are the ingredients used in chicken curry	ingredients_list
what ingredients are in beef jerkey	ingredients_list
can you tell me what ingredients are needed for cinnamon buns	ingredients_list
what ingredients do i need to bake a cake	ingredients_list
in terms of making scrambled eggs, what ingredients do i need	ingredients_list
what does subway use to make a cold cut combo	ingredients_list
what are the ingredients in gumbo	ingredients_list
what ingredients are in sushi	ingredients_list
tell me the ingredients for making tom yum	ingredients_list
give me a recipe for tacos	ingredients_list
what ingredients are in spinach dip	ingredients_list
what ingredients are necessary for a steak	ingredients_list
what do i need to make brownies	ingredients_list
what are the ingredients to make shepherd's pie	ingredients_list
what kind of stuff is in potato salad	ingredients_list
what ingredients are in tacos	ingredients_list
i'll use what ingredients for lasagna	ingredients_list
what ingredients are necessary to make spaghetti carbonara	ingredients_list
what do i need to buy to make pierogi	ingredients_list
please search for necessary ingredients included in meatballs	ingredients_list
i need what ingredients for meatloaf	ingredients_list
what's a good recipe foe tacos	ingredients_list
what ingredients go in a milky way	ingredients_list
what do you mix to make a chocolate cake	ingredients_list
what do you need to make pancakes	ingredients_list
what do i need if i want to make lasagna	ingredients_list
pizza has which ingredients	ingredients_list
what do i need to cook chicken soup	ingredients_list
what ingredients are in filet mignon	ingredients_list
what would i need if i wanted to make chicken marsala	ingredients_list
what ingredients do i need to make raisin bread	ingredients_list
what is the ingredient list for an omelette	ingredients_list
what goes into chicken noodle casserole	ingredients_list
what does it take to make buttermilk pancakes	ingredients_list
what ingredients do i need to make egg salad	ingredients_list
what ingredients are in mashed potatoes	ingredients_list
what ingredients do i need to make salmon salad	ingredients_list
what am i gonna need for sushi	ingredients_list
the ingredients in pizza are which ones	ingredients_list
what ingredients are needed to make lasgana	ingredients_list
tell me the ingredients in pizza	ingredients_list
what do i need to make pasta	ingredients_list
ingredients needed to make a mexican lasagna	ingredients_list
list the ingredients in pizza	ingredients_list
what are the ingredients of spaghetti	ingredients_list
how much flour do i need for a strawberry cake	ingredients_list
what ingredients are found in hunan chicken	ingredients_list
what ingredients are in dough	ingredients_list
do you know the ingredients used in homemade chicken soup	ingredients_list
what do i need to get to make lasagne	ingredients_list
please list ingredients for broccoli cheddar soup	ingredients_list
what ingredients do i need to make pancakes	ingredients_list
tell me what ingredients i need for carne asada	ingredients_list
what ingredients do you need to make lasagna	ingredients_list
what ingredients are in sugar cookies	ingredients_list
what ingredients do i need to make spaghetti	ingredients_list
i am making broccoli cheddar soup, what ingredients do i need	ingredients_list
what ingredients do i need for gumbo	ingredients_list
what ingredients go in potato skins	ingredients_list
what do you put in chicken noodle casserole	ingredients_list
what do i need to buy for spaghetti	ingredients_list
the ingredients in pizza are what	ingredients_list
i’m making spaghetti what ingredients do i need	ingredients_list
tell me what ingredients i will need to make this meal	ingredients_list
how can i make my own doughnuts/what ingredients	ingredients_list
what should i get to make the jamaican patties	ingredients_list
what ingredients does agor agor need	ingredients_list
i need a list of ingredients required to make lamb stew	ingredients_list
what ingredients go in mashed potato	ingredients_list
can you tell me the ingredients used in pasta sauce	ingredients_list
what stuff would i need to make tortellini	ingredients_list
what do i need to make a cajun chili	ingredients_list
what goes into a strawberry smoothie	ingredients_list
what do you need to make general tsao's chicken	ingredients_list
what do i need to make macaroni	ingredients_list
what should i grab to make a german chocolate cake	ingredients_list
what ingredients do i need for philly cheesesteaks	ingredients_list
what do you need to make dandelion wine properly	ingredients_list
what food do you need to make lasagna	ingredients_list
i need to know what ingredients are in a french baguette	ingredients_list
i want to make a meat stew what ingredients do i need	ingredients_list
thanks, bye	goodbye
it is time to say goodbye	goodbye
talk to you soon, bye!	goodbye
signing off	goodbye
great talk, thanks	goodbye
nice to speak with you	goodbye
this was a nice conversation	goodbye
thank you for chatting with me, bye	goodbye
thank you goodbye	goodbye
it was nice to talk it out with you	goodbye
good bye	goodbye
syonara, ai device!	goodbye
a pleasure as always to speak with you, bye	goodbye
this was a nice chat, goodbye	goodbye
peace	goodbye
sayonara	goodbye
bye bye!	goodbye
later, thanks for chatting	goodbye
see ya later	goodbye
good speaking to you	goodbye
this was a nice chat	goodbye
have a good one	goodbye
i have to get going	goodbye
this was fun, see you around bye	goodbye
see you around	goodbye
regards	goodbye
buhbye	goodbye
thanks for chatting, later	goodbye
that will be all have a nice day!	goodbye
adios	goodbye
i enjoyed our talk, goodbye	goodbye
it was nice to get in touch	goodbye
it was pleasant conversing with you	goodbye
it was a pleasure talking to you, goodbye now	goodbye
it was pleasant having a conversation with you	goodbye
until next time!	goodbye
tata for now	goodbye
ai goodbye	goodbye
goodbye, helpful ai device!	goodbye
i enjoyed our talk, bye	goodbye
goodbye for now ai	goodbye
thanks for talking to me	goodbye
this was a great conversation	goodbye
it was nice chatting with you	goodbye
i'm out of here	goodbye
it was nice to chat	goodbye
always nice to talk to you	goodbye
it was enjoyable talking with you	goodbye
goodbye	goodbye
it was great chatting with you	goodbye
i'm glad i got to talk to you	goodbye
i have to go ai goodbye	goodbye
it was great talking to you	goodbye
see you in a while	goodbye
bye	goodbye
glad we got to talk	goodbye
goodbye to you	goodbye
talk later	goodbye
it was nice to speak with you	goodbye
it was great to see you again, see ya later!	goodbye
thanks for your help, goodbye!	goodbye
nice to see you	goodbye
see you later!	goodbye
see you again soon	goodbye
bye for now	goodbye
bye-bye	goodbye
i enjoyed speaking with you	goodbye
good night	goodbye
i am glad we got to talk again, see you soon	goodbye
i enjoyed talking to you, bye	goodbye
i enjoyed talking to you	goodbye
fairwell	goodbye
thank you for the chat, goodbye	goodbye
it was lovely to speak with you	goodbye
nice to see you again	goodbye
it was very good to talk to you	goodbye
bye now	goodbye
i'm saying goodbye now	goodbye
nice seeing you bye	goodbye
cya later	goodbye
i had fun speaking with you	goodbye
great talk, take it easy	goodbye
it was really nice to be able to chat with you	goodbye
that's all i need, i'm going now	goodbye
tootles	goodbye
i'm outta here!	goodbye
talk to you later	goodbye
it was great to speak with you	goodbye
adios ai	goodbye
see you soon	goodbye
i've got to run now	goodbye
i need to go now	goodbye
adios!	goodbye
farewell!	goodbye
have a good day, bye	goodbye
i have to say goodbye	goodbye
goodnight	goodbye
good bye my friend	goodbye
goodbye!	goodbye
i'll talk to you later ai	goodbye
catch you later	goodbye
i must say goodbye	goodbye
bye!	goodbye
later gator!	goodbye
it was really awesome to talk to you	goodbye
it was good to talk to you today	goodbye
have a good day	goodbye
nice talking again, bye	goodbye
catch you around	goodbye
peace out	goodbye
take it easy!	goodbye
it was a pleasure talking to you	goodbye
ok good chatting goodbye	goodbye
it was nice to catch up with you	goodbye
enjoy your day, goodbye	goodbye
until next time	goodbye
i’m leaving-goodbye!	goodbye
i’ll be leaving now	goodbye
see you later, alligator	goodbye
it was great to have this conversation with you	goodbye
what are some good southern bbq restaurants in nashville	restaurant_suggestion
can you suggest some quality chinese restaurants in oklahoma city	restaurant_suggestion
name a good restaurant near me	restaurant_suggestion
i need reviews for places serving tacos in chicago	restaurant_suggestion
could you suggest a french restaurant, please	restaurant_suggestion
please find me some good thai restaurants in new york city	restaurant_suggestion
where should i go for food tonight	restaurant_suggestion
suggest a restaurant for me to eat tonight, please	restaurant_suggestion
in boston, what are the best pizza places	restaurant_suggestion
give me a list of places that serve the best wings in charlotte	restaurant_suggestion
i need to know what restaurants are near me	restaurant_suggestion
i want sushi, is there any good place in ho chi minh	restaurant_suggestion
help me find a good sushi spot in chicago	restaurant_suggestion
i want to eat mediterranean fare with at least four stars, near me	restaurant_suggestion
i feel like going out for sushi tonight who in the area serves good sushi	restaurant_suggestion
could you locate me some good places in kentucky that serve sushi	restaurant_suggestion
suggest some restaurants	restaurant_suggestion
are there any decent places to get seafood in seattle	restaurant_suggestion
what are some good places in kentucky that serve sushi	restaurant_suggestion
what are some good mexican restaurants in indianapolis	restaurant_suggestion
show me some restaurants that have high reviews for eating out	restaurant_suggestion
its date night and we cant decide where to go help	restaurant_suggestion
tell me some good mexican restaurants in dallas	restaurant_suggestion
i want to go out to eat but have no idea where to go, do you know of any places	restaurant_suggestion
help me pick a nice restaurant to dine at	restaurant_suggestion
are there some good thai restaurants in san antonio	restaurant_suggestion
can you list off 4 star restaurants	restaurant_suggestion
what are the best italian restaurants in chicago	restaurant_suggestion
any good pizza restaurants around here	restaurant_suggestion
where do people go to eat in this town	restaurant_suggestion
what's a highly rated place for steak in omaha	restaurant_suggestion
are there decent seafood restaurants in portland	restaurant_suggestion
i need some suggestions for dinner places tonight	restaurant_suggestion
i need a list of good places to eat near me	restaurant_suggestion
where can i go to eat	restaurant_suggestion
give me some restaurant suggestions	restaurant_suggestion
where should i eat	restaurant_suggestion
do you know of any good mexican restaurants in seattle	restaurant_suggestion
what are some good ethiopian restaurants in queens	restaurant_suggestion
can you suggest a restaurant for me to eat tonight	restaurant_suggestion
where can i get some good food	restaurant_suggestion
are there are any good places in washington that serve cheese pizza	restaurant_suggestion
can you find a good steakhouse for tonight	restaurant_suggestion
are there any good places in cleveland that serve clams	restaurant_suggestion
do you know any good restaurants good for kids	restaurant_suggestion
give me some good restaurants	restaurant_suggestion
what are good places for a burrito in albuquerque	restaurant_suggestion
please list nearby restaurants with 4 or more star reviews	restaurant_suggestion
what are the best restaurants	restaurant_suggestion
does cleveland have any good places that serve clams	restaurant_suggestion
what are the best places to get shrimp in chicago	restaurant_suggestion
can you recommend a decent place in chicago to get pizza	restaurant_suggestion
can you find any good places in cleveland that serve clams	restaurant_suggestion
what's your recommendation for dining out tonight	restaurant_suggestion
where do you want to eat tonight	restaurant_suggestion
can you suggest a thai restaurant, please	restaurant_suggestion
what's a good place to eat chinese in san francisco	restaurant_suggestion
what are some good sushi restaurants in reno	restaurant_suggestion
can you list off different restaurants	restaurant_suggestion
where is your favorite restaurant to eat	restaurant_suggestion
i am hungry and need a restaurant suggestion	restaurant_suggestion
list a few pizza places that have seating near my current location	restaurant_suggestion
are there any vegan restaurants in my town	restaurant_suggestion
could you direct me to any good places in kentucky that serve sushi	restaurant_suggestion
find an indian restaurant	restaurant_suggestion
where should i go to eat tonight	restaurant_suggestion
does kentucky have any good restaurants that serve sushi	restaurant_suggestion
find me a new place for dinner	restaurant_suggestion
are there any sushi restaurants in reno that have good reviews	restaurant_suggestion
where can i pick up a good burger near where i am	restaurant_suggestion
any fantastic restaurants to get shrimp at in atlanta	restaurant_suggestion
can you recommend an indian restaurant	restaurant_suggestion
in cleveland, are there any good places that serve clams	restaurant_suggestion
do you have any restaurant recommendations	restaurant_suggestion
what are the best sushi restaurants in reno	restaurant_suggestion
what's the food can easily get in canada	restaurant_suggestion
can you tell me the best place for cajun shrimp in tampa	restaurant_suggestion
any ideas on a good place to eat out	restaurant_suggestion
can you recommend any restaurants	restaurant_suggestion
what type of restaurants are nearby	restaurant_suggestion
do you know of any good restaurants	restaurant_suggestion
is there any good place for vietnamese food on the east side of the island	restaurant_suggestion
what are some good itialian restaurants in north salem	restaurant_suggestion
recommendations for good thai restaurants in las vegas	restaurant_suggestion
what restaurants are pet friendly near here	restaurant_suggestion
i'm not going to cook today, can you suggest a restaurant	restaurant_suggestion
is there a barbecue restaurant around here	restaurant_suggestion
give me restaurant reccomendations	restaurant_suggestion
i want you to recommend a good local restaurant to me	restaurant_suggestion
can i get good tacos anywhere in austin	restaurant_suggestion
is there any good place in hawaii for pasta	restaurant_suggestion
are there any good chinese restaurants open right now	restaurant_suggestion
find me an asian restaurant	restaurant_suggestion
what's a good restaurant nearby	restaurant_suggestion
i'm famished so give me some places to eat!	restaurant_suggestion
can you find me a good restaurant to try eating at	restaurant_suggestion
what's the best place for some thai in new york city	restaurant_suggestion
pull up some recommendations for places serving fish in maine	restaurant_suggestion
suggest a few local eateries in mid price range	restaurant_suggestion
i am looking for good southeast asian restaurants in philadelphia	restaurant_suggestion
tell me where to go since i want to eat out tonight	restaurant_suggestion
where should i go for good thai food in las vegas	restaurant_suggestion
where are some good thai restaurants in las vegas	restaurant_suggestion
can you suggest a french restaurant	restaurant_suggestion
where should i go for dinner	restaurant_suggestion
what mexican restaurant within 5 miles has the best reviews	restaurant_suggestion
do you know of any good seafood restaurants in seattle	restaurant_suggestion
i need suggestions for good thai restaurants in las vegas	restaurant_suggestion
is there any good place for mexican food in hawaii	restaurant_suggestion
please give me the name of a few good options for places to eat dinner tonight	restaurant_suggestion
find me a good spot for southern comfort food in los angeles	restaurant_suggestion
are there good clam places in cleveland	restaurant_suggestion
where can i satisfy my craving for french food in milwaukee	restaurant_suggestion
can you search recommended casual restaurants for tonight in philadelphia	restaurant_suggestion
does boise have any good indian restaurants	restaurant_suggestion
list me some good vietnamese restaurants in new york city	restaurant_suggestion
i'm in the mood for italian, are there any good places around	restaurant_suggestion
any new restaurants near the mall	restaurant_suggestion
tell me which restaurants are good for thai food in las vegas	restaurant_suggestion
i'm craving for italian food, where should i go	restaurant_suggestion
can you show me transactions related to utilities	transactions
let me know the list of transaction on my first hawaiian bank	transactions
show me the transaction on mcdonald	transactions
i need to know last months transactions	transactions
i need to know the transactions i made on the 10th	transactions
show my my most recent visa card transaction	transactions
show my transaction statement	transactions
show me my transactions within the past week	transactions
let me check my transaction for first bank card	transactions
what was my recent transaction	transactions
looking at january, show all wine purchases	transactions
what were my purchases on visa card last month	transactions
can you show me the transactions that were made last night at the restaurant	transactions
when was my most recent transaction	transactions
please tell me all of my recent transactions	transactions
what transactions did i make yesterday at the flea market	transactions
what have i spent things on	transactions
show what i have spent things on	transactions
what were my last five transactions on my visa card	transactions
before i pay my capital one, what are the most recent transactions i've made	transactions
on the card can you give me the last transactions	transactions
show me yesterday's last transaction	transactions
what did i spend at target on my barclays card last month	transactions
i would like to hear all transactions made on my amex for the last ten days	transactions
show me last transaction	transactions
show me all gas purchases within the last month	transactions
what transactions have i made on liquor in the past month	transactions
how many paypal transactions did i have last week	transactions
what transactions have i made in the last few weeks	transactions
show me transactions related to travel	transactions
please review my recent visa card transaction	transactions
state recent transaction	transactions
please let me review all items on my mastercard from this billing period	transactions
what transactions do i have on my visa from the last 4 weeks	transactions
show me the transaction on burger king	transactions
where can i find my recent transaction history	transactions
tell me the most recent charges on my chase credit card before i pay the bill	transactions
show me my transactions on mcdonalds	transactions
what withdrawals were there on my account yesterday	transactions
please tell me all the purchases on my hy-vee card for this statement period	transactions
please show me my recent transaction	transactions
list all purchases of video games	transactions
my transaction history	transactions
is my visa bill over my limit this month	transactions
can you verify my recent visa card transaction	transactions
i need to know all my spending transactions	transactions
can i get my transactions for the date of the 23rd	transactions
what were my last 10 charges on my credit card	transactions
how much have i spent on my bank card sine i last paid my bill	transactions
show me the transactions from costco yesterday	transactions
before i pay my walmart credit card did i make any purchases using it recently	transactions
what was the amount that i spent on fidelity visa last month	transactions
i need some information on a recent transaction	transactions
what transactions did i put on my visa last month	transactions
i want to know what my recent transaction was	transactions
show me my ten most recent transactions on account xyz	transactions
may transactions for last 2 days	transactions
show me my recent transactoin	transactions
what did i buy last	transactions
bring up my most recent purchases	transactions
show me the transaction on the food	transactions
i'd like to see last week's atm transactions	transactions
how much was my last target trip	transactions
help me get access to my recent transaction history	transactions
please tell me all the transactions i've made recently	transactions
how much have i spent on my debit card this month	transactions
what was my recent transaction on my visa card	transactions
show me my recent transactions from account xyz	transactions
pull up my grocery transactions	transactions
let me see the list of tranaction on my discovery credit card	transactions
please tell me this month's transactions on my visa	transactions
get me access to a list of my recent transactions	transactions
what is the largest transaction i have made on video games this month	transactions
may i get all of the food transactions that were made last month	transactions
what was the last thing i purchased	transactions
please tell me my in-person transactions for the last three days using my debit card	transactions
how much money have i spent on restaurants	transactions
i want to see all transactions in the past month for all accounts	transactions
i made a transaction recently	transactions
how much did i spend on my most recent transaction	transactions
what is the last transaction on my visa card	transactions
what items do i have on my amex card this month	transactions
are you able to find my recent transactions for me	transactions
when did i last make a purchase	transactions
what transactions do i have on groceries from yesterday	transactions
show me my transactions on groceries	transactions
can you let me know my latest transactions	transactions
what's the last transaction i made yesterday	transactions
list me my recent transaction	transactions
i would like to take a look at my transaction history	transactions
let me check my transaction on my citi card	transactions
what are the last ten transactions i've made	transactions
i want to see transactions from this month	transactions
read off to me the last five transactions i've made	transactions
how many transactions do i have on flower shops from last wednesday between 2pm and 7pm	transactions
can i see my transactions on the 7th	transactions
can i see my transactions from yesterday	transactions
show me all new transactions	transactions
