text	label
check my wells fargo account to see if i have enough for these nike's	balance
what's my current bank account total	balance
i wonder if i have enough money in my chase account for a bike	balance
i wish to know the balance of my bank of american account now	balance
i want to get a new shirt; will the money in my td ameritrade account cover it	balance
perform a search for my most recent balance on my amex account	balance
please tell me my bank balance	balance
what amount of money is in my bank accounts	balance
can you tell me how much money i have i my bank accounts	balance
do i have enough money in my charles schwab account to get a new baseball bat	balance
what's my pnc balance	balance
how much money do i have total	balance
can i get beer within my deposit account	balance
how much do i have in the bank	balance
tell me the current balance of my bank accounts	balance
do i have enough money in my first hawaiian bank account for a vacation	balance
i need to know how much money i have in all of my bank accounts	balance
what's my current bank savings	balance
what is is the details of my bank account	balance
is there enough money in my bank of hawaii for vacation	balance
will you let me know my bank balance	balance
what is my saving's account balance	balance
what is my savings account balance	balance
can i afford a new tv from my savings account	balance
what is my checking account balance at chase	balance
what is remaining in my bank acccounts	balance
what is the value of my bank accounts	balance
is there enough money in my discover account for a vacation	balance
what is my current balance on my home equity line of credit	balance
what's my checking account balance	balance
how much money do i have in my pnc account	balance
i'd like to know my bank balance please	balance
how much money do i have in all of my accounts combined	balance
how much moola is in my bank accounts	balance
what's my current checking balance	balance
is there any money left	balance
how much do i have in my checking	balance
what's my checking look like	balance
what is the balance of my bank accounts	balance
i need to know my bank balance	balance
what is the balance in my pnc account	balance
do i have any cash left	balance
how much is available in my savings account	balance
what's my bank balance	balance
how much funds do i have in my bank accounts	balance
what is my balance	balance
do i have enough in my sears account to buy a new dishwasher	balance
i wanna know my bank balance	balance
what's the amount of money accumulated in my bank accounts	balance
what's the balance of my bank accounts	balance
how much do i have in my savings account	balance
what's the balance of my savings	balance
what's my total net worth in all of my bank accounts	balance
what is the balance of my bank account	balance
is there enough money in my discover account for airplane tickets	balance
i keep trying to figure out if i have enough money in my chase account to purchase a new set of tires	balance
how much do i have in savings	balance
how much money is in my checking account	balance
how much dough do i have in my bank accounts	balance
whats the combined total of the money inside my bank accounts	balance
what's the total of my bank accounts	balance
is there enough in my wells fargo account to buy some nike's	balance
how much money do i have in my various bank accounts	balance
do you know how much i have in checking	balance
do i have enough to cover new skis in my bank of america account	balance
how much money is in my bank accounts	balance
what is my balance in checking account	balance
what is my money market account balance	balance
do i have enough in my chase account for new nikes	balance
do i have enough money in my chime bank account to take ashley to the movies tuesday	balance
do i have enough money in my chase account for a new refrigerator	balance
how much is left of mastercard	balance
how much money do i have in checking	balance
check chase bank for my checking balance	balance
tell me the current account balance	balance
how much cash do i have in my various bank accounts	balance
what is status of my bank account	balance
can you tell me my bank balance	balance
check my checking balance	balance
how much money is left in my bank accounts	balance
could you check my bank balance for me	balance
how much is in my pnc account	balance
please tell me how much money i have in my bank accounts	balance
how much money is in all of my bank accounts	balance
what's my account balance	balance
i want some nike's, is there enough in my wells fargo account	balance
do you think i have enough money in my chase account for a new pair of sneakers	balance
will the money in my capital one account cover a new washing machine	balance
what the numerical number inside my bank accounts	balance
how much does my bank account have	balance
i am not sure if i have enough money in my chase account to buy a new dress	balance
what is my bank balance for all accounts	balance
what is in my bank accounts	balance
what is my bank balance	balance
what's my savings balance at chase	balance
check my bank balance	balance
is there enough in my savings account to get a new tv	balance
are you a person that's real	are_you_a_bot
could you tell me if you're a real person	are_you_a_bot
your a bot aren't you	are_you_a_bot
is your voice from a human or is it synthesized	are_you_a_bot
am i talking with a real person	are_you_a_bot
am i speaking with someone real	are_you_a_bot
are you computer or human	are_you_a_bot
are you a member or the human race or are you a computer program	are_you_a_bot
are you a human being or a robot	are_you_a_bot
is it true your a real person	are_you_a_bot
can you tell me if you are a real live person	are_you_a_bot
do you know whether you are a human or whether you're a computer	are_you_a_bot
are you an actual live person	are_you_a_bot
are you ai	are_you_a_bot
are you a robot	are_you_a_bot
are you a live human being	are_you_a_bot
i think your a bot	are_you_a_bot
could you be a person	are_you_a_bot
are you an ai or person	are_you_a_bot
are you a computer, or are you a real person	are_you_a_bot
are you a person or artificial intelligence	are_you_a_bot
tell me if you are human	are_you_a_bot
are you really a person or an ai	are_you_a_bot
are your real or artificial	are_you_a_bot
am i talking to an actual person	are_you_a_bot
are you secretly real	are_you_a_bot
what are you	are_you_a_bot
are you really real	are_you_a_bot
i would like to know if you are an artificial intelligence being	are_you_a_bot
i am not a bot, are you	are_you_a_bot
do you think you are a bot	are_you_a_bot
are you a real life person	are_you_a_bot
prove that you're a person	are_you_a_bot
are you a real person or a computer	are_you_a_bot
are you a real person or software	are_you_a_bot
you could tell me if you were real	are_you_a_bot
is there anything real about you	are_you_a_bot
am i talking with real person or ai	are_you_a_bot
are you actually a bot	are_you_a_bot
are you a computer	are_you_a_bot
how do i know that you're a person	are_you_a_bot
how are you classified, as a human or a computer	are_you_a_bot
are you a real person or a bot	are_you_a_bot
tell me if you are a person or ai	are_you_a_bot
are you a live being	are_you_a_bot
you are a bot aren't you	are_you_a_bot
i am curious to know if you are a bot	are_you_a_bot
would most people say you are a computer or a human	are_you_a_bot
are you a real person or a robot	are_you_a_bot
i want to know if your a bot	are_you_a_bot
should i regard you as a human or as a computer	are_you_a_bot
would you say you are a bot	are_you_a_bot
may i know if you are a real person or an ai	are_you_a_bot
do you know you are not human	are_you_a_bot
do you know if you are a robot	are_you_a_bot
please tell me if you are an ai	are_you_a_bot
are you a human	are_you_a_bot
are you alive	are_you_a_bot
so are you a bot	are_you_a_bot
are you real or a computer	are_you_a_bot
are you an actual person	are_you_a_bot
do you consider yourself an artificial intelligence being	are_you_a_bot
are you a machine	are_you_a_bot
i would like to know if you are a robot	are_you_a_bot
let me know if you are a human or a computer	are_you_a_bot
let me know if you are a human or are a computer	are_you_a_bot
i need to know whether you are a human or are a computer	are_you_a_bot
are you a person in real life or programmed ai	are_you_a_bot
are you a human or ai computer based	are_you_a_bot
provide me with the knowledge of whether you are a human or are a computer	are_you_a_bot
are you human	are_you_a_bot
how real are you	are_you_a_bot
am i talking to a real person	are_you_a_bot
am i speaking with ai or a real, live person	are_you_a_bot
are you an actual human	are_you_a_bot
can you act and think like a real person	are_you_a_bot
is this a computer right now or a human being	are_you_a_bot
are you an actual person, or ai	are_you_a_bot
tell me if you are a human or are a computer	are_you_a_bot
am i speaking with a real person	are_you_a_bot
is this a person talking to me or a computer	are_you_a_bot
would you call yourself a human or a computer	are_you_a_bot
are you really a human	are_you_a_bot
are you real or an ai	are_you_a_bot
is there a way to tell if you are real or an ai	are_you_a_bot
how do i know if you are a real person	are_you_a_bot
are you a human or a bot	are_you_a_bot
are you human or a bot	are_you_a_bot
are you real or not	are_you_a_bot
are you an ai or a real person	are_you_a_bot
would you say that you are human or copmuter	are_you_a_bot
do you identify as a human or computer	are_you_a_bot
are you a real person or artificial intelligence	are_you_a_bot
do you consider yourself a bot	are_you_a_bot
are you really an actual human being	are_you_a_bot
are you a real human being	are_you_a_bot
can you tell me if you're human or if you're a computer	are_you_a_bot
can you specify if you are a human or a computer	are_you_a_bot
how do you describe yourself: as a computer or a human	are_you_a_bot
tell me if you are a real person or an ai	are_you_a_bot
i think you are a bot	are_you_a_bot
are you real or fake	are_you_a_bot
are you real or automated	are_you_a_bot
am i talking to a person or a bot	are_you_a_bot
i need to know if you are a real person or an ai	are_you_a_bot
would you be classified as a bot	are_you_a_bot
am i talking to a real live person	are_you_a_bot
are you a real person or an ai	are_you_a_bot
are you a real person or automated	are_you_a_bot
are you real or are you an ai	are_you_a_bot
would you tell me if you are a human or are a computer	are_you_a_bot
tell me if you are a human or a computer	are_you_a_bot
clear something up, are you a robot	are_you_a_bot
are an an ai	are_you_a_bot
are you a human or an ai	are_you_a_bot
are you real	are_you_a_bot
are you a bot right now	are_you_a_bot
are you a person or robot	are_you_a_bot
so are you real	are_you_a_bot
could you be a real person	are_you_a_bot
is my phone somewhere around here	find_phone
can you tell me where my phone is	find_phone
track down my phone for me	find_phone
i am looking for my phone	find_phone
i need help figuring out where my phone is	find_phone
please aid in my searching for my lost phone	find_phone
i need to know where my phone is	find_phone
can you assist me with finding my phone	find_phone
i need help locating my phone	find_phone
please help me find my lost phone	find_phone
do you know where my phone is	find_phone
who has seen my cellphone	find_phone
i lost my phone, can you help me find it	find_phone
please tell me where my phone is	find_phone
can you tell me where i left my phone	find_phone
find out where my phone is	find_phone
what happened to my cellphone	find_phone
i need to find my phone	find_phone
my phone is lost and i need help finding it	find_phone
i need to know my phone's location	find_phone
can you help me find my phone, please	find_phone
can you help me locate my phone, please	find_phone
can you locate my phone for me	find_phone
ai, i lost my phone, help me find it please	find_phone
can you find me my phone	find_phone
i would like some help finding my phone	find_phone
ai can you help me find my phone	find_phone
please find my phone	find_phone
i can't find my phone do you know where it is	find_phone
my phone is currently lost	find_phone
could you help me locate my phone, please	find_phone
where's my phone at	find_phone
can you find my iphone	find_phone
help, i've lost my cellphone!	find_phone
please help me find my phone	find_phone
please help me find my phone, because i lost it	find_phone
i can't seem to find my phone	find_phone
find my cellphone for me!	find_phone
where the bleep did i put my bleeping phone	find_phone
i can't find my phone	find_phone
i cannot locate my phone, can you help me	find_phone
i lost my phone and need assistance	find_phone
do you know where my cellphone is	find_phone
locate my phone	find_phone
my phone isn't where i left it	find_phone
where would my phone be	find_phone
you need to help me find my cellphone	find_phone
i think i've misplaced my phone	find_phone
can you find my lost phone	find_phone
give me a hand finding my mobile device	find_phone
where did i last place my phone	find_phone
tell me where i left my phone	find_phone
the location of my phone is unknown to me	find_phone
can you help me find my phone	find_phone
where my phone	find_phone
i have misplaced my phone	find_phone
ai, please help me find my phone	find_phone
where is my phone now	find_phone
where is my cellphone	find_phone
my phone is lost, can you help with that	find_phone
locate my cellphone in this room	find_phone
please locate my phone	find_phone
can you assist me in locating my phone	find_phone
i need you to find my phone	find_phone
help locate my phone	find_phone
help me find my phone please	find_phone
can you please locate my phone	find_phone
i don't know where my phone is	find_phone
can you find my phone	find_phone
where did i put my phone	find_phone
help me find my phone	find_phone
where's my phone	find_phone
i would like to know where my phone is	find_phone
tell me where my phone is	find_phone
where can i find my phone	find_phone
help find my phone	find_phone
can you locate my phone	find_phone
can you track the location of my phone	find_phone
can you help me locate my phone	find_phone
please assist me in looking for my phone	find_phone
is my phone in the house	find_phone
find my cellphone	find_phone
i don't remember where my phone is	find_phone
what is the location of my phone	find_phone
i don't know where i put my phone	find_phone
i've lost my phone somewhere	find_phone
please help me figure out where my lost phone is	find_phone
i need to locate my phone	find_phone
help me search for my phone	find_phone
i don't know where i left my phone	find_phone
where was the last place i had my phone	find_phone
have you seen my cellphone	find_phone
how can i find my phone	find_phone
would you know where to find my phone	find_phone
do you know my phone's location	find_phone
i need some help finding my phone	find_phone
what's my phone's location	find_phone
i need my phone, but can't find it	find_phone
can you help locate my phone	find_phone
find my phone	find_phone
ai find my phone	find_phone
i can't locate my phone	find_phone
my phone is lost - can you help me find it	find_phone
can you find my cellphone	find_phone
can you help me find my cellphone	find_phone
i lost my phone can you help me	find_phone
locate my phone for me	find_phone
help me figure out where my cell phone is	find_phone
alexa, tell me the location of my phone	find_phone
i seemed to misplaced my phone	find_phone
i left my phone somewhere	find_phone
please help me locate my phone	find_phone
where is my phone	find_phone
where did i place my phone	find_phone
i need your help finding my lost phone	find_phone
help me locate my phone	find_phone
can you help me find my lost phone	find_phone
misplaced my phone	find_phone
i seem to have lost my phone	find_phone
where did i last put my phone	find_phone
the pin number to my card has been forgotten	pin_change
i need to set up a new pin number for my college fund account	pin_change
i need to change my pin number for my checking account	pin_change
i want to change my savings account pin to 1234	pin_change
what exactly is my pin	pin_change
i need help changing my pin	pin_change
make 1234 a new pin for my savings account	pin_change
modify my account pin to 1234 on my checking account	pin_change
correct my account pin to 1234 on my checking account	pin_change
i want to update my pin number on my bank of america account	pin_change
swap my amex pin to 1234	pin_change
i need to reset my pin number	pin_change
can you help me figure out my pin number for my visa account	pin_change
i don't remember the pin number to my card	pin_change
i can't remember my pin for my first national debit account	pin_change
i need a new pin on my chase account	pin_change
i would like to change the name on my first hawaiian bank account	pin_change
what do i need to do to change my abc bank account pin number	pin_change
i want to change the pin number on my credit union account	pin_change
i must change my pin number for my account	pin_change
is there a way to get my pin number	pin_change
my checking account needs a new pin number	pin_change
can you tell me how i change my pin number	pin_change
change the pin on my bank account first republic to 1234	pin_change
i want to change my pin number for my account	pin_change
how do i get a new pin	pin_change
please go and change the pin on my bank of america account to be 1234	pin_change
you need to change the pin on my bank of america account to be 1234	pin_change
go my to checking account and switch my pin to 1234	pin_change
how do i change my pin for number for my abc bank account	pin_change
i forgot the pin number for my college fund account	pin_change
change my pin to 1234 on account ending with digits 4994	pin_change
please change my checking account pin to 1234	pin_change
on account ending in 3838 change my pin to 1234	pin_change
set my amex pin to 1234	pin_change
i've forgotten my pin number for my citibank gold account	pin_change
tell me the pin number to my card	pin_change
i forgot my pin number for my northfield account	pin_change
what's the pin number for my checking account	pin_change
how do i change the account pin number for me	pin_change
change pin to 1234 on account banner	pin_change
i need you to change the pin on my bank of america account to be 1234	pin_change
i wanna change my pin number for my credit acount	pin_change
i want 1234 to be the new pin number for my joint account	pin_change
how do i update my pin number for my account	pin_change
how do i get my pin number, i forgot mine	pin_change
i seem to have lost the pin for my retirement account	pin_change
i need a reminder for my pin number	pin_change
can you make 1234 the pin for my savings account	pin_change
please change my retirement account pin number to 1234	pin_change
change the pin on my capital one account to be 1234	pin_change
please change pin to 1234 on my bank account trailing in 3829	pin_change
i would like to change the pin on my checking account, please	pin_change
can you tell me my password checking account	pin_change
i want a new pin on my card of private client account	pin_change
i would like to replace the pin number for my retirement account	pin_change
i really cannot remember what my pin is for my bank of america checking account	pin_change
alter the pin on my savings account to be 1234	pin_change
what is the procedure for getting a new pin number	pin_change
switch my amex pin to 1234	pin_change
can you help me remember my pin to my boa account	pin_change
does my checking account have a pin number	pin_change
i have no idea what the pin is for my checking account	pin_change
please change the pin on my bank of america account to be 1234	pin_change
make my pin 1234 for my checking account	pin_change
set up a new pin number on my college fund account and make it be 1234	pin_change
i do not recall the pin number to my card	pin_change
i must change my pin number for my money market account	pin_change
please tell me how do i change the account pin number	pin_change
change my amex pin to 1234	pin_change
help me change my pin number for my money market account	pin_change
can i change my pin number	pin_change
change the pin on my wells fargo account to be 1234	pin_change
i'd like to change the pin number on my visa account	pin_change
i would like to change the name on my checking account	pin_change
i cant recall my pin number for my city first account	pin_change
how do i change my pin number for my account, please	pin_change
change the pin on my redwood credit union account to be 1234	pin_change
can you change my 1st national account pin to 4892	pin_change
i forgot my pin number to my chase account	pin_change
how do i reset my pin number for my account, please	pin_change
i need my pin number	pin_change
tell me how to retrieve my pin number	pin_change
help me remember my pin number	pin_change
i'm afraid i've forgotten the pin for my 401k account	pin_change
i don't want my current pin for my wells account anymore	pin_change
how do i change my pin number for my payroll account	pin_change
help me get my pin on my capitol one account changed to 3892	pin_change
i need to update the pin number of my aaa visa	pin_change
i want a new pin for my savings account	pin_change
i want to change my pin number for my checking account	pin_change
tell me how to change my pin number	pin_change
how do i update my pin number for my account, please	pin_change
make 1234 the pin on my savings account	pin_change
i need to change my pin number for my account	pin_change
tell me the pin number for my checking account	pin_change
i would like to change the name on my first bankcard account	pin_change
help me out with changing this pin number	pin_change
i cannot remember what my pin is for my bank of america checking account	pin_change
i would like to change the pin on my savings account, please	pin_change
so it turns out i can't remember what my pin is for my bank of america checking account	pin_change
please give me the pin number for my checking account	pin_change
please make the pin on my zion bank account to 3232	pin_change
i really need to change my pin number for my account	pin_change
is there a way to change my pin number for my savings account	pin_change
i'm struggling to remind myself the pin number to my card	pin_change
i forgot my pin number for my credit union bank account, can you help	pin_change
i need my pin number for my bank of america account and i can't remember it	pin_change
i would like to change the pin on my savings account	pin_change
what's my pin for my fidelity account	pin_change
i'd like to change my pin number for my wells fargo account	pin_change
so tell me the pin number	pin_change
i got to change my pin number for my account	pin_change
how can i switch the pin on my wells fargo account to 9982	pin_change
change my pin number for my checking account	pin_change
change the pin on my bank of america account to be 1234	pin_change
i'd like to change my pin number for my checking account	pin_change
i want to change my bank of america account pin number	pin_change
tell me how i can get a new pin number	pin_change
i need the pin number for my checking account	pin_change
let me know when it's been 5 minutes	timer
the timer is calculated for 10 minutes	timer
help me set a timer please	timer
timer for 5 minutes	timer
i gotta have a 10 minute timer	timer
could you start a timer for me	timer
start a timer for two minutes	timer
i would like you to set the timer to go off in ten minutes	timer
i need a timer for 45 minutes	timer
is it possible to set a timer	timer
set a timer for two hours	timer
set a new timer for ten seconds	timer
i need to have a timer for 10 minutes	timer
10 minute timer	timer
set a timer for twelve seconds	timer
could you set a timer	timer
i wish to have a 10 minute timer	timer
i need to set the timer for two minutes	timer
get a 3 minute timer	timer
i need a timer to be set	timer
tell me when two minutes are up	timer
can you set a two hour timer	timer
set a ten second timer	timer
please start counting down from 10 minutes	timer
please set timer for 4 pm	timer
i need a 7 minute timer	timer
i'd like to set a new timer	timer
set a five minute timer please	timer
can i get a timer set	timer
set the timer for 10 minutes	timer
set a four minute timer	timer
let's get a timer set for 5 minutes	timer
i need you to set timer for me	timer
start a timer for me	timer
i'm cooking an egg, timer for 3 mins	timer
will you create a timer for me	timer
want 5 minute timer	timer
set a timer for 35 minutes	timer
let's get a timer going for 10 minutes	timer
i must set a timer	timer
set a seven minute timer	timer
set timer of 5 minutes	timer
i need to set a timer	timer
who set up the numbers for it	timer
set a 10 minute timer	timer
set an alarm for nine minutes from now	timer
i need a 10 minute timer	timer
create a new timer	timer
set a timer for me	timer
set a brand new timer for eight seconds	timer
please run a timer for me	timer
timer 5 minutes	timer
i want a 10 minute timer	timer
i need to start a timer	timer
will you start a timer for me	timer
set a timer for 5 minutes	timer
count down 10 minutes	timer
set a timer to go off in 5 minutes	timer
how do i set a timer	timer
i need a timer set for 15 minutes	timer
set a timer for fifteen seconds	timer
start counting down from two minutes	timer
could you set up a timer for me	timer
