text	label
can you set me up for a reservation for five at outback steakhouse on february 28th at seven pm	restaurant_reservation
what reservations are available for 3 people at the xenophobe	restaurant_reservation
please book a reservation for 8 pm at red robin under the name kevin	restaurant_reservation
are there 8pm tables available at texas roadhouse	restaurant_reservation
i gotta make a reservation for 8 pm at red robin for 3	restaurant_reservation
make a reservation for three at prime rib at 6:30 pm	restaurant_reservation
book room for me and her under the name kendra	restaurant_reservation
please make me a reservation for monty's at noon for 55555	restaurant_reservation
book a reservation for 3 at red lobster under the name steve	restaurant_reservation
can you get me a table for 8 at johnnys	restaurant_reservation
allow me to turn on the lights	restaurant_reservation
can you get a table for 5 at joe's at 5pm	restaurant_reservation
make a reservation for wheeler party of 3 for 5pm at andrea's steakhouse	restaurant_reservation
is it possible to book a room at the taco bell for reavers at 3	restaurant_reservation
can you get me a table for 3 at captain d's at 2pm	restaurant_reservation
i want you to book a reservation for 8 pm at red robin under the name kevin	restaurant_reservation
a table for two needs to be reserved for 7:00pm at olive garden using the name michael	restaurant_reservation
can you get me a table for 4 at red lobster at 8pm	restaurant_reservation
reserve a table for 3 at andrea's steakhouse around 5pm under the name wheeler	restaurant_reservation
can you book a table at the restaurant for me and my husband	restaurant_reservation
can you make a reservation for me at the restaurant	restaurant_reservation
martins needs a table for 5 people at tropicana at 8pm precisely	restaurant_reservation
reserve a table for 6 at morton's under the name jaime at 8:30pm	restaurant_reservation
reserve a table for 4 at red lobster under the name dave at 7:30pm	restaurant_reservation
could you reserve table for 3 at carlos jr under the name adam at 4	restaurant_reservation
can you get me a table for two for 8:00 pm at parc	restaurant_reservation
can you get me a table for 5 at johnnys	restaurant_reservation
i need to book a reservation for 3 at xenophobe under the name zebee	restaurant_reservation
please make a reservation at ruth's steaks for a party of five at 7:00 pm under jack arnold	restaurant_reservation
help me reserve a table for 3 at lucky's under the name crystal at 8 pm	restaurant_reservation
i want to eat at seven in the restaurant for two people	restaurant_reservation
would you please schedule a reservation for 2 at lucky's under the name sam at 7:30pm	restaurant_reservation
please make a reservation for me: party of two, february 22nd at chili's, two in the afternoon	restaurant_reservation
can you reserve a table for 6 at red robin under the name mavrick at 5 clock	restaurant_reservation
can i make a reservation for 2 at state bird for 7:30, please	restaurant_reservation
make a reservation for 2 at red lobster at 8pm	restaurant_reservation
make me a reservation for 5 at coral for 10 pm immediately	restaurant_reservation
i'd like a reservation for 2 at olive garden for 5 pm today	restaurant_reservation
please reserve a table for two at olive garden at 7:00pm for michael	restaurant_reservation
i'd like to set up a reservation for kibble at 4	restaurant_reservation
book a reservation for 4 at outback steakhouse under the name dave	restaurant_reservation
hey computer, make a reservation for 2 for my parents at red lobster on wednseday next, 2:00pm if possible	restaurant_reservation
please make a reservation for 2 at olive garden for 5 pm today	restaurant_reservation
reserve a table for 3 at 7 for olive garden	restaurant_reservation
book a reservation for 8 pm at red robin under the name kevin	restaurant_reservation
reserve a table for 5 at lawry's under the name steve at 8:00pm	restaurant_reservation
make a reservation for 2 tonight at 7:00 at outback steakhouse	restaurant_reservation
at 7, i need a table for 3 at olive garden	restaurant_reservation
ai, please stop your current task	cancel
forget what i told you to do	cancel
stop talking	cancel
ignore the previous command	cancel
stop it	cancel
stop please	cancel
stop processing	cancel
abort please	cancel
this process needs to stop	cancel
abort running program	cancel
cancel that input	cancel
can you cancel that request, please	cancel
could you cancel that request, please	cancel
no more talking	cancel
forget it	cancel
can you cancel	cancel
i need you to stop talking	cancel
i would like you to stop what you were doing	cancel
i don't want you to speak any more for now	cancel
please cancel the last input	cancel
stop	cancel
cancel	cancel
quit	cancel
please abandon the current job	cancel
shhhh	cancel
please stop the current process	cancel
halt the process	cancel
i need you to stop talking now	cancel
undo this process	cancel
can you end the current process	cancel
stop the process	cancel
i advise you to quit talking	cancel
stop, i changed my mind	cancel
actually, cancel that command	cancel
can you end the task	cancel
i want you to stop your present action	cancel
quiet now	cancel
can you be quiet please	cancel
abort	cancel
you can stop talking ai	cancel
please cancel the input	cancel
quit what you are doing	cancel
forget it, i do not need it anymore	cancel
abort mission	cancel
halt that immediately	cancel
please be quiet now	cancel
cancel that	cancel
silence	cancel
please be quiet	cancel
can you cancel it	cancel
be quiet	cancel
please cancel that last task	cancel
scratch	cancel
never mind	cancel
just shut up	cancel
please stop doing that	cancel
refrain from talking	cancel
stop it now!	cancel
i want you to cancel the current action	cancel
eliminate	cancel
please refrain from carrying out the current task	cancel
please stop doing what i asked	cancel
please abort the current process	cancel
actually, cancel that	cancel
sorry, you can actually stop that	cancel
shut up!	cancel
oops cancel that	cancel
whats the procedure to cancel it	cancel
ai, shut up	cancel
i actually don't want this anymore, please abort	cancel
i want you to quit the action	cancel
discontinue please	cancel
please stop talking	cancel
hey ai cancel it now	cancel
ai, stop talking	cancel
abort it	cancel
actually forget that i don't need it	cancel
please cancel that last command	cancel
stop that	cancel
oh shut the hell up would you	cancel
undo	cancel
terminate current process	cancel
stop talking you are annoying	cancel
don't do this process	cancel
that was a mistake, undo that	cancel
can you stop speaking	cancel
forget my previous command	cancel
just stop talking	cancel
what you are doing is not actually helpful, please cancel the action	cancel
can you cancel what you were doing	cancel
mute	cancel
cancel my last request, i know the answer	cancel
stop and go back	cancel
don't continue with what you're doing	cancel
stop working on it, i need something else	cancel
can you switch off	cancel
never mind, cancel that	cancel
can you turn off the process	cancel
stop, just stop	cancel
can you stop	cancel
you need to shut it	cancel
cancel current process	cancel
stop this process	cancel
stop what you're doing	cancel
ai, cancel that last request	cancel
quit the current action please	cancel
pause	cancel
how to cancel	cancel
discontinue your current task	cancel
don't talk anymore	cancel
cancel that last command	cancel
can you cancel that	cancel
stop the process happening now	cancel
please stop it	cancel
that's enough, don't say anymore please	cancel
could you stop please	cancel
could you stop talking for a second	cancel
stop doing that	cancel
cancel action	cancel
never mind, don't do that	cancel
how much have i spent on starbucks since the beginning of 2019	spending_history
how much money have i recently spent on stuff	spending_history
how much have i spent this week	spending_history
have i been spending a lot on take out lately	spending_history
what did i spend at the grocery store yesterday	spending_history
how much money did i spend on food last month	spending_history
how much did i spend on groceries today	spending_history
how much did i spend on grocery shopping recently	spending_history
how much have i spent on groceries recently	spending_history
how much have i spent on shoes	spending_history
please tell me how much i have spent recently	spending_history
how much did i spend on food	spending_history
have i been giving lot of money to food to food lately	spending_history
i have been spending a lot on insurance lately	spending_history
how much money have i recently spent on entertainment	spending_history
how much did i spend on christmas gifts in december	spending_history
can you tell me what i spend on gas for the past two weeks	spending_history
could you tell me how much i've spent over the past two weeks	spending_history
how much have i paid for rent in the last 6 months	spending_history
do i spend too much on beer	spending_history
how much have i paid in medical expenses recently	spending_history
could you check my account and let me know how much i spent on food in january	spending_history
how much have i spent lately on eating out	spending_history
what've i spent on gas this month	spending_history
what is the amount i have spent on food recently	spending_history
where did all my money go this month	spending_history
how much have i been spending on booze this month	spending_history
have i been spending a ton of money on movies lately	spending_history
i need to know my total spending on amazon for november and december 2018	spending_history
how much money have i spent this week	spending_history
what's my going out to eat tab this month vs last month	spending_history
have i been spending excessively on donuts recently	spending_history
i want to know my recent spending	spending_history
could you tell me what kind of money i've recently spent	spending_history
have i gone over my entertainment budget	spending_history
i need to know what i have spent on food recently	spending_history
tell me how much i have been buying as of late	spending_history
would you mind telling me how much i have spent recently on grocery shopping	spending_history
how much did i spend on petrol 2 days ago	spending_history
did i go out to eat more than usual	spending_history
what chunk of my income have i spent on rent this year	spending_history
how much have i spent recently	spending_history
what's the total i've spent on shoes this month	spending_history
what's the amount of money i spent yesterday	spending_history
how much did i spend on gear two weeks ago	spending_history
yesterday what did i spend on lunch	spending_history
how much money have i spent on fast food lately	spending_history
what have i spent lately in child care	spending_history
how much did i spend on shcool due last year	spending_history
can you tell me how much i spent on grocery shopping recently	spending_history
how much did i spend last week	spending_history
how much fast food have i bought recently	spending_history
what is the total i spent on shoes recently	spending_history
how much money have i spent recently	spending_history
let me know the amount i spent on food last month	spending_history
how much money have a spent in the last week	spending_history
i need to know what i spend on utilities for the last year	spending_history
how much money did i spend yesterday	spending_history
did i spend a lot on shoes recently	spending_history
how much money did i spend on tent equipment four hours ago	spending_history
tell me how much i have spent on grocery shopping just now	spending_history
how much have i spent on books recently	spending_history
how much have i spent on shoes recently	spending_history
can you tell me what i have spent on food recently	spending_history
what did i spend on beer last month	spending_history
how much have i spent on clothes recently	spending_history
how much have i spent on eating out recently	spending_history
how much have i spent on alcohol recently	spending_history
what did i spend at bath and body works last month	spending_history
how much have i spent on make up recently	spending_history
what did i spend my money on last week	spending_history
what did car insurance run me this year	spending_history
check how much i spent this week	spending_history
have i spent a lot on food recently	spending_history
what has gas cost me this week	spending_history
would you say i've spent too much money on chips as of late	spending_history
how much did i spend on furniture last week	spending_history
how much money have i spent on groceries recently	spending_history
what have i spent on fast food recently	spending_history
how much did i spend shopping for clothes today	spending_history
what amount did i spend last week	spending_history
how much money did i spend at starbucks in the last week	spending_history
how much did i spend on gas the past month	spending_history
was i spending too much money on doughnuts last week	spending_history
please list my total spending on grocery shopping for the last two months	spending_history
what was the total i spent at home depot last month	spending_history
what is my total spent on dining out for the month of january	spending_history
how much have i spent lately	spending_history
how many dollars have i spent on coffee this month	spending_history
how much did i spend on bills last month	spending_history
tell me how much money i've spent on fast food in the past week	spending_history
would please let me know how much i spent on food in january	spending_history
how much did i spend on movies last week	spending_history
what have my expenditures been at macys	spending_history
i spent a lot on vacations recently	spending_history
have i been spending a lot on groceries lately	spending_history
do i overspend when it comes to fast food	spending_history
what have i spent over the last few days	spending_history
how much have i spent on tires this month	spending_history
how much have i spent on shoes lately	spending_history
how much have i spent lately on food	spending_history
how much have i recently spent	spending_history
have i been spending a lot on alcohol lately	spending_history
could you tell me how much money i spent last week	spending_history
how much money have i spent this month	spending_history
how much did i spend at restaurants last week	spending_history
have i have been spending a lot of money on shoes	spending_history
looking at this week only, have i overspent on hoagies	spending_history
i have been spending a lot on utility bills lately	spending_history
what have i spent on food recently	spending_history
how much did i spend the past 3 days	spending_history
how much have i spent eating out this week	spending_history
i want to know how much i spent last week	spending_history
how much have i spent on food in the past week	spending_history
what did i spend on groceries this month	spending_history
have i been spending a lot on roast beef lately	spending_history
please check and tell me the amount i spent on food last month	spending_history
i have spent a lot on groceries lately	spending_history
did i buy too many donuts recently, like last week	spending_history
how much money did i spent on grocery recently	spending_history
please repeat the last thing	repeat
come again	repeat
will you repeat that, please	repeat
i didn't hear you, can you repeat that louder	repeat
please run that by me again	repeat
please ask me again	repeat
hold on what was that you just said	repeat
would you please ask the question again	repeat
one more time for me please	repeat
i would like you to repeat yourself	repeat
what did you just ask	repeat
one more time please	repeat
would you repeat what you said earlier	repeat
what did you just say	repeat
repeat your last message	repeat
can you say that over	repeat
sorry, i didn't catch that could you say it again	repeat
can you please sat it one more time	repeat
i didn't hear what you said	repeat
say it again	repeat
sorry i missed that	repeat
i did not hear you, please repeat	repeat
please say it again	repeat
i missed what you said, please say it again	repeat
i didn't understand you	repeat
ai please repeat	repeat
repeat please	repeat
would you say it again please	repeat
would you repeat that, please	repeat
i need that repeated	repeat
i want to hear that again	repeat
i would like that repeated	repeat
please repeat what you just said	repeat
could you repeat what you just said again	repeat
i missed that last one, please repeat	repeat
what'd you say	repeat
i want you to repeat that	repeat
i would like you to repeat it	repeat
please say it one more time	repeat
just another time please	repeat
please say that again	repeat
i want that repeated	repeat
what	repeat
repeat the question	repeat
say it one more time please	repeat
what was said	repeat
can you repeat the question again	repeat
pardon, i didn't hear you	repeat
i didn't understand what you just said, can you repeat it	repeat
excuse me	repeat
would you repeat what you just said	repeat
can you please repeat that	repeat
i did not hear you	repeat
could you ask the question again	repeat
can you say what you just said again	repeat
can you ask me that again	repeat
can you please say that again	repeat
what did you ask again	repeat
i didnt hear what you just said, can you say it again	repeat
would you say that again, please	repeat
i'm sorry please repeat the question	repeat
tell me once more	repeat
please repeat what you said	repeat
i need you to please repeat that	repeat
what was that	repeat
ai what was the question	repeat
will you please repeat what you said	repeat
what question did you just ask me	repeat
just one more time	repeat
please repeat	repeat
can you repeat what you said	repeat
what were you just saying	repeat
can you say again	repeat
ai i didn't hear you	repeat
repeat what you just said	repeat
i didn't catch that say it again	repeat
please repeat that phrase	repeat
can you say that again, please	repeat
i need you to repeat that, please	repeat
repeat that please	repeat
can you phrase that question again	repeat
come again with that	repeat
i need that said again	repeat
i need to know again	repeat
repeat that for me	repeat
what did you just mention	repeat
i did not understand say it again	repeat
i didn't get that, please repeat	repeat
may you please say that again	repeat
can you repeat that question	repeat
i missed what you said, can you say it again	repeat
i must have you repeat that	repeat
i'm sorry, i didn't understand what you said	repeat
could you say that again	repeat
can you repeat yourself	repeat
can you repeat that	repeat
may you repeat what you said again	repeat
could you repeat that	repeat
could that be repeated	repeat
sorry, i didn't hear you, can you say that gain	repeat
could you repeat that, please	repeat
i didn't hear you please repeat	repeat
repeat what you just told me	repeat
i want to have that repeated for me	repeat
can you please repeat that response	repeat
i didn't catch that so please repeat it	repeat
replay what you just said	repeat
i didn't hear say it again please	repeat
i need for you to ask the question again	repeat
can you tell me what you just said	repeat
can i get you to say that once more	repeat
i did not quite hear you, can you say it again	repeat
say again please	repeat
say it again please	repeat
i need you to repeat that please	repeat
repeat that last response	repeat
i didn't hear, please say it again	repeat
please repeat over what you said	repeat
i didnt understand what you just said, can you say it again	repeat
say it one more time	repeat
i think there has been a fraud on my black visa card, can i report it	report_fraud
there's been some fraudulent activity on my card	report_fraud
i want to report fraudulent activity on my visa	report_fraud
i think there's a fraudulent transaction on my account	report_fraud
i want to report fraudulent activity on my navy federal card	report_fraud
help me tell visa about fraud on my account	report_fraud
it looks like someone made an unauthorized amazon purchase on my account	report_fraud
help! i'm a victim of credit card fraud!	report_fraud
i think i made a fraudulent transaction	report_fraud
there has been fraudulent activity on my card and i need to report it	report_fraud
i don't remember buying this	report_fraud
i may have a fraudulent transaction	report_fraud
i think i've been the victim of fraud	report_fraud
i have a false charge on my account from mcdonald's	report_fraud
help me figure out where this fraudulent transaction from google came from on my account	report_fraud
i'm afraid there is a false transaction on my account	report_fraud
i believe there are fraudulent charges on my card how can i report them	report_fraud
there are some questionable charges on my card	report_fraud
where do i report fraud on my credit card	report_fraud
i have some charges on my account from old navy that aren't mine	report_fraud
i gotta report fraudulent activity on my credit card	report_fraud
i think i have fraud on my account from walmart	report_fraud
i made a fraudulent transaction	report_fraud
i have transactions on my card that aren't mine	report_fraud
i seem to have a purchase that i didn't make from olive garden on my account	report_fraud
there is a fraudulent charge for paypal on my bank account	report_fraud
i think my chase account has been compromised and fraud committed	report_fraud
i believe there's fraud on my card	report_fraud
i need to report fraudulent activity on my usaa card	report_fraud
someone misused my card and put fraudulent transactions on it	report_fraud
"""""""i need to report fraudulent activity to my card company"""	report_fraud
i'm reporting fraudelent activity on my card	report_fraud
an unauthorized transactions has been made on my gap card and i need to report it	report_fraud
can you report credit card fraud for me	report_fraud
i see a purchase on my chase checking that i did not make	report_fraud
my online bill has some items that i didn't purchase from penneys	report_fraud
report fraudulent activity on my debit card	report_fraud
who do i contact to report fraud on my visa	report_fraud
my card has purchases i don't recognize	report_fraud
i want to report fraudulent activity on my visa card, please	report_fraud
this charge is bs	report_fraud
there is an unauthorized transaction on my bank of america checking	report_fraud
i want to report fraud on my american express	report_fraud
i need to report a fraudulent transaction from postmates on my account	report_fraud
send information about suspicious credit card activity	report_fraud
looks like someone made an unauthorized charge to nike on my account	report_fraud
i want to report fraudulent activity on my amex card	report_fraud
i need to talk to someone about a transaction that was not made by me on my chase account	report_fraud
report fraud on my card	report_fraud
i have a fraudulent transaction from red robin on my account	report_fraud
there's fraudulent transaction going on	report_fraud
i think a thief used my card	report_fraud
i have activity on my bank of america card i don't recognize	report_fraud
i must report fraudulent activity on my debit	report_fraud
i have detected fraudulent activity on my account	report_fraud
i have a fraudulent transaction from wal mart on my account right now	report_fraud
i have a bogus transaction from amazon on my account	report_fraud
looks like my card is being used by someone else, report it	report_fraud
i need to report unauthorized activity on my card	report_fraud
i think someone made an illegal charge to my card	report_fraud
i want to report fraudulent activity on my card	report_fraud
i need to report fraudulent activity on my mastercard	report_fraud
is there anyway, i can report a suspicious activity on my citi card	report_fraud
"""""""please contact my credit card company to report fraudulent activity on"""	report_fraud
i suspect some suspicious activity	report_fraud
i have a fraudulent transaction from fry's on my account	report_fraud
send fraudulent activity information	report_fraud
i think the charge for uber on my account is fraudulent	report_fraud
i want to report fraudulent activity on my visa card	report_fraud
i see a suspicious transaction in my account history	report_fraud
i want to report fraudulent activity on my quicksilver card	report_fraud
i'm afraid this charge on my account is fraud	report_fraud
i'd like to report a fraudulent charge from people's natural gas	report_fraud
i think there's fraud on my account	report_fraud
i think there's a fraudulent charge from mcdonald's on my account	report_fraud
my account has a fraudulent transaction i think	report_fraud
i need to report fraudulent activity on my visa card, please	report_fraud
how do i report fraud on my chase bank card	report_fraud
i have to report fraudulent activity the bank of america card	report_fraud
i would like to report a fraud on my wells fargo card, please	report_fraud
please report information about activity on my credit card	report_fraud
how do i tell mastercard about a fraudulent charge	report_fraud
contact the bank about fraud activity on my card	report_fraud
i need to report some fraudulent card activity	report_fraud
what steps do i take if there is a transaction that i do not recognize on my navy federal credit union account	report_fraud
there's a messed up transaction on my account from mcdonald's	report_fraud
so i made a fraudulent transaction	report_fraud
